video_id,title,publishedAt,channelId,channelTitle,categoryId,trending_date,tags,view_count,likes,dislikes,comment_count,thumbnail_link,comments_disabled,ratings_disabled,description
"9LSBvO41nMo","Live Q&A: Emergency Declaration in DC Approved by Trump; First Time Trump & Pence Speak Since Jan 6?","2021-01-12T04:46:11Z","UCG8yy4W8nBbTle9YSpCqXeg","Crossroads with JOSHUA PHILIPP","24","21.14.01","crossroads epoch times|joshua philipp epoch times|china news|crossroads|news|joshua philipp|中國|china|epoch time|crossroads with joshua philipp|us china|ccp|epoch times|xi jinping|crossroads joshua philipp|us china relations|2020|Trump|documentary|election|donald trump|the epoch times|CCP virus|live Q&A|Emergency Declaration|DC|Washington|25th Amendment|remove from office|National Guard|House|resolution|Republicans|democrats|protests","447643","36405","416","5313","https://i.ytimg.com/vi/9LSBvO41nMo/default.jpg","False","False","Donald Trump has approved an emergency declaration for Washington, D.C., and up to 15,000 National Guard troops could be deployed on inauguration day amid rumors of armed protests. And after Republicans blocked the House from bringing up a resolution on the 25th Amendment to remove Trump from office, Democrats are have introduced an impeachment resolution. In this live Q&A with Crossroads host Joshua Philipp we'll be discussing these stories and more, and answering questions from the audience.#Trump #WashingtonDC #Pence- - - - - - - - -⭕️  Subscribe to Crossroads: https://www.youtube.com/channel/UCG8yy4W8nBbTle9YSpCqXeg?sub_confirmation=1- - - - - - - - -Watch more on YouTube:• Interviews: https://bit.ly/2WDTjHL• Government and Law: https://ept.ms/36UlS7k• Money and Economy: https://ept.ms/2TpakFg• The Wisdom of Tradition: https://ept.ms/2NrHaRT• Progressivism and Society: https://ept.ms/373Nqac• Constitutional Rights: https://ept.ms/30kK93O• Human Rights: https://ept.ms/3ac3SXR• Religion and Spirituality: https://ept.ms/36W48ID- - - - - - - - -⭕️  Join us on Patreon: https://www.patreon.com/Crossroads_Josh⭕️  Donate to support our work:  https://donorbox.org/crossroadsContact us:  crossroadsjoshua@gmail.comFollow us on Parler: https://parler.com/profile/Crossroads/ Follow us on Twitter: https://twitter.com/crossroads_joshFollow us on Facebook: https://www.facebook.com/Crossroads.JoshFollow us on Gab: https://gab.com/Crossroads_JoshJoin us on Rumble: https://rumble.com/c/Crossroads/Follow us on Instagram: https://www.instagram.com/crossroads.joshua.epochtimes/Hosted by @JoshJPhilipp : https://twitter.com/JoshJPhilipp- - - - - - - - -💎 Sign the Petition to Investigate, Condemn, and Reject the Chinese Communist Party👉 https://rejectccp.com💎 Get real news other media outlets don’t report for only $1: http://ept.ms/JoshuaforEpoch- - - - - - - - -Want to listen to our interviews? Check out our new podcasts! Links below:🔵 iTunes Podcast: https://ept.ms/CrossroadsApplePodcast🔵 Spotify Podcast: https://ept.ms/CrossroadsSpotifyPodcast🔵 Google Podcast: https://ept.ms/CrossroadsGooglePodcast- - - - - - - - -Credits:Getty ImagesMusic:  Audioblocks.com, epidemicsound.comStock Video:  Videoblocks.com-------------------------------------------------© All Rights Reserved."
"rY2xbodmGj8","SNEAKING Into A Movie Theater For 24 HOURS!","2021-01-10T16:00:32Z","UCwIWAbIeu0xI0ReKWOcw3eg","Unspeakable","22","21.14.01","unspeakable|vlog|vlogs|unspeakablegaming|prank|comedy|challenge|laugh|funny|moments|craziest|pranks|crazy|no cursing|no swearing|how to|parody|troll|video|react|family friendly|funniest|adventure|trolling|unspeakable vlogs|real life|life|unspeakable real life|unspeakableplays|movie theater|24 hour|overnight challenge|24 hour challenge|for kids|movie theater prank|24 hours","3208634","77483","3903","8495","https://i.ytimg.com/vi/rY2xbodmGj8/default.jpg","False","False","NEW MERCH! - https://www.unspeakable.com/Follow all of these or I will steal your cookies.INSTAGRAM 1 - http://instagram.com/unspeakableINSTAGRAM 2 - https://www.instagram.com/Unspeakableshop/TIK TOK -  https://vm.tiktok.com/tyG2Rd/TIK TOK 2.0 - https://www.tiktok.com/@unspeakablegameplaysFACEBOOK - https://www.facebook.com/UnspeakableVlogsFACEBOOK 2.0 - https://www.facebook.com/UnspeakableClothingSubscribe to my other channels or I will eat your computer.MINECRAFT - https://www.youtube.com/user/UnspeakableGaming?sub_confirmation=1EPIC GAMES - https://www.youtube.com/channel/UC1n_yB_W-FZCbwajZPcs8Jw?sub_confirmation=1VLOGS - https://www.youtube.com/channel/UCwIWAbIeu0xI0ReKWOcw3eg?sub_confirmation=1VLOGS 2.0 - https://www.youtube.com/channel/UCet_y01v87pE7MPGikjTQQw?sub_confirmation=1NEW MERCH - https://www.youtube.com/channel/UCBUOxKtRd79qLwkLTPsFCUA?sub_confirmation=1THE NOOB - https://www.youtube.com/channel/UCA1LBqaJbeRPyjL3LmHjwqQ?sub_confirmation=1Thanks for watching! Likes are greatly appreciated! Subscribe to be notified when my next video is live!"
"RUudbt7iUu8","Passengers Cheer As Trump Supporters Kicked Off Plane After Capitol Riot","2021-01-12T02:24:28Z","UCV3Nm3T-XAgVhKH9jT0ViRg","AJ+","25","21.14.01","News|AJ+|AJPlus|Al Jazeera|AJ|AJ plus|capitol riot|insurrection|trump supporters|trump supporters flight ban|dc capitol riot","399396","9584","654","3110","https://i.ytimg.com/vi/RUudbt7iUu8/default.jpg","False","False","Some of the Trump supporters who took part in the riot at the Capitol have been kicked off of their flights. The largest flight attendant union called for the rioters to be banned from flights, and the chairman of the House Homeland Security Committee called for the rioters to be added to the no-fly list. The “No Fly For Terrorists Act” says U.S. citizens and residents can only be stopped from flying by the DHS if they’ve been convicted of federal terrorism charges. Over 120 people connected to the attack on the Capitol have been arrested, but only around 25 domestic terror cases have been opened since the attack.Subscribe for more videos: https://ajplus.co/subscribe Sign up for subtext, our newsletter about the people and movements driving change in our society: https://ajplus.co/ekdv4Follow us on Instagram: https://www.instagram.com/ajplus/Like us on Facebook: https://www.facebook.com/ajplusenglishFollow us on Twitter: https://twitter.com/ajplus"
"Bm2We_p5Mzo","SIDEMEN BIG FAT QUIZ OF THE YEAR 2020","2020-12-27T18:01:25Z","UCDogdKl7t7NHzQ95aEwkdMw","Sidemen","24","21.14.01","sidemen|sidemen sunday|#sidemensunday|quiz|big fat quiz|2020","6880133","331111","4546","13921","https://i.ytimg.com/vi/Bm2We_p5Mzo/default.jpg","False","False","A SIDEMEN QUIZ BASED ON THE YEAR 2020👉🏻 Subscribe to our 2nd Channel: https://www.youtube.com/MoreSidemen 👈🏻👕: Sidemen Clothing: http://www.sidemenclothing.com📸: Sidemen Instagram: http://www.instagram.com/Sidemen🐤: Sidemen Twitter: http://www.twitter.com/Sidemen✏️: SUBMIT A #SidemenSunday IDEA HEREhttps://forms.gle/JDuGrSzM4F6mdo6D9-----------------------------------------------------------------------------------------------------------------------▶️ SIDEMEN ◀️🔴 SIMON (Miniminter)● http://www.youtube.com/Miniminter● http://www.youtube.com/MM7Games● http://www.instagram.com/Miniminter● http://www.twitter.com/Miniminter🔵 JOSH (Zerkaa)● http://www.youtube.com/Zerkaa● http://www.youtube.com/ZerkaaPlays● http://www.instagram.com/Zerkaa● http://www.twitter.com/ZerkaaHD🔴 ETHAN (Behzinga)● http://www.youtube.com/Behzinga● http://www.youtube.com/Beh2inga● http://www.instagram.com/Behzingagram● http://www.twitter.com/Behzinga🔵 VIK (Vikkstar123)● http://www.youtube.com/Vikkstar123● http://www.youtube.com/Vikkstar123HD● http://www.youtube.com/VikkstarPlays● http://www.instagram.com/Vikkstagram● http://www.twitter.com/Vikkstar123🔴 TOBI (Tobjizzle)● http://www.youtube.com/TBJZL● http://www.youtube.com/Editingaming● http://www.instagram.com/Tobjizzle● http://www.twitter.com/Tobjizzle🔵 JJ (KSI)● http://www.youtube.com/KSI● http://www.youtube.com/KSIOlajidebtHD● http://www.instagram.com/KSI● http://www.twitter.com/KSIOlajidebt🔴 HARRY (W2S)● http://www.youtube.com/W2S● http://www.youtube.com/W2SPlays● http://www.instagram.com/Wroetoshaw● http://www.twitter.com/Wroetoshaw"
"_bqzwsM6eoQ","Why does Russia have the best maps of Britain?","2021-01-11T16:00:01Z","UCbbQalJ4OaC0oQ0AqRaOJ9g","Jay Foreman","23","21.14.01","Russia|Map Men|Jay Foreman|Mark Cooper-Jones|Soviet Union|spies|secret maps|Polish|Polish map of England|Red Atlas|How the Soviet Union Secretly Mapped the World|Skillshare|jayforeman|mapmen","665065","57281","529","3163","https://i.ytimg.com/vi/_bqzwsM6eoQ/default.jpg","False","False","The first 1,000 people to use this link will get a free trial of Skillshare Premium Membership: http://skl.sh/mapmen01211Huge thanks to John Davies and Alexander J Kent, authors of 'The Red Atlas: How the Soviet Union Secretly Mapped the World'. You can view images of Soviet maps and purchase reprints at https://redatlasbook.comBUY MAP MEN MUGS, T-SHIRTS, POSTERS ETC...http://www.mapmenmerch.comSEE NEW EPISODES EARLY, AND BEHIND-THE-SCENES EXTRAS...http://www.patreon.com/jayforemanWritten, presented and edited byJAY FOREMAN https://www.twitter.com/jayforemanMARK COOPER-JONES https://www.twitter.com/markcooperjonesAD, Camera, Props and CostumesJADE NAGI https://www.twitter.com/jade_nagi"
"lFsumKiRVRs","Mom Says Girls Can't Play Video Games ft SSSniperWolf","2020-12-19T19:42:02Z","UCpB959t8iPrxQWj7G6n0ctQ","SSSniperWolf","20","21.14.01","sssniperwolf|sniper wolf|reacting|reaction|funny","18621461","615838","16772","87856","https://i.ytimg.com/vi/lFsumKiRVRs/default.jpg","False","False","Mom Says Girls Can't Play Video Games ft SSSniperWolf! Leave a Like if you enjoyed! Watch the last vid https://youtu.be/ZORZh2ySHtw Subscribe to SSSniperWolf to join the Wolf Pack http://bit.ly/SubSSSniperWolf Check out Dhar Mann https://www.youtube.com/c/DharMannOfficialTikTok: http://tiktok.com/@sssniperwolfInstagram: http://instagram.com/sssniperwolfTwitter: http://www.twitter.com/sssniperwolfFacebook: https://www.facebook.com/sssniperwolfOfficial Merch: https://ogwolfpack.com/"
"_TMkW6Y5Q98","Making a 6BT & @Hughes Performance  4L80E fit into a Nissan Patrol - Cummins Patrol EP7","2021-01-12T21:58:35Z","UCFUBt5_cGJpt58XBIh4RtNA","The Skid Factory","2","21.14.01","woody|al|turbo|yoda|tsf|the|skid|factory|Mighty|Car|Mods|Bennys|Custom|Works|Freedom|ECU|Tool|Pro|haltech|GFB|Nissan|Patrol|4x4|4wd|4x4247|gu|gq|y60|y61|y62|td42|zd30|tb45|tb42|tb48|turbocharged|det|cummins|6bt|isb|24 valve|p pump|400hp|300hp|lift kit|body lift|suspension|articulation|welding|fabrication|custom|engine|mounts|CEM|Custom engineering & Mechanical|Hughes|Performance|4l80E|TH400|Built|Transmisson|tow|vehicle|tourer|touring|travel|camping|adventure|four wheel drive","95324","5852","29","530","https://i.ytimg.com/vi/_TMkW6Y5Q98/default.jpg","False","False","Support us on Patreon: http://www.patreon.com/theskidfactoryBuy merch here: https://www.theskidfactory.comToday on The Skid Factory, AL & Woody Fabricate some engine mounts to fit the 24 valve Cummins into the Y61 Nissan Patrol Chassis. Without the body fitted it makes it a bit harder to know where the engine should be sitting in relation to the firewall so the boys take a guess and refit the body.Luckily the patrol firewall is malleable as it required some persuasion to allow the rear injector line to fit. @Hughes Performance are the experts when it comes to transmissions whether it be for your 4x4, street car or drag car. For enquires feel free to contact one of their team members. http://www.hughesperformance.comCheckout their Youtube channel for Tech info and more! https://www.youtube.com/user/HughesPerformanceIf you like what you see then Share it with your friends and don't forget to subscribe and hit the bell for Weekly episodes!For updates keep your eye on The Skid Factory (TSF) here:https://www.instagram.com/woodrigos/?hl=enhttps://www.instagram.com/theskidfactory/?hl=enhttps://www.facebook.com/TheSkidFactory/https://www.instagram.com/turboyodatsf/?hl=enhttps://www.facebook.com/theturboyoda/Please note: We like to make interesting car mods and show you how we've gone about it, but we can't promise that anything we show you will work for your particular car, or that you won't harm yourself, someone else, your car or your warranty doing it. Please be safe, be responsible and unless you know what you're doing, do not fool around with very serious machinery just because you've seen us make it look so easy."
"vvvMb1cY0EU","Radio Hosts During the Commercial - Key & Peele","2021-01-11T21:00:30Z","UCdN4aXTrHAtfgbVG9HjBmxQ","Key & Peele","23","21.14.01","Key & Peele|Key and Peele|Jordan Peele|Keegan-Michael Key|keey & peele|Key & Peele full episodes|key and peele show|kay and peele|radio hosts|radio|radio commercial|sketch comedy|funny|funny video|comedy videos|funny jokes|funny clips","1222422","58887","660","1614","https://i.ytimg.com/vi/vvvMb1cY0EU/default.jpg","False","False","These radio hosts are pretty different on and off the mic.About Key & Peele: Key & Peele showcases the fearless wit of stars Keegan-Michael Key and Jordan Peele as the duo takes on everything from Gremlins 2 to systemic racism. With an array of sketches as wide-reaching as they are cringingly accurate, the pair has created a bevy of classic characters, including Wendell, the players of the East/West Bowl and President Obama's Anger Translator. Subscribe to Comedy Central: https://www.youtube.com/channel/UCUsN5ZwHx2kILm84-jPDeXw?sub_confirmation=1Watch more Comedy Central: https://www.youtube.com/comedycentral Follow Key & Peele:Facebook: https://www.facebook.com/KeyAndPeele/Twitter: https://twitter.com/keyandpeeleWatch full episodes of Key & Peele: http://www.cc.com/shows/key-and-peeleFollow Comedy Central:Twitter: https://twitter.com/ComedyCentralFacebook: https://www.facebook.com/ComedyCentral/Instagram: https://www.instagram.com/comedycentral/#KeyandPeele"
"uPyGuDG2r-A","Game Theory: Spiderman DESTROYED New York! (Spider-Man: Miles Morales)","2021-01-09T20:05:39Z","UCo_IB5145EVNcf8hw1Kku7w","The Game Theorists","20","21.14.01","spiderman|spiderman miles morales|marvel's spiderman|marvel's spiderman miles morales|miles morales|spider-man|spider-man miles morales|spiderman 2|spiderman 3|marvel|mcu|spider-man 2|spider-man 3|spiderman trailer|spiderman 3 trailer|spiderman far from home|spider-man ps5-spider.man ps4|spider man|doctor doom|venom|miles morales ending|miles morales ps5|ps5 spiderman|spider-man ps5|miles morales gameplay|game theory|game theorists|matpat","1324386","74002","1313","6562","https://i.ytimg.com/vi/uPyGuDG2r-A/default.jpg","False","False","Special thanks to NordVPN for sponsoring this episode!Get a 2 Year Plan + an extra 1 month FREE w/ code MATPAT ► https://NordVPN.com/matpat It’s risk free with Nord’s 30 day money-back guarantee!*Correction - Dr. Vijay Modi is a Professor of Mechanical Engineering at Columbia UniversityTheorists, we are here to talk about the ending of Spider-Man: Miles Morales. That is your warning. You see, at the end of the game Miles absorbs the giant blast meant to destroy his city and released it high above the skyline in order to keep people from being hurt. Well Miles, there is a slight problem with your solution. Miles, I am sorry to tell you that you did NOT save the city. Why? Watch to find out!Find the game here ► https://www.playstation.com/en-us/games/marvels-spider-man-miles-morales/Get yourself some Theory Wear! ► https://bit.ly/2UkxCv0    SUBSCRIBE to Catch all the Theories! ► https://goo.gl/kQWHkJ      Need Royalty Free Music for your Content? Try Epidemic Sound. Get A 30 Day Free Trial! ► http://share.epidemicsound.com/MatPat#Spiderman #Marvel #MilesMorales #Spiderman2 #Spiderman3 #PS5 #Venom #GreenGoblin #MCU #MatPat #GameTheory More THEORIES: FNAF, The FINAL Timeline ►► https://bit.ly/2MlHYFeFNAF, The Monster We MISSED! ►► https://youtu.be/_ygN8HLCaJgFNAF This Theory Changes Everything ► https://bit.ly/2JUQUn6FNAF, You Were Meant To Lose ► https://youtu.be/7bn8hM9k0b0FNAF 6, No More Secrets ► https://bit.ly/2LVCq4u   Credits:Writers: Matthew Patrick and Justin KuiperEditors: Alex Sedge Sedgwick and Danial BanditRants KeristoufiAssistant Editor: AlyssaBeCrazySound Editor: Yosi Berman"
"iQUSPmnRvw4","The Family Man Season 2 - Official Teaser 4K | Raj & DK | Manoj Bajpayee, Samantha | Amazon Original","2021-01-13T06:25:15Z","UC4zWG9LccdWGUlF77LZ8toA","Amazon Prime Video India","24","21.14.01","the family man|the family man season 2 teaser|the family man season 2|the family man 2 release date|the family man web series|the family man movie|the family man manoj bajpai|manoj bajpayee|the family man manoj bajpai fight scene|samantha akkineni|the family man manoj bajpayee full movie|priyamani|manoj bajpayee movie|manoj bajpayee dialogue|manoj bajpayee the family man scenes|action|thriller|funny|comedy|announcement|the family man season 2 trailer|teaser|2021|new","5722053","220262","2832","6222","https://i.ytimg.com/vi/iQUSPmnRvw4/default.jpg","False","False","Amazon Prime Video presents the Official Teaser of The Family Man Season 2.Created, Produced by Raj & DKWritten by Suman Kumar, Raj & DKDirected by Raj & DK, Suparn S Varma Starring: Manoj Bajpayee, Samantha Akkineni, Priyamani, Sharib Hashmi, Shreya Dhanwanthary, Sunny Hinduja, Sharad Kelkar, Darshan Kumaar, Dalip Tahil, VipinKumar A Sharma, Seema Biswas, Asif Sattar Basra, Shahab Ali, Ashlesha Thakur, Vedant Sinha, Ravindra Vijay, Devadarshini Chetan, Mime Gopi, N Alagamperumal, Anandsami, Abhay Verma, and others► Trailer Release Date - 19 Jan, 2021 only on Amazon Prime Video► Show Release Date - 12 Feb, 2021 in Hindi, Tamil, TeluguDirector of Photography: Cameron Eric BrysonProduction Design: Saini S JohrayEditor: Sumeet KotianBackground Music: Ketan SodhaAssociate Producer: Anuradha SharmaExecutive Producer: Rahul GandhiScreenplay: Suman Kumar, Suparn S Varma, Raj & DKHindi Dialogues: Suparn S VarmaSrilankan Tamil Dialogues: Manoj Kumar KalaivananAction Directors: Aejaz Gulab, Yannick BenSound Design: Pritam DasCostume Designers: Suveera Ambade & Swetesh AmbadeCasting: Mukesh Chhabra, CSACreative Supervisor: Suman KumarFor more such videos, subscribe to our YouTube channel ► https://amzn.to/SubscribeDon't forget to push the Bell 🔔 icon to never miss an update.For more updates, stay connected with us on► Facebook: https://www.facebook.com/PrimeVideoIN/► Twitter: https://twitter.com/PrimeVideoIN► Instagram: https://www.instagram.com/primevideoin► Watch Now: https://primevideo.comAbout Amazon Prime VideoAmazon Prime Video offers unlimited ad-free streaming of Prime Originals, premium Hollywood, Bollywood & Regional movies, and TV shows. Enjoy on your phone, tablet or SmartTV. Or you can download your favorite movies and TV shows to watch them offline.► Join Prime today at just Rs.999/year only. https://amzn.to/SignUp#TheFamilyMan #NewSeason #OfficialTeaser #AmazonPrimeVideo"
"0frvTbcz0dk","Tottenham v Brentford | Carabao Cup 20/21 | Match Highlights","2021-01-05T21:46:41Z","UCsY7UM8d2sGHhWP_nj7WYjQ","beIN SPORTS","17","21.14.01","Football|soccer|Highlights|Sport|Sports|Futbol|Match Highlights|Carabao CUp|Jose Mourinho|Mourinho|tottenham|brentford|Son|Harry Kane|Kane|Son Heung Min","1287965","14239","534","1402","https://i.ytimg.com/vi/0frvTbcz0dk/default.jpg","False","False","Tottenham v Brentford | Carabao Cup 20/21 | Match Highlights😍 Love It Like The First Time📱 Subscribe to beIN SPORTS CONNECT: https://connect-au.beinsports.com/en/...🏃‍♂️ Follow us▶️ Facebook: https://facebook.com/beINSPORTSAUS▶️ Twitter: https://twitter.com/beINSPORTS_AUS▶️ Instagram: https://www.instagram.com/beinsports_AUS⚽️🎾🏈 beIN SPORTS. The biggest names in the game. LIVE every week"
"0eFdq5Fd2TU","Trying 2021 Nail Art Trends","2021-01-09T16:31:02Z","UCGCVyTWogzQ4D170BLy2Arw","Simply Nailogical","24","21.14.01","nails|nail art|nail tutorial|beauty tutorial|nail art tutorial|diy nails|diy nail art|simply nailogical|cristine|nail trends|2021|2020|2021 trends|fashion week|fashion trends|biting nails|retro nails|muted nails|nail style|nail art trends|smudge nail art|how not to streak nail polish","1454947","78875","1063","5043","https://i.ytimg.com/vi/0eFdq5Fd2TU/default.jpg","False","False","Stay at home and paint your nails💅😷Got boring nails? Just add a Holo Taco 💿🌮 Sign up for email updates to be notified about restocks ➡️ http://holota.co/holothere1 ♡ Subscribe to never miss n̶e̶w̶ ̶n̶a̶i̶l̶ ̶a̶r̶t̶ ̶t̶u̶t̶o̶r̶i̶a̶l̶s̶! http://bit.ly/subsimply♡ Subscribe to Holo Taco (for nail videos lol): http://bit.ly/SubHoloTaco♡ Subscribe to the Podcast to hear me have adult conversations: http://bit.ly/SubSimplyPodLogicalAllure article: https://www.allure.com/story/nail-trends-2021Simply historical piece on yellow nails: http://bit.ly/YellowNailsDontMatter_ _ _ _ _ _ _ _ _ _ _ _ _ _ _ _ _ _ _ _ _ _ _ _ _ _ _ _ _ _ _ _ _ _♡PRODUCTS USED IN THIS VIDEO:♡♥ Holo Taco - Peely Base♥ Holo Taco - Smoothing Base♥ Holo Taco - Rainbow Collection♥ Black & white acrylic paint: https://amzn.to/39hXEWN♥ Jade Crystal Glow Lolligloss Jelly (pink)♥ Holo Taco - Scattered Holo Taco & Flakie Holo Taco♥ Press-on nails: https://amzn.to/3bpeWny♥ Unreleased Holo Tacos👀♥ Essie orange: https://amzn.to/3bplK4z♥ OPI Nude: https://amzn.to/2LgiY7e♥ Essie brown: https://amzn.to/39g1S19♥ Essie pistachio: https://amzn.to/3q8HZ2P♥ Blue face masks: https://amzn.to/2Lye9WPTools:♥ Holo Taco - Rainbow Chrome Nail Tool Kit: https://www.holotaco.com/products/rainbow-chrome-nail-tool-kit♥ Holo Taco - One-Coat Black 🖤♥ Nail vinyls: http://bit.ly/NailVinyls1♥ Unreleased Holo Taco Brushes & clean-up brush👀_ _ _ _ _ _ _ _ _ _ _ _ _ _ _ _ _ _ _ _ _ _ _ _ _ _ _ _ _ _ _ _ _ _Stalk me on all the social medias!http://instagram.com/simplynailogicalhttps://www.snapchat.com/add/simplynailogicahttps://twitter.com/nailogicalhttps://www.facebook.com/simplynailogicalhttp://www.simplynailogical.com (archival materials)My other YouTube channels:https://www.youtube.com/simplypodlogicalhttps://www.youtube.com/holotacohttps://www.youtube.com/simplynotlogical_ _ _ _ _ _ _ _ _ _ _ _ _ _ _ _ _ _ _ _ _ _ _ _ _ _ _ _ _ _ _ _ _ _I film my nail videos with this camera: http://amzn.to/1MgznhtThis 105mm macro lens: http://amzn.to/1Pi8PM3I filmed my face in this video with this camera: https://amzn.to/327OB7bThis lens: https://amzn.to/38HnBgUVoiceover mic: http://amzn.to/1MefGpGAudio recorder: https://amzn.to/3dbtg1wExternal mic: https://amzn.to/32AnO3gRing light for face-cams: http://amzn.to/2cU7cNOI edit my videos with: http://bit.ly/videoeditor1I get some cool editing filters from: https://motionvfx.sjv.io/Ze3bRCheck out my personalized Amazon page with stuff I like! https://www.amazon.com/shop/simplynailogicalMusic: http://share.epidemicsound.com/SIMPLY_ _ _ _ _ _ _ _ _ _ _ _ _ _ _ _ _ _ _ _ _ _ _ _ _ _ _ _ _ _ _ _ _ _Disclaimer cause I love you guys: This video was not sponsored by any of the brands mentioned. All opinions are my own. Some links above are affiliate links."
"6NfkD5ch1TM","Hiding UNDERGROUND From POLICE! HIDE & SEEK Challenge","2020-12-26T17:00:07Z","UCwIWAbIeu0xI0ReKWOcw3eg","Unspeakable","22","21.14.01","unspeakable|vlog|vlogs|unspeakablegaming|prank|comedy|challenge|laugh|funny|moments|craziest|pranks|crazy|no cursing|no swearing|how to|parody|troll|video|react|family friendly|funniest|adventure|trolling|unspeakable vlogs|real life|life|unspeakable real life|unspeakableplays","7371136","299935","7430","16719","https://i.ytimg.com/vi/6NfkD5ch1TM/default.jpg","False","False","NEW MERCH! - https://www.unspeakable.com/Follow all of these or I will steal your cookiesINSTAGRAM 1 - http://instagram.com/unspeakableINSTAGRAM 2 - https://www.instagram.com/Unspeakableshop/TIK TOK -  https://vm.tiktok.com/tyG2Rd/Subscribe to my other channels or I will eat your computerMiNeCrAfT - https://www.youtube.com/user/UnspeakableGaming?sub_confirmation=1EpIc GaMeS - https://www.youtube.com/channel/UC1n_yB_W-FZCbwajZPcs8Jw?sub_confirmation=1MoRe VlOgS - https://www.youtube.com/channel/UCet_y01v87pE7MPGikjTQQw?sub_confirmation=1BeSt MeRcH - https://www.youtube.com/channel/UCBUOxKtRd79qLwkLTPsFCUA?sub_confirmation=1ThE n00b - https://www.youtube.com/channel/UCA1LBqaJbeRPyjL3LmHjwqQ?sub_confirmation=1Thanks for watching! Likes are greatly appreciated! Subscribe to be notified when my next video is live!"
"QPBE9DtQI88","Anne-Marie's '2002' | Blind Auditions | The Voice UK 2021","2021-01-02T21:16:16Z","UCOlLivh3_AfkjDFy5X7EL5Q","The Voice UK","24","21.14.01","the voice coaches|the voice uk|Anne-Marie|will.i.am|william|tom jones|olly murs|the voice of uk|the voice itv|tv talent|the voice best moments|the voice performance|la voiz|aj odudu|emma willis|the voice uk 2021|the voice uk 2021 highlights","6561512","242554","1238","0","https://i.ytimg.com/vi/QPBE9DtQI88/default.jpg","True","False","Anne-Marie performs her hit single '2002' in week 1 of The Voice UK 2021 Blind Auditions!Watch Full Episodes on The ITV Hub: http://entslink.itv.com/38Fg5ppSubscribe, like and watch more: http://bit.ly/2jmXcPtWebsite: http://bit.ly/2hwvvllFacebook: http://bit.ly/2iuiAyQTwitter: http://bit.ly/2ht0H1rInstagram: http://bit.ly/2iIEy0qDownload The Voice UK's free app for exclusive previews and news:iOS: http://apple.co/2hzvKxqAndroid: https://link.itv.com/androidGet all the latest from The Voice UK YouTube channel, news, gossip and videos with superstar Coaches will.i.am, Anne-Marie, Olly Murs and Sir Tom Jones.http://www.itv.comhttp://www.stv.tv #TheVoiceUK"
