video_id,title,publishedAt,channelId,channelTitle,categoryId,trending_date,tags,view_count,likes,dislikes,comment_count,thumbnail_link,comments_disabled,ratings_disabled,description
"VGu2OCS4q8U","Aston Villa v Liverpool | Key Moments | Third Round | Emirates FA Cup 2020-21","2021-01-08T21:51:51Z","UCChcWqwYXCEs657MQ00qVWA","The Emirates FA Cup","17","21.14.01","fa cup|emirates fa cup|fa cup highlights|fa cup third round|third round|emirates fa cup third round|liverpool|aston villa|liverpool vs aston villa|liverpool highlights|aston villa highlights|aston villa 1-4 liverpool|louie barry|sadio mane|mo salah|louie barry goal vs liverpool|aston villa fa cup","1892317","16594","854","1687","https://i.ytimg.com/vi/VGu2OCS4q8U/default.jpg","False","False","A young Aston Villa side hosted Liverpool at Villa Park in the Third Round of the Emirates FA Cup.Follow @EmiratesFACup on Twitter for in-game highlights and match updates!                        https://twitter.com/emiratesfacup                                                Subscribe:                        https://www.youtube.com/thefacup                                                To find out more about The Emirates FA Cup visit:                        TheFA.com/EmiratesFACup                                                The Emirates FA Cup on Facebook:                        https://www.facebook.com/EmiratesFACup/                                                The Emirates FA Cup on Instagram:https://www.instagram.com/emiratesfacup/"
"5WfGUl8cilY","Violent protests spread across the U.S. after Capitol Hill riot","2021-01-11T01:58:54Z","UCAeWdyKJXGWmVAXFpgLNNTg","CBS Evening News","25","21.14.01","video|cbs|news|president trump|riot|protest|Capitol|nationwide|lindsey graham|Washington state|arizona|Florida|Minnesota|Kansas|state house","598641","6635","762","3656","https://i.ytimg.com/vi/5WfGUl8cilY/default.jpg","False","False","In the wake of the deadly protest at the Capitol on Wednesday, supporters of President Trump are protesting and storming state capitols nationwide. Mark Strassmann takes a look.Subscribe to the CBS Evening News Channel HERE: http://bit.ly/1S7DhikWatch Full Episodes of the CBS Evening News HERE: http://cbsn.ws/23XekKAWatch the latest installment of On the Road, only on the CBS Evening News, HERE: http://cbsn.ws/23XwqMHFollow CBS Evening News on Instagram: http://bit.ly/1T8icTOLike CBS Evening News on Facebook HERE: http://on.fb.me/1KxYobbFollow the CBS Evening News on Twitter HERE: http://bit.ly/1O3dTTeFollow the CBS Evening News on Google+ HERE: http://bit.ly/1Qs0aamGet your news on the go! Download CBS News mobile apps HERE: http://cbsn.ws/1Xb1WC8Get new episodes of shows you love across devices the next day, stream local news live, and watch full seasons of CBS fan favorites anytime, anywhere with CBS All Access. Try it free! http://bit.ly/1OQA29B---The CBS Evening News premiered as a half-hour broadcast on Sept. 2, 1963. Check local listings for CBS Evening News broadcast times."
"OKiXjL5_bbY","Air Force veteran identified as Capitol rioter carrying zip ties on Senate floor","2021-01-10T04:38:43Z","UCruQg25yVBppUWjza8AlyZA","FOX 4 Dallas-Fort Worth","25","21.14.01","FOX|KDFW|Dallas|Fort|Worth|Good|Day|Texas|News|Sports|weather|politics","806528","10254","1110","4939","https://i.ytimg.com/vi/OKiXjL5_bbY/default.jpg","False","False","Larry R. Brock Jr., whose address is listed in Grapevine, confirmed to the New Yorker that he was the man pictured wearing a helmet and military gear on the Senate floor.FOX 4 News is a FOX-owned station serving Dallas-Fort Worth and all of North Texas."
"1EfauAJ4GXU","Suspek sa Christine Dacera case lumantad; kampo ng biktima may apela | TV Patrol","2021-01-05T11:35:12Z","UCE2606prvXQc_noEqKxVJXA","ABS-CBN News","25","21.14.01","PatrolPH|Tagalog News|balita|TV Patrol|TV PATROL TOP|Christine Dacera|victim blaming|dead|Makati|hotel|crime|krimen|party|flight attendant|Claire dela Fuente|Gregorio de Guzman|PatrolPh|Tagalog news|TV PATROL|ABS-CBN|Kapamilya|ABS-CBN News|ABS-CBN Philippines|Philippine News|ABS-CBN News and Current Affairs|ABS-CBN News Channel|January 5 2021|20210105news|YT0psJosh|breaking news|TV Patrol January 5 2021|#TVPatrol|#ABSCBN|#KapamilyaChannel|24 Oras|Dacera","8053494","62581","5626","10604","https://i.ytimg.com/vi/1EfauAJ4GXU/default.jpg","False","False","Umapela ang kampo ng nasawing flight attendant na itigil na ang victim-blaming. Lumantad naman ang isa sa mga suspek.To watch the latest COVID-19 videos, click the link below:https://www.youtube.com/playlist?list=PLgyY1WylJUmgfPR6cfM34CVfv_xeWMu01To watch TeleRadyo videos, click the link below: https://www.youtube.com/playlist?list=PLgyY1WylJUmjhG4rVrq9CXF7oVrogq2wXFor more TV Patrol videos, click the link below:http://bit.ly/TVPatrol_2021Subscribe to the ABS-CBN News channel! - http://bit.ly/TheABSCBNNewsWatch the full episodes of TV Patrol on iWantTFC:http://bit.ly/TVPatrol-iWantTFCVisit our website at http://news.abs-cbn.comFacebook: https://www.facebook.com/abscbnNEWSTwitter: https://twitter.com/abscbnnews#TVPatrol#ABSCBNNews#LatestNews"
"HZNQPTngAaU","Guy Throws Christmas Tree Out of Window and it Lands Perfectly on the Ground - 1169330","2021-01-13T03:36:19Z","UCdAeRRjq6vjnAkxatZVxxxg","RM Videos","24","21.14.01","[none]","941104","23873","341","2079","https://i.ytimg.com/vi/HZNQPTngAaU/default.jpg","False","False","To license this content click here and use “RM1” code at checkouthttps://www.jukinmedia.com/licensing/view/1169330"
"UZdCgTNHVN4","Air Force vet arrested for Capitol riot - Larry Brock Jr. seen carrying zip ties on Senate floor","2021-01-11T00:13:03Z","UCruQg25yVBppUWjza8AlyZA","FOX 4 Dallas-Fort Worth","25","21.14.01","FOX|KDFW|Dallas|Fort|Worth|Good|Day|Texas|News|Sports|weather|politics","1201799","11661","1424","6642","https://i.ytimg.com/vi/UZdCgTNHVN4/default.jpg","False","False","FOX 4 News is a FOX-owned station serving Dallas-Fort Worth and all of North Texas."
"vBHild0PiTE","Lana Del Rey - Chemtrails Over The Country Club (Official Video)","2021-01-11T19:10:09Z","UC3N5y6UWKJaKqoU2b_0MfTQ","LanaDelReyVEVO","10","21.14.01","Lana|Del|Rey|Chemtrails|Over|The|Country|Club|Polydor|Records|Pop","5166706","477845","9021","46421","https://i.ytimg.com/vi/vBHild0PiTE/default.jpg","False","False","Lana Del Rey - Chemtrails Over The Country ClubThe New Album 'Chemtrails Over The Country Club' - Out March 19th Pre-Order Now https://Lana.lnk.to/ChemtrailsOverTheCountryClubVDSign-up to be notified first https://Lana.lnk.to/ChemTrailsJan11Follow Lana Del Rey:http://www.instagram.com/lanadelreyhttp://www.facebook.com/lanadelreyhttp://www.twitter.com/lanadelreyhttp://lanadelrey.tumblr.comhttps://LanaDelRey.comMusic video by Lana Del Rey performing Chemtrails Over The Country Club. © 2021 Lana Del Rey, under exclusive licence to Universal Music Operations Limitedhttp://vevo.ly/mC5fVM"
"BHHxICRa9tU","Customizing My Shoes (Again)","2021-01-08T21:00:03Z","UCYAB7hh1ohA8-iX54EpMdeA","Moriah Elizabeth","24","21.14.01","making custom shoes|how to customize shoes|painting on shoes|custom vans|decorating air force ones|tiktok painting compilation|painting on things","2883754","156833","1646","30201","https://i.ytimg.com/vi/BHHxICRa9tU/default.jpg","False","False","Hey Guys! Today I am going to be painting and customizing a pair of my white vans. Shoes are such a fun item to paint, and I have so many ideas for ways to decorate these. I hope I give you some inspiration for a fun painting project! I love making custom shoes because you can really put your own style on them and make them personal to you (even if you never actually wear them lol). This is always such a cool, creative and easy activity to do if you're bored or need to get over artist's block. You can even use this technique to upcycle some old shoes!SUPPLIES I USED (contains affiliate links):Angelus Leather Paint (big bottles): https://amzn.to/2QzjUmGAngelus Leather Paint (small bottles): https://amzn.to/2U5gmuoVinyl Red Tape: https://amzn.to/2WHjhLRHigh Gloss Acrylic Finisher: https://amzn.to/2J4mCwc___________WELCOME TO MY CHANNEL__________Hey! my name is Moriah (pronounced muh-rye-yuh 😂 ) and this is my channel....obviously. I'm 25 and like doing anything creative...and being snarky.....just a lil. I make a lot of decorating, painting and general art videos here. I'm obsessed with editing and adding lil bits to my videos, so if that's not your thing....oof you may hate this haha. I paint on squishies, thrift store finds, and other random things I pick up. I also love to draw, but don't expect anything too skilled, I'm not the best at that haha. You will also find occasional crafting/testing crafting kits on my channel which are always a hot mess. And even some baking (REALLY bad at that, but it's fun to try LOL). CURRENT SERIES:Squishy Makeovers: Fixing and decorating used squishies sent from my viewersThrift Store Makeovers: Fixing and decorating stuff I find at thrift stores/yard salesBake With ME: Recreating squishies I've decorated in real lifeCreate This Book: Drawing in the prompt book that I wrote (available to purchase and follow along)Squishy Unboxing: Opening used squishy packages sent from viewersCraft Kit Testing: pretty self explanatory. testing craft kits.Find Products I Use (contains affiliate links):https://a.co/4XDtrmV___UPLOAD SCHEDULE___Every Friday at 4:00pm ET: Alternating Squishy Makeovers, Thrift Makeovers, Craft Kit Reviews, Create This Book, Mail Openings and Miscellaneous crafts and DIYs____PURCHASE ME PRODUCTS____CREATE THIS BOOK:https://amzn.to/2vUerfICREATE THIS BOOK 2:https://amzn.to/2Nx2G9fME Custom Merchandise:https://moriahelizabethmerch.com/ME Pin & Sticker Shop:https://me-merch.myshopify.comME Printed Apparel and Accessories:https://moriah-elizabeth.teespring.com/____ME SOCIALS____INSTAGRAM: https://www.instagram.com/moriahelizabethofficial/TIKTOK:https://www.tiktok.com/@me.moriah.elizabethFACEBOOK:https://www.facebook.com/Moriah-Elizabeth-102592864903627SNAPCHAT:MoriahOfficialVISIT ME WEBSITE:https://www.moriahelizabeth.com/____CONTACT ME____EMAIL PICTURES OF YOUR ART (Create This Book or Fan art only please):Artwork@Moriah.videoFOR BUSINESS INQUIRIES/OPPORTUNITIES ONLY:moriah@nightmedia.co_____MAIL ME_____For sending squishies, Letters, or general fan mail, please contact: FANMAIL@MORIAH.VIDEO to request my P.O. box address (must be 13+ to send mail)ATTENTION: Unfortunately I can only respond to a small amount of people each week. This is to make sure that I get a reasonable amount of mail and can feature the maximum amount on camera. I apologize in advance if you do not hear back from me, I may not have even seen the message. This email gets SUPER clogged with thousands of messages. Currently have 15,000+ unread messages just in this folder. SORRY PEEPS!*"
"tojy1rQucws","CHEAP NISSAN OUTDRIVES US ALL! Secret 4WD Hotspot With MENTAL Tracks & WICKED Beach Camps","2021-01-07T06:30:03Z","UCs-vWZu3t2ky3oImX83S_2Q","4WD 24-7","2","21.14.01","4wd|action|4x4|offroad|outdoors|travel|overlanding|toyota|nissan|hilux|patrol|landcruiser|adventure|camping|fishing|diesel|petrol|surf|shaun whale|graham cahill|australia|dirty 30|shorty|gq|gu|80 series|40 series|60 series|79 series|troopy|4wd action|4wd 247|4wd 24/7","325814","7286","97","826","https://i.ytimg.com/vi/tojy1rQucws/default.jpg","False","False","This is what it's all about, one of our wildest 4WD trips yet! Shauno & Graham hit some insane 4WD tracks in central Queensland, ticking off some cracking hotspots like Burrum, Kinkuna beach, Bundaberg & Pine Creek + Woodgate!Don't miss the once in a lift time beach camping spot either! More on the INSANE chopped 200 series: https://dmwindustries.com.au/Suspension that can handle the punishment: https://fulcrumsuspensions.com.au/"
"5Fg9oZk-5uA","I Bought Everything In 5 Stores","2021-01-09T21:01:25Z","UCX6OQ3DkcsbYNE6H8uQQuVA","MrBeast","24","21.14.01","[none]","28084135","2535688","16183","164468","https://i.ytimg.com/vi/5Fg9oZk-5uA/default.jpg","False","False","Please subscribe this video costed so much moneyBuy Merch Here!! - https://shopmrbeast.com/Beast Philanthropy - https://www.youtube.com/channel/UCAiLfjNXkNv24uhpzUgPa6ASUBSCRIBE OR I TAKE YOUR DOG╔═╦╗╔╦╗╔═╦═╦╦╦╦╗╔═╗║╚╣║║║╚╣╚╣╔╣╔╣║╚╣═╣ ╠╗║╚╝║║╠╗║╚╣║║║║║═╣╚═╩══╩═╩═╩═╩╝╚╩═╩═╝----------------------------------------------------------------follow all of these or i will kick you• Facebook - https://www.facebook.com/MrBeast6000/• Twitter - https://twitter.com/MrBeastYT•  Instagram - https://www.instagram.com/mrbeast--------------------------------------------------------------------"
"nBf-BMDTYDY","LaMelo Ball Reacts To Becoming The Youngest Player In NBA History To Post Triple-Double","2021-01-10T02:38:20Z","UC9-OpMMVoNP5o10_Iyq7Ndw","Bleacher Report","17","21.14.01","bleacher report|br|nba|lamelo ball|lamelo ball highlights|lamelo ball 19|lamelo ball charlotte hornets|lamelo ball rookie highlights|lamelo ball nba|lamelo ball triple-double|lamelo ball nba history|lamelo ball best passes|lamelo ball best highlights|lamelo ball 2021|lamelo ball 2021 highlights|lamelo ball vs. trae young|lamelo ball hornets|lamelo ball best assists|lamelo ball mix|lamelo ball fadeaway|lamelo ball 3-pointer|charlotte hornets|atlanta hawks","1664599","26223","613","2803","https://i.ytimg.com/vi/nBf-BMDTYDY/default.jpg","False","False","LaMelo Ball continues to impress as Charlotte's No. 3 overall draft pick. Tonight, he made NBA history at just 19 years old. He finished with 22 PTS, 12 REB, 11 AST in a win over the Atlanta Hawks. Subscribe: https://www.youtube.com/user/BleacherReport?sub_confirmation=1Follow on IG: http://www.instagram.com/f/bleacherreportFollow us on Twitter: http://www.twitter.com/bleacherreportLike us on Facebook: http://www.facebook.com/bleacherreport"
"lfP_5L8epow","Inside the Capitol Hill Riots","2021-01-10T00:23:30Z","UCZaT_X_mc0BI-djXOlfhqWQ","VICE News","25","21.14.01","Capitol Hill insurrection|inside capitol hill riots|vice news 2020|VICE News Tonight|vice video|capitol hill riot video|VICE News|capitol building|VICE on HBO|news|VICE on SHOWTIME|donald trump|joe biden|president trump|us capitol riot|washington dc|TRUMP presidency|Mike pence|trump supporters|capitol hill reaction|Capitol hill live|nancy pelosi office|nancy pelosi","1638679","31931","4300","16129","https://i.ytimg.com/vi/lfP_5L8epow/default.jpg","False","False","This is what it was like to be inside the Capitol Hill insurrection.Subscribe to VICE News here: http://bit.ly/Subscribe-to-VICE-NewsCheck out VICE News for more: http://vicenews.comFollow VICE News here:Facebook: https://www.facebook.com/vicenewsTwitter: https://twitter.com/vicenewsTumblr: http://vicenews.tumblr.com/Instagram: http://instagram.com/vicenewsMore videos from the VICE network: https://www.fb.com/vicevideo"
"angCGS5WciM","Trump’s Bananas Border Speech, Looming Impeachment & Crazy Conspiracies","2021-01-13T03:29:55Z","UCa6vGFO9ty8v5KZJXQxdhaw","Jimmy Kimmel Live","23","21.14.01","jimmy|jimmy kimmel|jimmy kimmel live|late night|talk show|funny|comedic|comedy|clip|comedian|mean tweets|Pandemic|Coronavirus|COVID-19|Social Distancing|Quarantine|Monologue|Donald Trump|POTUS|Border Wall|Trump speech|Mike Pence|25th Amendment|Big Tech|Jacob Chansley|Mitch McConnell|YMCA|Capitol Siege|Washington|Chuck Schumer|Qanon|Matt Damon|Johnny Chan","1765350","40497","1571","4968","https://i.ytimg.com/vi/angCGS5WciM/default.jpg","False","False","Eight days are left of Donald Trump’s presidency, the House will vote to impeach tomorrow, new details have been released about what went down at the White House on Wednesday during the attacks on the Capitol, one of the rioters (who was dressed like a Viking) isn’t happy with his accommodations in jail, Trump flew to Alamo, Texas to brag about his “wall” the same week his supporters showed that walls serve no purpose whatsoever, three Democrats in the house have tested positive for COVID after being holed up during the Capitol lockdown with maskless colleagues, and it turns out that QAnon is just a build-your-own-apocalypse. SUBSCRIBE to get the latest #Kimmel: http://bit.ly/JKLSubscribeWatch Mean Tweets: http://bit.ly/KimmelMT10Connect with Jimmy Kimmel Live Online:Visit the Jimmy Kimmel Live WEBSITE: http://bit.ly/JKLWebsiteLike Jimmy Kimmel on FACEBOOK: http://bit.ly/KimmelFBLike Jimmy Kimmel Live on FACEBOOK: http://bit.ly/JKLFacebookFollow @JimmyKimmel on TWITTER: http://bit.ly/KimmelTWFollow Jimmy Kimmel Live on TWITTER: http://bit.ly/JKLTwitterFollow Jimmy Kimmel Live on INSTAGRAM: http://bit.ly/JKLInstagramAbout Jimmy Kimmel Live:Jimmy Kimmel serves as host and executive producer of Emmy®-nominated “Jimmy Kimmel Live!,” ABC’s late-night talk show. “Jimmy Kimmel Live!” is well known for its huge viral video successes, with over 11 billion views and more than 15 million subscribers on the show’s YouTube channel. Some of Kimmel’s most popular comedy bits include “Celebrities Read Mean Tweets,” “Lie Witness News,” “Unnecessary Censorship,” “Halloween Candy YouTube Challenge,” and music videos like “I (Wanna) Channing All Over Your Tatum.”"
"pSryeC-g0Jc","Honest Trailers | Wonder Woman 1984","2021-01-12T18:00:23Z","UCOpcACMWblDls9Z6GERVi1A","Screen Junkies","1","21.14.01","screenjunkies|screen junkies|honest trailers|honest trailer|wonder woman|wonder woman 1984|dc|dceu|gal gadot|patty jenkins|warner bros.|wonder woman 1984 trailer|honest trailers wonder woman 1984","925276","37156","881","3809","https://i.ytimg.com/vi/pSryeC-g0Jc/default.jpg","False","False","►►Subscribe to ScreenJunkies!► https://fandom.link/SJSubscribe►►Watch the Honest Trailers Commentary with the Writers! ► https://youtu.be/xPbGrImlTZo►►Watch the Honest Trailer for 2020 featuring Patton Oswalt! ►https://www.youtube.com/watch?v=dMUxFSETaCYHonest Trailers | Wonder Woman 1984Voice Narration: Jon Bailey aka Epic Voice GuyTitle Design: Robert HoltbyWritten by: Spencer Gilbert, Joe Starr, Danielle Radford, Lon Harris, & Logan ReesProduced by: Spencer Gilbert & Joe StarrEdited by: Kevin WilliamsenPost-Production Supervisor: Emin BassavandDirector of Video Production: Max DionneAssociate Producer: Ryan O'TooleExecutive Producer: Roth Cornet#HonestTrailers"
"g7cPIQJWKho","The Kapil Sharma Show Season 2 - The Big Bull Stars Are Here - Full Ep - 174 - 9th Jan, 2021","2021-01-12T13:30:04Z","UCpEhnqL0y41EpW2TvWAHD7Q","SET India","24","21.14.01","the kapil sharma show|tkss set india|hindi serial|set hindi shows|set comedy hindi serial|set comedy tkss|kapil sharma comedy|kapil sharma serial set india|kiku sharda|sapna tkss|kapil comedy tkss|sapna comedy tkss|kapil sharma show new|new episode of kapil sharma|the kapil sharma show fresh episodes|hindi comedy show tkss|tkss new episodes|the kapil sharma show ep 174|ajay devgan in kapil show|abhishek bachchan in kapil show|Big Bull cast in kapil show","693902","11477","516","506","https://i.ytimg.com/vi/g7cPIQJWKho/default.jpg","False","False","Click here to Subscribe to SET India: https://www.youtube.com/channel/UCpEhnqL0y41EpW2TvWAHD7Q?sub_confirmation=1Click here to watch the full episodes of The Kapil Sharma Show: https://www.youtube.com/playlist?list=PLzufeTFnhupw4um68ni-2wyqenswK2ayGEpisode 174: The Big Bull Stars Are Here--------------------------------------------------------------------------------Here comes The Big Bulls Stars, Ajay Devang, Abhishek Bachchan, Sohum Shah, and Nikita Dutta are on the Set of The Kapil Sharma Show and have a huge laughter ride, sharing their experiences of working with each other. Catch the fun. About The Kapil Sharma Show Season 2 : ----------------------------------------------------------------Kapil Sharma is back with a new 'Salah Center' (Consultancy Business) in a Mohollah with absurd characters. The wealthy milkman Bachcha Yadav (Kiku Sharda) with his wife Titli Yadav (Bharti Singh) and sister-in-law Bhoori (Sumona Singh) is the one who has rented out houses within the Mohollah and is Kapil Sharma's business partner. The neighbors in the Mohollah are also full of quirks and don't shy away from the antics. With celebrities gracing every episode, The Kapil Sharma Show promises fun-filled entertaining weekends.#thekapilsharmashow #comedy #thekapilsharmashowfullepisodes"
"O0bd2bq8LG4","Panjab (My Motherland) Sidhu Moose Wala | TheKidd | NavkaranBrar | GoldMedia | New Punjabi Songs","2020-12-26T16:13:41Z","UC9ChdqQRCaZmTCwSJ49tcbw","Sidhu Moose Wala","10","21.14.01","sidhu moosewala|sidhu moosewala latest song|sidhu moosewala leaked songs|sidhu moosewala official videos|sidhu moosewala official song|latest punjabi song 2020","9882700","655474","43186","116072","https://i.ytimg.com/vi/O0bd2bq8LG4/default.jpg","False","False","Sidhu Moose Wala PresentsTitle : PanjabSinger/Lyrics/Composer/Concept : Sidhu Moose WalaMusic : The KiddMix Master : DenseVisuals  : Navkaran BrarPromotions : Gold Media https://www.instagram.com/goldmediaa/This Is Official Channel Of Punjabi Singer SIDHU MOOSE WALA This Channel is Made For Live Video And Other Events Broadcast, V LogsDo Subscribe & Be A Part Of My Life - https://bit.ly/SidhuMooseWalaSubscribeOnline Promotion Gold MediaTo Stream & Download Full Song:iTunes - https://music.apple.com/in/album/panjab-single/1546485491Spotify :- https://open.spotify.com/album/5Jtu3QrbP0OQui6JDNVTIb?si=l_m8i_pdSC-_sciherUBqQGaana - https://gaana.com/album/panjab-punjabiHungama - http://www.hungama.com/album/panjab/61240395/Resso - https://m.resso.app/ZSWxeqpy/YouTube Music - https://music.youtube.com/watch?v=DFGHScEXIPoAnghami - https://play.anghami.com/song/95471863Boomplay - https://www.boomplay.com/share/music/51658990Enjoy And Stay Connected With Artist || SIDHU MOOSE WALAClick to Subscribe - https://bit.ly/SidhuMooseWalaSubscribeTwitter - https://www.twitter.com/iSidhuMooseWalaFacebook - https://www.facebook.com/SidhuMooseWalaInstagram - https://instagram.com/Sidhu_MooseWalaSnapChat - https://www.snapchat.com/add/SidhuShubh"
"xSs4yUZhb-I","CAREER-HIGH 62 PTS For Stephen Curry‼","2021-01-04T04:30:16Z","UCWJ2lWNubArHWmf3FIHbfcQ","NBA","17","21.14.01","NBA|G League|Basketball|game-0022000092|Steph|Stephen Curry|Curry|Warriors|Golden State|Golden State Warriors|Career-High|62 PTS|Pass|Assist|Dunk|Jump Shot|Steal|Rebound|Offense|Defense|Three|Three-Pointer|Triple|Mid-Range|Jumper|Fadeaway|Highlight|Highlights|Play|Plays|Double-Double|Triple-Double|NBA Season|2020-21 Season","4202558","97320","1129","8662","https://i.ytimg.com/vi/xSs4yUZhb-I/default.jpg","False","False","Stephen Curry scores a CAREER-HIGH 62 POINTS to lead the Warriors past Portland!62 PTS, 18-31 FGM, 8 3PM, 18-19 FTMSubscribe to the NBA: https://on.nba.com/2JX5gSN Full Game Highlights Playlist: https://on.nba.com/2rjGMgeFor news, stories, highlights and more, go to our official website at https://nba_webonly.app.link/nbasiteGet NBA LEAGUE PASS: https://nba.app.link/nbaleaguepass5"
"OgjDzzMOew8","Dana White talks Conor McGregor’s return, previews the UFC in 2021 | ESPN MMA","2021-01-11T13:00:16Z","UCO4AcsPKEkIqDmbeiZLfd1A","ESPN MMA","17","21.14.01","dana white|dana white ufc|dana white interview|dana white convo|espn mma dana white|dana white espn|dana ufc|conor mcgregor|mcgregor|poirier|mcgregor vs poirier|conor mcgregor dustin poirier 2|khabib|nurmagomedov|khabib nurmagomedov|ufc news|ufc interview|mma news|mma interview|jon jones|israel adesanya|jorge masvidal|brett okamoto|okamoto espn|espn ufc|espn mma|mma espn|ufc espn|ufc|ufc 257|fight island|mma|fight|espn|mayweather|pacquiao","580144","10246","435","2444","https://i.ytimg.com/vi/OgjDzzMOew8/default.jpg","False","False","UFC president Dana White sits down with ESPN MMA’s Brett Okamoto to discuss what’s ahead for the UFC in 2021, including (6:20) Conor McGregor’s fight vs. Dustin Poirier on Jan 23. White also previews his upcoming meeting with (14:32) Khabib Nurmagomedov on Fight Island, then gives his thoughts on (18:44) Jon Jones and other stars for the upcoming 12 months.#UFC #MMA #ESPNMMA✔ Donate now to Jimmy V Fund here: https://www.v.org/v-week/✔ For more UFC, sign up for ESPN+ http://espnplus.com/ufc/youtube✔ Get the ESPN App: http://www.espn.com/espn/apps/espn✔ Subscribe to ESPN on YouTube: http://es.pn/SUBSCRIBEtoYOUTUBE✔ Subscribe to ESPN FC on YouTube: http://bit.ly/SUBSCRIBEtoESPNFC✔ Subscribe to NBA on ESPN on YouTube: http://bit.ly/SUBSCRIBEtoNBAonESPN✔ Watch ESPN on YouTube TV: http://es.pn/YouTubeTVESPN on Social Media:► Follow on Twitter: http://www.twitter.com/espn► Like on Facebook: http://www.facebook.com/espn► Follow on Instagram: http://www.instagram.com/espnVisit ESPN on YouTube to get up-to-the-minute sports news coverage, scores, highlights and commentary for NFL, NHL, MLB, NBA, College Football, NCAA Basketball, soccer and more. More on ESPN.com: http://www.espn.com"
