video_id,title,publishedAt,channelId,channelTitle,categoryId,trending_date,tags,view_count,likes,dislikes,comment_count,thumbnail_link,comments_disabled,ratings_disabled,description
"hIYZXscer_s","Highlights: Southampton 1-0 Liverpool","2021-01-05T00:00:06Z","UC9LQwHZoucFT94I2h6JOcjw","Liverpool FC","17","21.14.01","Liverpool FC|LFC|Liverpool|Anfield|Melwood|Liverpool Football Club|premier league","1729190","19756","1594","2547","https://i.ytimg.com/vi/hIYZXscer_s/default.jpg","False","False","Watch key highlights from St Mary's, where Jürgen Klopp's side were beaten in their opening Premier League game of 2021, thanks to a single goal by Danny Ings. Enjoy more content and get exclusive perks in our Liverpool FC Members Area, click here to find out more: https://www.youtube.com/LiverpoolFC/joinSubscribe now to Liverpool FC on YouTube now and get notified when new videos land: https://www.youtube.com/subscription_center?add_user=LiverpoolFC"
"lTBz1Fx7DVw","Last To Get Knocked Out Wins iPhone 12 ft Beta Squad","2021-01-10T18:25:32Z","UC_8JxHQrJHC4rUsBtoPY4wQ","KingKennyTv","24","21.14.01","Last To Get Knocked Out Wins iPhone 12 ft Beta Squad|Beta Squad|Last to get knocked out wins PS5|Last to|Last to wins iphone 12 Pro|knocked out|chunkz|niko omilana|aj shabeel|johnny carey|sharky|kingkennytv|last to get knocked out wins|wins iphone 12|win iphone 12|Last to get knocked out|last to get|Last to get knocked out wins iPhone 12|iphone 12|iphone","1029615","88242","759","4067","https://i.ytimg.com/vi/lTBz1Fx7DVw/default.jpg","False","False","Last To Get Knocked Out Wins iPhone 12 ft @Beta Squad In this video @Chunkz @Sharky @Johnny Carey @Aj Shabeel and myself all competed in a boxing tournament to win an iPhone 12 Pro Max. We also had the best referee of all time, @Niko Omilana LOL enjoy.Subscribe: http://bit.ly/SubscribeKingKennyFollow Me To Keep Updated!InstaGRAM : https://www.instagram.com/kingkennytv/Twitter : https://twitter.com/KingKennytvFacebook :https://www.facebook.com/KingKennyTv/Twitch : https://www.twitch.tv/kingkennytvSnapchat: SkullparkerFamily Friendly PG Clean"
"VGV61CqJF5c","Trump Defends His Sedition Speech as Support for Impeachment Grows: A Closer Look","2021-01-13T02:00:07Z","UCVTyTA7-g9nopHeHbeuvpRA","Late Night with Seth Meyers","23","21.14.01","Late|Night|with|Seth|Meyers|acl|a closer look|NBC|NBC TV|television|funny|talk show|comedy|humor|stand-up|parody|snl seth meyers|host|promo|seth|meyers|weekend update|news satire|satire|Donald Trump|President Trump|Trump|Joe Biden|Kamala Harris|Mike Pence|Vice President|President|2020 election|electoral college|Biden|Kamala|2020|DC|storming|coup|United States|US|impeach|Capitol|US Capitol|Riot|Protests|Pence|news|White House|Impeachment|Insurrection","2373571","58843","1522","8742","https://i.ytimg.com/vi/VGV61CqJF5c/default.jpg","False","False","Seth takes a closer look at House Democrats calling on Vice President Pence to remove President Trump through the 25th Amendment as they prepare to vote on a resolution to impeach Trump.Late Night with Seth Meyers is supporting God’s Love We Deliver to help those in need during the COVID-19 pandemic. God’s Love We Deliver is a New York City-based organization that for over 30 years has provided personalized meals and nutrition counseling, free of charge, to those living with severe illnesses. With the help of 17,000 volunteers, God’s Love We Deliver provides over 2 million free meals each year to thousands of New York’s most vulnerable. Click the button on the above/below to donate or visit www.glwd.org.Late Night with Seth Meyers.  Stream now on Peacock: https://bit.ly/3erP2gXSubscribe to Late Night: http://bit.ly/LateNightSeth Watch Late Night with Seth Meyers Weeknights 12:35/11:35c on NBC. Get more Late Night with Seth Meyers: http://www.nbc.com/late-night-with-seth-meyers/ LATE NIGHT ON SOCIALFollow Late Night on Twitter: https://twitter.com/LateNightSethLike Late Night on Facebook: https://www.facebook.com/LateNightSethFollow Late Night Instagram: http://instagram.com/LateNightSethLate Night on Tumblr: http://latenightseth.tumblr.com/ Late Night with Seth Meyers on YouTube features A-list celebrity guests, memorable comedy, and topical monologue jokes. GET MORE NBCLike NBC: http://Facebook.com/NBCFollow NBC: http://Twitter.com/NBCNBC Tumblr: http://NBCtv.tumblr.com/YouTube: http://www.youtube.com/nbcNBC Instagram: http://instagram.com/nbc Trump Defends His Sedition Speech as Support for Impeachment Grows: A Closer Look- Late Night with Seth Meyershttps://youtu.be/VGV61CqJF5cLate Night with Seth Meyershttp://www.youtube.com/user/latenightseth"
"MpJIg_3DnLk","London's 2021 fireworks 🎆 Happy New Year Live! 🔴 BBC","2021-01-01T00:13:16Z","UCCj956IF62FbT7Gouszaj9w","BBC","24","21.14.01","fireworks|NYE|new year countdown 2021|fireworks live|big ben|NYE 2021|fireworks 2021|NYE 2021 fireworks|NEW YEAR'S EVE|new year's fireworks 2021|London Fireworks 2021|London NYE Fireworks 2021|2021 London Fireworks|London New Year's Day Fireworks|Fireworks london 2021|Fireworks london eye|fireworks big ben|London Fireworks new year's eve|BBC New Year's Eve Fireworks|UK Fireworks 2021|london fireworks|NYE fireworks|london eye|David Attenborough","7670357","106173","12694","20942","https://i.ytimg.com/vi/MpJIg_3DnLk/default.jpg","False","False","Subscribe and 🔔 to OFFICIAL BBC YouTube 👉 https://bit.ly/2IXqEInStream original BBC programmes FIRST on BBC iPlayer 👉 https://bbc.in/2J18jYJAs Big Ben strikes midnight, the nation comes together to welcome in the new year and light up the new year countdown to 2021.New Year's Eve Fireworks 2021 | BBC#BBC #FireworksLondon #BBCiPlayer #NewYearsEve #HappyNewYear2021 #2021All our TV channels and S4C are available to watch live through BBC iPlayer, although some programmes may not be available to stream online due to rights. If you would like to read more on what types of programmes are available to watch live, check the 'Are all programmes that are broadcast available on BBC iPlayer?' FAQ 👉 https://bbc.in/2m8ks6v."
"BdUmNxjCpdY","Christine Dacera's mother hopes to view CCTV of incident in full | ANC","2021-01-12T01:21:56Z","UCvi6hEzLM-Z_unKPSuuzKvg","ANC 24/7","25","21.14.01","ANC|ABS-CBN News Channel|ABS-CBN News|Philippine News|ANC 24/7|January 12 2021|YT0psRica|Christine Dacera|rape slay|Dacera rape slay|Dacera suspects|flight attendant rape slay|Christine Dacera News|Christine Dacera rape case|Christine Dacera Case|Christine Dacera investigation|Makati rape-slay|Christine Dacera Autopsy Report|Christine Dacera Autopsy|Christina Dacera CCTV Footage|Christina Dacera CCTV|Sharon Dacera|Sharon Dacera Interview|Dacera Family","784887","4391","718","2555","https://i.ytimg.com/vi/BdUmNxjCpdY/default.jpg","False","False","Headstart: The mother of Christine Dacera says she hasn't seen the hotel CCTV of the incident and want to view it in full.For more ANC Highlights, click the link below:https://www.youtube.com/playlist?list=PLm34qRgqWBU5ZeBwa8GTTal3LyNmJCpB1To watch more COVID-19 Special Coverage videos, click the link below:https://www.youtube.com/playlist?list=PLm34qRgqWBU7IDL0Gq6jOuYb9E3QaAM3zFor more Headstart videos, click the link below:https://www.youtube.com/playlist?list=PLm34qRgqWBU4jxZ_zzeH5rlxy__1WMTjsSubscribe to the ANC Youtube channel!https://www.youtube.com/user/ANCalertsVisit our website at https://news.abs-cbn.com/ancFacebook: https://www.facebook.com/ancalertsTwitter: https://twitter.com/ancalerts#ANCNews#ANCHighlights#ChristineDacera"
"Bds-DQlZvVs","The Terrorists Who Attacked Congress At The President's Direction Came Prepared To Kill","2021-01-12T04:50:02Z","UCMtFAi84ehTSYSE9XoHefig","The Late Show with Stephen Colbert","24","21.14.01","The Late Show|Late Show|Stephen Colbert|Steven Colbert|Colbert|celebrity|celeb|celebrities|late night|talk show|comedian|comedy|CBS|joke|jokes|funny|funny video|funny videos|humor|hollywood|famous","4142183","107974","4467","15910","https://i.ytimg.com/vi/Bds-DQlZvVs/default.jpg","False","False","Stephen didn't get a lot of sleep last weekend, as horrific scenes from last week's violent insurrection at the U.S. Capitol played over and again in his head. It now appears clear that the armed mob, who were organized and cheered on by the president and his GOP backers in the House and Senate, came to the nation's capital prepared to commit acts of violence against members of Congress and Vice President Mike Pence.Subscribe To The Late Show Channel HERE: http://bit.ly/ColbertYouTubeFor more content from The Late Show with Stephen Colbert, click HERE: http://bit.ly/1AKISnRWatch full episodes of The Late Show HERE: http://bit.ly/1Puei40Like The Late Show on Facebook HERE: http://on.fb.me/1df139YFollow The Late Show on Twitter HERE: http://bit.ly/1dMzZzGFollow The Late Show on Google+ HERE: http://bit.ly/1JlGgzwFollow The Late Show on Instagram HERE: http://bit.ly/29wfREjFollow The Late Show on Tumblr HERE: http://bit.ly/29DVvtRWatch The Late Show with Stephen Colbert weeknights at 11:35 PM ET/10:35 PM CT. Only on CBS.Get the CBS app for iPhone & iPad! Click HERE: http://bit.ly/12rLxgeGet new episodes of shows you love across devices the next day, stream live TV, and watch full seasons of CBS fan favorites anytime, anywhere with CBS All Access. Try it free! http://bit.ly/1OQA29B---The Late Show with Stephen Colbert is the premier late night talk show on CBS, airing at 11:35pm EST, streaming online via CBS All Access, and delivered to the International Space Station on a USB drive taped to a weather balloon. Every night, viewers can expect: Comedy, humor, funny moments, witty interviews, celebrities, famous people, movie stars, bits, humorous celebrities doing bits, funny celebs, big group photos of every star from Hollywood, even the reclusive ones, plus also jokes."
"XW_jRyyU1RA","I Actually Didn't Laugh","2021-01-09T20:47:32Z","UCGmnsW623G1r-Chmo5RB4Yw","JJ Olatunji","24","21.14.01","ksi|ksiolajidebt|ksiolajidebthd","4674102","442103","6041","22755","https://i.ytimg.com/vi/XW_jRyyU1RA/default.jpg","False","False","New song with Anne Marie & DFA - https://lnk.to/DontPlay"
"z3szNvgQxHo","(여자)아이들((G)I-DLE) - '화(火花)(HWAA)' Official Music Video","2021-01-11T09:00:14Z","UCritGVo7pLJLUS8wEu32vow","(G)I-DLE (여자)아이들 (Official YouTube Channel)","10","21.14.01","kpop|gidle|(여자)아이들|(G)I-DLE|IDLE|여자아이들|아이들|미연|민니|수진|소연|우기|슈화|MIYEON|MINNIE|SOOJIN|SOYEON|YUQI|SHUHUA|큐브|CUBE","20113870","767379","21550","119913","https://i.ytimg.com/vi/z3szNvgQxHo/default.jpg","False","False","(여자)아이들((G)I-DLE) - '화(火花)(HWAA)' Official Music VideoComposed by 소연, Pop TimeLyrics by 소연Arranged by Pop Time, 소연차디찬 한겨울이 덮친 듯시간은 다 얼어버리고잔인한 그 바람이 남긴 듯한어둠은 더 깊어 버리고벗어나리오끝없이 펼쳐진 기약 없는 계절을지워내리오뜨겁지 못한 날들에 홀로 데인 흉터를큰불을 내리오이 내 안에 눈물이 더는 못 살게난 화를 내리오 더 화를 내리오잃었던 봄을 되찾게차갑게 부는 바람이 눈이 하얗게 덮인 마음이아침이 오면 부디 모두 녹을 수 있게불을 지펴라화 火타올라 타올라화 火꽃피우리라화 火타올라 타올라화 火꽃피우리라내 너의 흔적 남지 않게 하리못다 한 원망도 훨훨 타리쓸쓸한 추위를 거둬 가길남겨진 시들은 꽃길을 즈려 밟지한을 풀리라 다시금 봄을 누리라추억은 모조리 불이 나 거름이 돼찬란한 꽃을 피우리라난 화를 내리오 더 화를 내리오잃었던 봄을 되찾게차갑게 부는 바람이 눈이 하얗게 덮인 마음이아침이 오면 부디 모두 녹을 수 있게불을 지펴라화 火타올라 타올라화 火꽃피우리라화 火타올라 타올라화 火꽃피우리라끊어진 인연의 미련을 품에 안고시렸던 시간을 나를 태워간다 화화 花화 花불을 지펴라꽃피우리라(G)I-DLE Official YouTube: http://www.youtube.com/gidleofficial(G)I-DLE Official Twitter: https://twitter.com/G_I_DLE(G)I-DLE Official Facebook: https://facebook.com/G.I.DLE.CUBE(G)I-DLE Official Instagram: https://instagram.com/official_g_i_dle(G)I-DLE Official Weibo: http://weibo.com/cubegidle(G)I-DLE Official Fansite: https://www.united-cube.comⓒ All Rights Reserved CUBE Entertainment Inc.#여자아이들 #GIDLE #HWAA"
"WjTi7qZJyuU","We surprised KLAI with a GRADUATION!","2021-01-11T18:53:00Z","UCuDTc9ztKJbsI6yleL3W2Vg","The Ohana Adventure","24","21.14.01","surprise graduation|surprised klailea|we surprised klailea with a graduation|graduation|homeschool graduation|toa|the Ohana adventure|ohana adventure|Rach Bennett|Jase Bennett|Shae|Wyatt|klailea|rykel|evee|Cora","419714","20317","225","0","https://i.ytimg.com/vi/WjTi7qZJyuU/default.jpg","True","False","We wanted to make this graduation special for Klailea before she leaves for college! Watch this: https://youtu.be/K5i-eKpErbsSubscribe: https://goo.gl/dRpa1NWho loves the NEW INTRO song? GET your free copy of our intro song now: https://bit.ly/3epIuR9song from Marc Allred MusicWelcome to The Ohana Adventure!GET YOUR OWN TOA SWAG: https://goo.gl/7DU59bFOLLOW OUR ADVENTURES:INSTAGRAM: https://www.instagram.com/theohanaadventure/WEBSITE: www.theohanaadventure.com FACEBOOK: https://www.facebook.com/theohanaadventure/PINTEREST: https://www.pinterest.com/OhanaAdventure/BUSINESS EMAIL: theohanaadventure@gmail.comWatch these fun things we do: PARENTING  HACKS: https://goo.gl/T1wo0qFUN HOW TO'S: https://goo.gl/rsbOiMTRAVEL ADVENTURES: https://goo.gl/yszf5dFor Business INquiries: Email us: theohanaadventure@gmail.comMAIL to: 250 North Redcliffs DR, 4B #366Saint George, UT 84790We are a crazy family of 8 from Hawaii; we believe in doing hard things, spontaneous adventures, laughing together, & trying new things and adventures in new lands! Mom - RachelDad - JaseKlai 17Rykel 15Shae 14Wyatt 12Evelin 10Cora 8**********************************************************************Music: Epidemic Sound: http://share.epidemicsound.com/rQNll imovie free music, youtube royalty free music from bensound.com or artlist.io or www.soundstorymusic.com or Artlist.io**********************************************************************"
"3iH0YehfMB0","The Girl On The Train | Official Teaser | Parineeti Chopra, Aditi Rao Hydari & Kirti Kulhari","2021-01-13T05:00:00Z","UCZSNzBgFub_WWil6TOTYwAg","Netflix India","24","21.14.01","TheGirlOnTheTrain|ParineetiChopra|NetflixIndia|netflix india|netflix|netflix shows|Aditi Rao Hydari|Kirti Kulhari","1009517","24881","1963","1587","https://i.ytimg.com/vi/3iH0YehfMB0/default.jpg","False","False","Are you on the edge of your seat or are you on the edge of your seat? A bright city, a dull morning and a curious girl on the train. When a voyeuristic divorcee fixates on the lives of a perfect couple from afar, she soon gets embroiled in a murder mystery that unfolds revealing truths about her own life. Get on board a thrilling experience with Parineeti Chopra, Aditi Rao Hydari, Kirti Kulhari and Avinash Tiwary. Catch Ribhu Dasgupta's The Girl On The Train on 26th February, only on Netflix.Follow Netflix India on:Website: https://www.netflix.com/YouTube: http://bit.ly/NetflixIndiaYTInstagram: http://www.instagram.com/netflix_inFacebook: http://www.facebook.com/NetflixINTwitter: http://twitter.com/netflixindiaSubscribe: https://bit.ly/2Oufg8zAbout Netflix:Netflix is the world's leading streaming entertainment service with over 195 million paid memberships in over 190 countries enjoying TV series, documentaries and feature films across a wide variety of genres and languages. Members can watch as much as they want, anytime, anywhere, on any internet-connected screen. Members can play, pause and resume watching, all without adverts or commitments.The Girl On The Train | Official Teaser | Parineeti Chopra, Aditi Rao Hydari & Kirti Kulharihttps://youtube.com/NetflixIndiaOfficial"
"x_BKRmfoF6w","Whose Bra Is This? | Cyanide & Happiness Comic Classics","2021-01-10T17:00:33Z","UCWXCrItCF6ZgXrdozUS-Idw","ExplosmEntertainment","23","21.14.01","satire|shorts|c&hshorts|c&h shorts|c and h shorts|cyanide and happiness shorts|cartoon|funny|cyanide|happiness|C&H|cy&h|cyanide and happiness|explosm|exlposm|cyanide & happiness|explosm.net|explosm animated|explosm comics|cartoon movies|animated|humor|comedy|explosmentertainment|comic classic|comic|classic|whos bra is this|bra|who|mystery|dating|girlfriend|boyfriend|couple|couple prank","469873","34613","270","716","https://i.ytimg.com/vi/x_BKRmfoF6w/default.jpg","False","False","Check out this short next! ► https://youtu.be/SrKVP5FgFkcTrial by Trolley is available NOW on Amazon! ► https://amzn.to/2OMFvHlC&H Video Game - Add Freakpocalypse to your Steam wish list now! ► https://bit.ly/fp-steamExplosm has a new upload schedule! Update your day-planners, wall calendars and sun dials!Comic Classics are Sundays at 12pm Eastern / 11am CentralThe Stockholms is Mondays at 12pm Eastern / 11am CentralCyanide & Happiness Shorts are Thursdays at 12pm Eastern / 11am CentralCyanide & Happiness has a Patreon! Become an Ultra Mega Pal today ► http://bit.ly/cnhpatreonJoin us to get behind the scenes video and bonus content  ►  https://www.youtube.com/channel/UCWXCrItCF6ZgXrdozUS-Idw/joinSubscribe to Explosm!  ► http://bit.ly/13xgq7aCyanide and Happiness delivers daily comics to your face-hole on http://explosm.net since 2005!Credits:Created By: Rob DenBleyker, Kris Wilson, Dave McElfatrickDirected By: Dave McElfatrickBased on Original Comic By: Kris WilsonAnimation Director: Bill JonesSupervising Animator: Matt ThurmanAnimation: Matt ThurmanIntro Animation: Paul BlairAnimatic: Elizabeth Del RosarioCharacter Design & Props: Paul BlairEditor: Taylor RansomSound Editor & Mixer: Ben Governale, Cymatic StudiosSound‌ ‌Design/Foley:‌ ‌Nic‌ ‌Federle, Ben GovernaleVoice Actors:Girl - Jennie Mae WilsonGuy - Kris WilsonProduced By: Adam NusrallahProduction Manager: Autumn SoederProduction Coordinator: Michael Stewart"
"TOFtEyDjs-0","Trump’s Savage Message to Biden Makes Internet EXPLODE: “Be Careful What You Wish For...”","2021-01-12T22:20:59Z","UCKgJEs_v0JB-6jWb8lIy9Xw","BlazeTV","25","21.14.01","TheBlaze|blaze|the blaze|the blaze tv|blazetv|blaze tv|politics|news|political news|conservative|conservative commentary|Blaze Media|trump|donald trump|president trump|joe biden|biden|joe biden impeachment|trump impeachment|donald trump impeachment|trump biden|biden trump|savage trump|trump savage|trump trolls|trump troll|us news|breaking news|trending news|blazetv youtube|politics news|25th amendment|fox news|blazetv live|blazetv videos","995793","47007","1248","7830","https://i.ytimg.com/vi/TOFtEyDjs-0/default.jpg","False","False","President Trump just issued a savage message to Biden during a press conference, saying that he is not worried about the 25th amendment, but that Biden should be! WATCH Trump break his silence to SLAM Big Tech and respond to the protesters who stormed the Capitol: https://www.youtube.com/watch?v=EoeWCZXy5MY#biden #trump #25thamendment► Subscribe to BlazeTV YouTube! https://bit.ly/2KJHuwu► Join BlazeTV! https://get.blazetv.com/► Sign up for our NEWSLETTER: https://theblaze.com/newslettersConnect with us on Social Media: http://twitter.com/BlazeTVhttp://instagram.com/TheBlazeTVhttp://facebook.com/BlazeMedia"
"N-6iAC1s8VM","Silicon Valley GOP official called to resign after controversial FB posts on Capitol insurrection","2021-01-10T06:00:03Z","UCYUbNjkuE4lsr2v1Id2O1oA","ABC7 News Bay Area","25","21.14.01","news|us capitol|bay area|silicon valley|south bay|gop|republican|phil reynolds|abc|california|us|capitol hill|capitol riots","124711","2062","155","837","https://i.ytimg.com/vi/N-6iAC1s8VM/default.jpg","False","False","Phil Reynolds says he has no intention of resigning or removing his controversial posts. I spoke from the heart, I was emotional and I'm not retracting comments, it did not incite violence.FULL STORY: https://abc7ne.ws/3owQMvj#capitol #bayarea #gop"
"q7IaN-VNuFI","U.S. House: Debate on 25th Amendment","2021-01-13T04:52:25Z","UCb--64Gl51jIEVE-GLDAVTg","C-SPAN","25","21.14.01","Articles of Impeachment|Impeach|Impeachment|Nadler|Collins|Constitution|Congress|Judiciary|House of Representatives|President of the United States|Ukriane|C-SPAN|CSPAN","318030","3858","2488","357","https://i.ytimg.com/vi/q7IaN-VNuFI/default.jpg","False","False","U.S. House: Debate on resolution calling on Vice President Pence to convene and mobilize the cabinet to invoke Section 4 of the 25th amendment. Discover the C-SPAN Video Library at https://www.c-span.org/quickguide/Download our App https://www.c-span.org/special/?radioappC-SPAN: Created by Cable in 1979. Offered as a public service.Subscribe to our YouTube channel: https://www.youtube.com/user/CSPANFollow us:Facebook: https://www.facebook.com/CSPANTwitter: https://twitter.com/cspanInstagram: https://www.instagram.com/cspan/Subscribe:C-SPAN Podcasts: https://www.c-span.org/podcasts/Newsletters: https://www.c-span.org/connect/"
"nHFBXpA6gyo","FBI arrests Nashville zip-tie suspect from assault on U.S. Capitol","2021-01-11T13:06:14Z","UCO6kzQ-7wcG0x8W5LpBA9RQ","NewsChannel 5","25","21.14.01","FBI arrests Nashville zip-tie suspect from assault on U.S. Capitol","882796","13871","722","7924","https://i.ytimg.com/vi/nHFBXpA6gyo/default.jpg","False","False","A self-described hidden patriot from Nashville, outed on social media as a rioter who invaded the U.S. Senate chambers Wednesday with a weapon and zip-tie handcuffs, was arrested Sunday on federal charges, NewsChannel 5 has learned."
"rPugZhq8XK4","PANAYAM NI IDOL RAFFY SA BEST FRIEND NI CHRISTINE DACERA.","2021-01-07T13:26:23Z","UCxhygwqQ1ZMoBGQM2yEcNug","Raffy Tulfo in Action","25","21.14.01","[none]","6110879","110517","3585","17526","https://i.ytimg.com/vi/rPugZhq8XK4/default.jpg","False","False","MAHALAGANG PAALALA:Muli po naming pinapaalala na hanggang ngayon ay SARADO PA RIN PO ANG AMING ACTION CENTER sa TV5 Media Center, Reliance Street, Mandaluyong City.Hindi pa rin po maaaring pumunta nang personal ang mga complainant para magreklamo kay Idol Raffy dahil sa ating kinahaharap na pandemya at mahigpit pa ring ipinapatupad ang mga safety measures upang maging ligtas ang lahat.Gayunpaman, puwede ninyong i-PM ang inyong mga sumbong sa OFFICIAL Facebook page ni Idol na RAFFY TULFO IN ACTION na may mahigit 13M followers. Nakahanda pong tumugon sa inyo ang RTIA researchers.Maraming salamat sa inyong pag-unawa at mag-ingat po tayong lahat!"
