video_id,title,publishedAt,channelId,channelTitle,categoryId,trending_date,tags,view_count,likes,dislikes,comment_count,thumbnail_link,comments_disabled,ratings_disabled,description
"lhjRXO72v1s","Must-See New Video Shows Capitol Riot Was Way Worse Than We Thought | All In | MSNBC","2021-01-09T02:37:11Z","UCaXkIU1QidjPwiAYu6GcHjg","MSNBC","25","21.14.01","Republicans|Capitol Hill|White House|Mike Pence|Donald Trump|Best of last night|Electoral College Protests|All In With Chris Hayes|All In|Chris Hayes|MSNBC|MSNBC news|MSNBC live|MSNBC TV|news|US news|politics|politics news|political news|elections|chris hayes live|chris hayes msnbc|us protest|us protest capitol|us protest 2021|us protests news|us protest violent|us protest election 2020|riot at capitol hill|protest at capitol|Capitol hill riots","10958597","173349","23439","72682","https://i.ytimg.com/vi/lhjRXO72v1s/default.jpg","False","False","Chris Hayes: “It is entirely possible that there were people in that crowd, looking to apprehend, possibly harm, and possibly murder the leaders of the political class that the President, and people like Mo Brooks, and even to a certain extent Ted Cruz and Josh Hawley, have told them have betrayed them. Aired on 1/8/2021.» Subscribe to MSNBC: http://on.msnbc.com/SubscribeTomsnbcAbout All In with Chris Hayes:Chris Hayes delivers the biggest news and political stories of the day with a commitment to in-depth reporting that consistently seeks to hold the nation's leaders accountable for their actions. Drawing from his background as a reporter, Hayes at times reports directly from the scene of a news event as it occurs to provide a firsthand account, digging deep and speaking with people who represent different points of view. Hayes brings the nation's officials, legislators, policymakers, and local activists to the table to address key issues affecting communities across America.MSNBC delivers breaking news, in-depth analysis of politics headlines, as well as commentary and informed perspectives. Find video clips and segments from The Rachel Maddow Show, Morning Joe, Meet the Press Daily, The Beat with Ari Melber, Deadline: White House with Nicolle Wallace, Hardball, All In, Last Word, 11th Hour, and more.Connect with MSNBC OnlineVisit msnbc.com: http://on.msnbc.com/ReadmsnbcSubscribe to MSNBC Newsletter: http://MSNBC.com/NewslettersYouTubeFind MSNBC on Facebook: http://on.msnbc.com/LikemsnbcFollow MSNBC on Twitter: http://on.msnbc.com/FollowmsnbcFollow MSNBC on Instagram: http://on.msnbc.com/Instamsnbc#CapitolRiot #Worse #MSNBCMust-See New Video Shows Capitol Riot Was Way Worse Than We Thought | All In | MSNBC"
"fF53U7TVCxg","COOLEST HACKS TO BECOME POPULAR AT SCHOOL || Epic Tik Tok Hacks Tested by 123 GO!","2021-01-02T14:00:07Z","UCBXNpF6k2n8dsI6nBH8q4sQ","123 GO!","26","21.14.01","#123go","10778082","87725","12531","5476","https://i.ytimg.com/vi/fF53U7TVCxg/default.jpg","False","False","Would you ride a motorcycle to be popular? Let us know in the comments! And don’t forget to share this video with your friends and subscribe to our channel for more great videos like this one!#123GO #tiktok #schoolThis video is made for entertainment purposes. We do not make any warranties about the completeness, safety and reliability. Any action you take upon the information on this video is strictly at your own risk, and we will not be liable for any damages or losses. It is the viewer's responsibility to use judgment, care and precautions if one plans to replicate.The following video might feature activity performed by our actors within controlled environment - please use judgment, care, and precaution if you plan to replicate. Music by Epidemic Sound: https://www.epidemicsound.com/Stock materials:https://www.depositphotos.comhttps://www.shutterstock.comAll product and company names shown in the video are trademarks™ or registered® trademarks of their respective holders. Use of them does not imply any affiliation with or endorsement by them."
"JpUxQyLCBbk","Hey, Republicans Who Supported This President: Are We Great Again Yet? - LIVE MONOLOGUE","2021-01-07T06:29:13Z","UCMtFAi84ehTSYSE9XoHefig","The Late Show with Stephen Colbert","24","21.14.01","The Late Show|Late Show|Stephen Colbert|Steven Colbert|Colbert|celebrity|celeb|celebrities|late night|talk show|comedian|comedy|CBS|joke|jokes|funny|funny video|funny videos|humor|hollywood|famous","10993456","300528","17873","45087","https://i.ytimg.com/vi/JpUxQyLCBbk/default.jpg","False","False","After the unprecedented assault on democracy that took place in the Capitol Building today, Stephen Colbert kicks off his LIVE monologue with a message for cowardly Republican lawmakers who for five years have coddled the president's fascist rhetoric: there will be a terrible price to pay. #Colbert #ALateShow #MonologueSubscribe To The Late Show Channel HERE: http://bit.ly/ColbertYouTubeFor more content from The Late Show with Stephen Colbert, click HERE: http://bit.ly/1AKISnRWatch full episodes of The Late Show HERE: http://bit.ly/1Puei40Like The Late Show on Facebook HERE: http://on.fb.me/1df139YFollow The Late Show on Twitter HERE: http://bit.ly/1dMzZzGFollow The Late Show on Google+ HERE: http://bit.ly/1JlGgzwFollow The Late Show on Instagram HERE: http://bit.ly/29wfREjFollow The Late Show on Tumblr HERE: http://bit.ly/29DVvtRWatch The Late Show with Stephen Colbert weeknights at 11:35 PM ET/10:35 PM CT. Only on CBS.Get the CBS app for iPhone & iPad! Click HERE: http://bit.ly/12rLxgeGet new episodes of shows you love across devices the next day, stream live TV, and watch full seasons of CBS fan favorites anytime, anywhere with CBS All Access. Try it free! http://bit.ly/1OQA29B---The Late Show with Stephen Colbert is the premier late night talk show on CBS, airing at 11:35pm EST, streaming online via CBS All Access, and delivered to the International Space Station on a USB drive taped to a weather balloon. Every night, viewers can expect: Comedy, humor, funny moments, witty interviews, celebrities, famous people, movie stars, bits, humorous celebrities doing bits, funny celebs, big group photos of every star from Hollywood, even the reclusive ones, plus also jokes."
"_xJUCsyMQes","Saweetie - Best Friend (feat. Doja Cat) [Official Music Video]","2021-01-07T23:00:20Z","UC2FCUwThC0RAzaQoI0TtpLA","Official Saweetie","22","21.14.01","saweetie|sweetie|tap in|my type|icy grl|icy girl|female hip hop|female rapper|hip hop|R&B|Doja Cat|Featuring Doja Cat|That's my best friend|Best Friend|Best Friend Saweetie Doja Cat|best friend thats my bestfriend lyrics|best friend tiktok|doja cat saweetie song|doja cat saweetie best friend mp3|saweetie ft doja cat|doja cat x saweetie type beat|dojacat|best friend video|best friend song|she's a real bad bitch","22341935","508273","26211","26652","https://i.ytimg.com/vi/_xJUCsyMQes/default.jpg","False","False","Download/Stream Best Friend (feat. Doja Cat): https://Saweetie.lnk.to/BestFriend❄️ICY GANG❄️Tap in with Saweetie to gain exclusive access to the next episode first! Text +1 (510) 250-3890 Follow SaweetieOfficial Website: www.saweetie.comTwitter: https://twitter.com/saweetieFacebook: https://www.facebook.com/OfficialSaweetieInstagram: https://www.instagram.com/saweetie/Credits: Starring: Saweetie, Doja Cat, & King BachDirected by Dave MeyersExecutive Producer: Nathan ScherrerProduced by Roisín Audrey MoloneyProduction Supervisor: Tori StoroshProduction Company: Freenjoy Saweetie Costume Design: Bryon JavarDoja Cat Costume Design: Brett Alan Nelson Director of Photography: Joshua Zucker- PludaProduction Designer: Alec Contestabile Cast Costume Design: Ann-Marie HoangEditor: Alyssa Oh @ Rock Paper ScissorsColorist: Stefan Sonnenfeld @ Company 3VFX: Buf ParisSound Design: Jeff Malen @ Lime Studios 00:42 Lyrics:That’s my bestfriend she a real bad bitchGot her own money she don’t need nigOn the dance floor she had two three drinksNow she twerking she throw it out and come back inThat’s my bestfriend she a real bad bitchDrive her own car she don’t need no lyftIn the strip club know my girl gone tipNow she twerking throw it out and come back inBeep beep is that my bestie in a tesiFresh blow out skin on 10 owe she readyBitch you look goodt with a t at the endImma hype her every time that’s my mothafuckin friendShe been down since the jellies and the bo bo’sNow we steppin out the G in manolo’sWhen we pull up to scene hoes be filled with jealousyIf a bitch get finicky she gone bring that energyI hit her phone with the tea like bitch guess whatAll the rich ass boys wanna fuck on usAll this ass sittin up you can look don’t touchAnd I’m bad bussin bands every time we link upThat’s my bestfriend she a real bad bitchGot her own money she don’t need nigOn the dance floor she had two three drinksNow she twerking she throw it out and come back inThat’s my bestfriend she a real bad bitchDrive her own car she don’t need no lyftIn the strip club know my girl gone tipNow she twerking throw it out and come back inThat’s my bestfriend if you need a freakI aint dumb but mothafucka she my Tweedle DIf she ride for me she don’t need a keyIf you sideways she’ll straighten you as needed beAnd she so bad that I just can’t take that bitch nowhereShe off her fish I said uh uh don’t go thereBitch break her back she protect and attackGet that strap let them buckleFoot on neck give no airWhole world wanna be usMy main bitch she my day 1On my way bitch letcha get drunkCelebrate cause we the baddest in the clubThat’s my bestfriend she a real bad bitchGot her own money she don’t need nigOn the dance floor she had two three drinksNow she twerking she throw it out and come back inThat’s my bestfriend she a real bad bitchDrive her own car she don’t need no lyftIn the strip club, know my girl gone tipNow she twerking throw it out and come back inBest friend you the baddest and you know itUh oh girl I think yo booty growingFck it up in the mirror hit them posesBest friend damn you mfn glowingBest friend damn yo wrist look like it’s frozenUh oh girl I think yo booty growingFck it up in the mirror hit them posesBest friend you mfn soulmate#Saweetie #DojaCat #BestFriend #PrettyBitchMusic"
"ZmDBbnmKpqQ","Olivia Rodrigo - drivers license (Official Video)","2021-01-08T05:00:22Z","UCxE5jEls-T0QtlTHT8lI1lw","OliviaRodrigoVEVO","10","21.14.01","Olivia|Rodrigo|drivers|license|Pop","21187646","1945967","13567","80173","https://i.ytimg.com/vi/ZmDBbnmKpqQ/default.jpg","False","False","Listen to ‘drivers license’ out now: https://smarturl.it/driverslicenseFollow Olivia Rodrigo:Instagram: https://instagram.com/olivia.rodrigoTwitter: https://twitter.com/Olivia_RodrigoFacebook: https://www.facebook.com/OliviaRodrigoOfficialYouTube: https://youtube.com/oliviarodrigomusicTikTok: https://tiktok.com/@livbedumbStore: https://smarturl.it/oliviarodrigoshopMusic video by Olivia Rodrigo performing drivers license. © 2021 Olivia Rodrigo, under exclusive license to Geffen Records"
"9Wa9xY88WF8","My Daughter's Emotional Goodbye To Gymnastics 💔","2021-01-07T17:00:10Z","UCKaCalz5N5ienIbfPzEbYuA","Jordan Matter","24","21.14.01","salish matter|jordan matter|gymnastics|gymnast|goodbye|gym|flexibility|bendy|contortion|giants|kip|galaxy gymnastics","3756856","98390","2237","0","https://i.ytimg.com/vi/9Wa9xY88WF8/default.jpg","True","False","My daughter is moving 3,000 miles away, and in this video she says an emotional goodbye to her gymnastics team. SUBSCRIBE! You could win a photo shoot, a zoom call, merch and more! https://www.youtube.com/user/jordanmatter?sub_confirmation=1Salish has done lots of videos with me. She adopted a puppy 10-Year-Old Has Only 10 Minutes to ADOPT A PUPPY *Emotional* https://youtu.be/kzpW0Y7A8F4. She took on a bodybuilder BODYBUILDER vs MY DAUGHTER - Adorable Fitness and Gymnastics Challenge https://youtu.be/c65wnT5hM5w. And learned contortion from Sofie Dossi Sofie Dossi Teaches My Daughter Contortion https://youtu.be/liPLR-RBskINEW MERCH: https://shopjordanmatter.comFollow us on Instagram:Me: https://www.instagram.com/jordanmatter/Salish: https://www.instagram.com/saysaymatter/Galaxy Gymnastics: https://www.instagram.com/galaxygymnasticsny/Sally Miller: https://www.instagram.com/sallymillerfash/Hudson: https://www.instagram.com/hudsonmatter/Video by Sandy ChaseAssistant Editor: Kelly ButlerBusiness Inquiries: info@jordanmatter.comMusic licensed through Epidemic SoundWow, if you're still reading you are awesome! BOOOMMMM!!"
"YVDJqipoohc","Jordan Klepper Sees It All at The Capitol Insurrection | The Daily Social Distancing Show","2021-01-12T20:31:40Z","UCwWhs_6x42TyRM4Wstoq8HA","The Daily Show with Trevor Noah","23","21.14.01","the daily show|trevor noah|daily show with trevor noah|the daily show episodes|comedy central|comedians|comedian|funny video|comedy videos|funny clips|noah trevor|trevor noah latest episode|daily show|trevor|news|politics|daily show trump|trevor noah trump|trump|coronavirus|jordan klepper|trump rally|donald trump|klepper fingers the pulse|joe biden|election|vote|2020 election|maga|protest|conspiracies|capitol|coup|coup d'etat|insurrection|washington|DC","4058403","125892","2428","15268","https://i.ytimg.com/vi/YVDJqipoohc/default.jpg","False","False","Pitchforks, Proud Boys, and a one-man “Tyranny Response Team.” Jordan Klepper saw it all at the Capitol insurrection. #DailyShow #JordanKlepper #CapitolSubscribe to The Daily Show:https://www.youtube.com/channel/UCwWhs_6x42TyRM4Wstoq8HA/?sub_confirmation=1 Follow The Daily Show:Twitter: https://twitter.com/TheDailyShowFacebook: https://www.facebook.com/thedailyshowInstagram: https://www.instagram.com/thedailyshowWatch full episodes of The Daily Show for free: http://www.cc.com/shows/the-daily-show-with-trevor-noah/full-episodesFollow Comedy Central:Twitter: https://twitter.com/ComedyCentralFacebook: https://www.facebook.com/ComedyCentralInstagram: https://www.instagram.com/comedycentralAbout The Daily Show:Trevor Noah and The Daily Show correspondents tackle the biggest stories in news, politics and pop culture.The Daily Show with Trevor Noah airs weeknights at 11/10c on Comedy Central."
"WAMMiCe35-Y","A Terrified President Throws His Riot Mob Under A Bus To Save His Neck (And Get Back On Twitter)","2021-01-08T04:53:05Z","UCMtFAi84ehTSYSE9XoHefig","The Late Show with Stephen Colbert","24","21.14.01","The Late Show|Late Show|Stephen Colbert|Steven Colbert|Colbert|celebrity|celeb|celebrities|late night|talk show|comedian|comedy|CBS|joke|jokes|funny|funny video|funny videos|humor|hollywood|famous","8145571","184157","8499","27917","https://i.ytimg.com/vi/WAMMiCe35-Y/default.jpg","False","False","Facing threats of impeachment, and with calls for his resignation coming from even the conservative Wall Street Journal editorial board, the president on Thursday released a video in which he unconvincingly condemned the insurrection he incited, and begrudgingly admitted that a new administration would take office following an orderly transition of power on January 20th. #Colbert #ALateShow #MonologueSubscribe To The Late Show Channel HERE: http://bit.ly/ColbertYouTubeFor more content from The Late Show with Stephen Colbert, click HERE: http://bit.ly/1AKISnRWatch full episodes of The Late Show HERE: http://bit.ly/1Puei40Like The Late Show on Facebook HERE: http://on.fb.me/1df139YFollow The Late Show on Twitter HERE: http://bit.ly/1dMzZzGFollow The Late Show on Google+ HERE: http://bit.ly/1JlGgzwFollow The Late Show on Instagram HERE: http://bit.ly/29wfREjFollow The Late Show on Tumblr HERE: http://bit.ly/29DVvtRWatch The Late Show with Stephen Colbert weeknights at 11:35 PM ET/10:35 PM CT. Only on CBS.Get the CBS app for iPhone & iPad! Click HERE: http://bit.ly/12rLxgeGet new episodes of shows you love across devices the next day, stream live TV, and watch full seasons of CBS fan favorites anytime, anywhere with CBS All Access. Try it free! http://bit.ly/1OQA29B---The Late Show with Stephen Colbert is the premier late night talk show on CBS, airing at 11:35pm EST, streaming online via CBS All Access, and delivered to the International Space Station on a USB drive taped to a weather balloon. Every night, viewers can expect: Comedy, humor, funny moments, witty interviews, celebrities, famous people, movie stars, bits, humorous celebrities doing bits, funny celebs, big group photos of every star from Hollywood, even the reclusive ones, plus also jokes."
"Qah9sSIXJqk","KGF Chapter2 TEASER |Yash|Sanjay Dutt|Raveena Tandon|Srinidhi Shetty|Prashanth Neel|Vijay Kiragandur","2021-01-07T15:57:35Z","UCarJoVXH0T2pdtcHBu9J8Bw","Hombale Films","24","21.14.01","Hombale films|hombale|hombale films kannada|hombale films kgf 2|kgf 2|yash|prashanth neel|srinidhi shetty|kgf 2 teaser|kgf 2 update|kgf chapter 2|Sanjay Dutt|Raveena Tandon|Prakash Raj|Rocking Star Yash|kgf chapter 2 teaser|kgf|kgf2|kgf 2 kannada|yash kgf|kgf teaser|sanjay dutt adheera|prashant neel|rocky bhai|kgf updates|adheera sanjay dutt|yash birthday|yash movies|kgf chapter 2 trailer|kgf 2 trailer|kgf trailer|yash birthday celebration","146694231","7305734","62946","643394","https://i.ytimg.com/vi/Qah9sSIXJqk/default.jpg","False","False","Here We Go, Glimpse Into An Empire Called KGF and a Glance of Rocky's World.Hombale Films Presents the Official Teaser of KGF Chapter 2.Written and Directed by Prashanth NeelProduced by Vijay KiragandurStarring: Rocking Star Yash, Sanjay Dutt, Srinidhi Shetty, Raveena Tandon, Prakash Raj, Malvika Avinash, Achyuth Kumar, Ayyappa P. Sharma, Rao Ramesh, Eshwari Rao, Archana Jois, T. S. Nagabharana, Saran, Avinash, Lakki Lakshman, Vashishta Simha, Harish Rai, Dinesh Mangalore, Tarak, Ramachandra Raju, Vinay Bidappa, Ashok Sharma, Mohan Juneja, Govinda Gowda, John Kokken, Srinivas MurthyTurn on Subtitles in Your Preferred Language.Director of Photography: Bhuvan GowdaSound Design, Music & Background Score: Ravi BasrurDirection Team: Kirtan Nadagouda, Dhool Prakash, Bhargav N, Prashanth Hosmane, Chandan L, Yuvindraja, Nishanth Varma, Sanjay Muruli Muddenahally, Ghattimutthu Shashidhar, Abhijith Gorachi, Shiva Kumar, Mithilesh Gowda, Akash Thaargar, Akash Rambo, Farman UllahCameraman Team: Sandy, Prajwal Gowda, Kumar Gowda, Sagar Gowda, Manuraj  Still - M G Narayan(Nani)Executive Producer: Karthik Gowda, K. V Rama RaoEditor: Ujwal KulkarniProduction Design: ShivakumarAction: AnbarivChoreography: Harsha, MohanDubbing: Anand Y. SCostume Designer: Yogi G Raj, Sania Sardhariya, Navin Shetty, Ashwin Mawle, Hassan KhanDialogues: Chandramouli.M, Dr. Suri, Prashanth NeelSound Effects: Nanndhu J & TeamProduction Managers: K S Champakadama,Gagan Murthy, S KumarProduction Incharge: Chidanand, Suresh Shankarananhalli, ShashikanthDI & VFX: Unify MediaVFX Supervisor: Konda Reddy SureshColorist: Fergus Hally, AshwathMarketing: Likitha Reddy, Naren Marol, Anil Kumar, Shreya Unchalli, Manoj Shetty, Lakshmi NarayanDigital Media PR: Prasad BhimanadhamArt Department: Venkata Chalapathi, Kiran Kumar, Ramesh, Shankar, Sunil, Deva, Abhi, Shyam, Koti, GouthamFemale Humming Solo Voice: Ananya BhatChorus Singers Batch A: Ravi Basrur, Sachin Basrur, Krishna Basrur, Nagaprakash Kota, Rajesh Kergal, Ramakrishna Basrur, Umesh Karkada, Chethan ChimmanahalliChorus Singers Batch B: Krishna Murthi Basrur, Karthik Madhur, Varadharaj Harman, Nikhil BasrurBhargav Guppi, Bhargav Jogi, Aaron Rahul, Johnson JoshuaMusic Mix & Mastered at : Ravi Basrur Music & Movies Basrur#KGFChapter2 #KGFChapter2Teaser #HombaleFilms #RockingStarYash #KGF2For More Updates:YouTube: https://www.youtube.com/HombaleNinnindale?sub_confirmation=1Facebook: https://www.facebook.com/HombaleFilms/Twitter: https://www.Twitter.com/hombalefilmsInstagram: https://www.instagram.com/hombalefilms"
"c6j1l-MICZk","Jimmy Kimmel on Angry Trump Mob Storming the Capitol","2021-01-07T05:08:43Z","UCa6vGFO9ty8v5KZJXQxdhaw","Jimmy Kimmel Live","23","21.14.01","jimmy|jimmy kimmel|jimmy kimmel live|late night|talk show|funny|comedic|comedy|clip|comedian|mean tweets|Pandemic|Coronavirus|COVID-19|Social Distancing|Quarantine|Monologue|Donald Trump|Georgia|Runoff election|POTUS|Mike Pence|Mitch Mcconnell|Jon Ossoff|Kelly Loeffler|2020 Election|Trump Rally|Capitol|Election results|Protest|BLM|Washington DC|Politics|DJTJ|Ted Cruz","8343350","185999","19283","27816","https://i.ytimg.com/vi/c6j1l-MICZk/default.jpg","False","False","Jimmy gives his thoughts on the angry mob of Trump supporters storming the capitol building in Washington D.C. today, Mike Pence shutting down Donald Trump’s request to determine which electoral votes should be counted and which shouldn’t, Senators Ted Cruz, Josh Hawley and others keeping this stolen election charade going, Democrats gaining control of the Senate after a double victory in Georgia’s runoff election, Donald Trump Jr. and Eric Trump going after the Republican establishment, and we revisit Trump’s inauguration speech with the benefit of hindsight. SUBSCRIBE to get the latest #Kimmel: http://bit.ly/JKLSubscribeWatch Mean Tweets: http://bit.ly/KimmelMT10Connect with Jimmy Kimmel Live Online:Visit the Jimmy Kimmel Live WEBSITE: http://bit.ly/JKLWebsiteLike Jimmy Kimmel on FACEBOOK: http://bit.ly/KimmelFBLike Jimmy Kimmel Live on FACEBOOK: http://bit.ly/JKLFacebookFollow @JimmyKimmel on TWITTER: http://bit.ly/KimmelTWFollow Jimmy Kimmel Live on TWITTER: http://bit.ly/JKLTwitterFollow Jimmy Kimmel Live on INSTAGRAM: http://bit.ly/JKLInstagramAbout Jimmy Kimmel Live:Jimmy Kimmel serves as host and executive producer of Emmy®-nominated “Jimmy Kimmel Live!,” ABC’s late-night talk show. “Jimmy Kimmel Live!” is well known for its huge viral video successes, with over 11 billion views and more than 15 million subscribers on the show’s YouTube channel. Some of Kimmel’s most popular comedy bits include “Celebrities Read Mean Tweets,” “Lie Witness News,” “Unnecessary Censorship,” “Halloween Candy YouTube Challenge,” and music videos like “I (Wanna) Channing All Over Your Tatum.”"
"_EQfUbE4bL8","LIVE ANALYSIS | Congress resumes electoral vote count","2021-01-07T11:04:33Z","UCHd62-u_v4DvJ8TCFtpi4GA","Washington Post","25","21.14.01","election certification|senate|josh hawley|ted cruz|mike pence|republican challengers|joe biden|electoral college|congress|joint session|breaking news video|video updates|live video|live updates|breaking news|press conference|live speeches|real time coverage","2797019","11504","3977","0","https://i.ytimg.com/vi/_EQfUbE4bL8/default.jpg","True","False","Protesters pressed past police and broke into the U.S. Capitol as Congress met in a joint session on Jan. 6 to count each state’s electoral votes and confirm President-elect Joe Biden as the winner. As many as three dozen congressional Republicans were expected to launch a final challenge to the results of the 2020 presidential election.It has become routine after recent elections for House lawmakers on the losing side to put up a symbolic fight over the results, which they can do under an 1880s law governing the process. It has been less common for senators to join them, but this time a dozen will. Sens. Josh Hawley (R-Mo.) and Ted Cruz (R-Tex.) will lead the challenge of the votes and call for an “emergency audit” to investigate baseless fraud allegations.The Post’s Libby Casey will anchor live coverage, featuring reporters Aaron Blake, Rhonda Colvin, James Hohmann and Amber Phillips. Read more: https://wapo.st/3ohQZCg. Read more: https://wapo.st/3ohQZCg. Subscribe to The Washington Post on YouTube: https://wapo.st/2QOdcqKFollow us:Twitter: https://twitter.com/washingtonpostInstagram: https://www.instagram.com/washingtonpost/Facebook: https://www.facebook.com/washingtonpost/"
