video_id,title,publishedAt,channelId,channelTitle,categoryId,trending_date,tags,view_count,likes,dislikes,comment_count,thumbnail_link,comments_disabled,ratings_disabled,description
"3yfF85HuJuE","Virtual Pub Quiz, Live! Saturday 9th January","2021-01-09T21:51:40Z","UCLcSqjJWHJeDWD_SbdorBRw","Jay's Virtual Pub Quiz","24","21.11.01","Virtual Pub Quiz|Pub quiz|virtual quiz|quiz|online quiz|online virtual quiz|online virtual pub quiz|Jay Flynn|jays virtual pub quiz|#withme #stayhome|with me|stay home","36659","145","20","27","https://i.ytimg.com/vi/3yfF85HuJuE/default.jpg","False","False","Live stream from 7:50 and first question at 8:15 as always! Mentioned in the stream tonight:Chocolate: https://tinyurl.com/jayadvent 10% = JAY10Teemill: https://jays-virtual-pub-quiz.teemill.com/PrezzyBox: https://www.prezzybox.com/jay 10%= JAYOurs socials,Facebook: https://www.facebook.com/thevirtualpubquiz/ Twitter: https://twitter.com/TheVirtualPubQ1 Instagram: https://www.instagram.com/thevirtualpubquiz/ Patreon: https://www.patreon.com/thevirtualpubquizDiscord: https://discord.gg/3PbQryKyh6Support from:Quiz Jockey: https://quizjockey.com/Scan: https://www.scan.co.ukQuizmaster Biz: https://www.quizmasters.biz/The Bookhttps://www.amazon.co.uk/Jays-Virtual-Pub-Quiz-Book/dp/1913406407/Stay SafeJay"
"iW2d54YW32I","Kim Kardashian & Kris Jenner's Plans for the Future | KUWTK Bonus Scene | E!","2021-01-09T15:59:49Z","UC8oimTPVHKiC7oL3QgdKbgg","Keeping Up With The Kardashians","24","21.11.01","Entertainment|Kardashians|Top Stories|Kim Kardashian|Kris Jenner|E! Shows|Bonus|TV|Reality TV|Coronavirus|Kourtney Kardashian|Kanye West|Scott Disick|Keeping Up with the Kardashians|Kardashian|KUWTK|family|Kendall Jenner|Kylie Jenner","372887","6606","143","328","https://i.ytimg.com/vi/iW2d54YW32I/default.jpg","False","False","While stuck in isolation due to the coronavirus pandemic, Kim & Kris discuss the baby bar exam and fears of greeting fans in public. Keep up with this KUWTK bonus scene!#KUWTK #KeepingUpWithTheKardashians #EEntertainment #KimKardashian #KhloéKardashian #KourtneyKardashian #KylieJenner #KendallJenner #KrisJennerSUBSCRIBE: http://www.youtube.com/kuwtkAbout Keeping Up With the Kardashians:Keeping Up with the Kardashians” takes viewers beyond the headlines and into the stories that dominate the news cycle and E! is the only destination to get the real story. Keep Up with the Kardashian-Jenner fam as they build business empires, face personal challenges, and share ups and downs together. Through all the epic moments, one thing remains the same… family always comes first. The Kardashian-Jenner clan continue to overcome it all through their unwavering love and commitment to each other.Keeping Up With The Kardashians Returns 2021Connect with the Kardashians:Visit the KUWTK WEBSITE: http://bit.ly/KUWTKwebLike KUWTK on FACEBOOK: http://bit.ly/KUWTKfb Follow KUWTK on TWITTER: http://bit.ly/KUWTKtwtr About E! Entertainment:E! is on the Pulse of Pop Culture, bringing fans the very best original content including reality series, topical programming, exclusive specials, breaking entertainment news, and more. Passionate viewers can’t get enough of our Pop Culture hits including Keeping Up with the Kardashians, Total Divas,” and “Very Cavallari.” And with new original programming on the way, fans have even more to love.Download The E! News App For The Latest Celebrity News and Trending Videos: https://eonline.onelink.me/yMtl/4ead5017Keeping Up With The Kardashians. Stream now on Peacock. http://bit.ly/KUWTKonPeacockConnect with E! Entertainment:Visit the E! WEBSITE: http://eonli.ne/1iX6d8nLike E! on FACEBOOK: http://on.fb.me/1fzeamgCheck out E! on INSTAGRAM: https://www.instagram.com/eentertainmentFollow E! on TWITTER: https://twitter.com/eentertainmentKim Kardashian & Kris Jenner's Plans for the Future | KUWTK Bonus Scene | E!http://www.youtube.com/kuwtk"
"itWEMxATuJk","The sharkboy and lavagirl sequel that no one asked for","2021-01-08T19:25:26Z","UCTSRIY3GLFYIpkR2QwyeklA","Drew Gooden","23","21.11.01","drew gooden|comedy|commentary|reaction|vine|drew gooden vine|road work ahead guy|parody|rant|cringe","2783968","178884","2588","15854","https://i.ytimg.com/vi/itWEMxATuJk/default.jpg","False","False","Sponsored by HelloFresh. Use code 10IMALITTLESTINKER to get 10 FREE MEALS across your first 4 HelloFresh boxes, including free shipping on your first box at https://bit.ly/3nJLaNUthis movie was made for nobody.outro music:stage kids - welcome to the junglemerch:https://www.drewgoodenshop.com/follow me:twitter - https://www.twitter.com/drewisgoodeninstagram - https://www.instagram.com/drewisgooden"
"YSy2lBZ1QrA","WizKid - Ginger (Official Video) ft. Burna Boy","2021-01-08T14:00:07Z","UCE0-Bxu88d4bsGCv34zvtbA","WizkidVEVO","10","21.11.01","Ginger|Starboy/RCA Records|WizKid feat. Burna Boy|World Music","1758917","104102","2169","9525","https://i.ytimg.com/vi/YSy2lBZ1QrA/default.jpg","False","False","Music video by WizKid performing Ginger (Official Video). (C) 2020 Starboy Entertainment Ltd., under exclusive license to RCA Recordshttp://vevo.ly/9d5X8H"
"3j9xiJ9LxNo","Peter Andre: I'm Positive...","2021-01-08T18:00:00Z","UCxIZnBj4n6DCSWrIW9CCE4Q","The Andres","24","21.11.01","Peter Andre|Life with the Andres|The Andres|Princess Andre|Junior Andre|Emily MacDonagh|Dr Emily MacDonagh|Theodore Andre|Amelia Andre|Family|Andre|virus|covid|corona|coronavirus|covid 19|covid-19|positive|testing|test|positive test|experience|living with|ill|vaccine","376996","5268","221","1157","https://i.ytimg.com/vi/3j9xiJ9LxNo/default.jpg","False","False","Hey everyoneI hope that you're all staying safe out there. In this video I documented my experience with the virus...Thanks for the support so far on the channel! We're having so much fun making each video for you guys! Remember to click LIKE and SUBSCRIBE! Ring the bell as well so you don't miss out on future videos!Brand enquires: claire@thecangroup.co.ukMusic: Epidemic Sound"
"VqqHH71SHdo","Neighbours Called Him Crazy, But He Had the Last Laugh","2021-01-08T19:00:05Z","UCkQO3QsgTpNTsOw6ujimT5Q","BE AMAZED","27","21.11.01","beamazed|be amazed|top 10","1067483","28449","864","1310","https://i.ytimg.com/vi/VqqHH71SHdo/default.jpg","False","False","Coming up are some amazing stories about people who protected their home in amazing ways.Suggest a topic here to be turned into a video: http://bit.ly/2kwqhuhSubscribe for more! ► https://goo.gl/pgcoq1 ◄Stay updated ► https://goo.gl/JyGcTt https://goo.gl/5c8dzr ◄ For copyright queries or general inquiries please get in touch: hello@beamazed.comLegal Stuff.Unless otherwise created by BeAmazed, licenses have been obtained for images/footage in the video from the following sources: https://pastebin.com/sDha7AGa"
"lRZwrzczo7Q","I Built a SECRET Hidden Gaming Room in my House!","2021-01-08T18:31:30Z","UCilwZiBBfI9X6yiZRzWty8Q","FaZe Rug","24","21.11.01","faze rug|rug|rugfaze|fazerug|secret room|hidden room|secret hidden room|secret room in my house|hidden room in my house|secret gaming room|gaming room|secret hidden gaming room|i built a secret gaming room|i built a gaming room|i built a hidden gaming room|hidden gaming room","3607566","434450","4762","41526","https://i.ytimg.com/vi/lRZwrzczo7Q/default.jpg","False","False","THIS IS THE CRAZIEST GAMING ROOM EVER!We found a secret hidden room in my house and turned it into the ULTIMATE gaming room!🔴 SUBSCRIBE FOR LIT VIDEOS ► http://bit.ly/SubToRug🔵 Try my G FUEL Flavor!! ► https://gfuel.ly/use-code-rug GO SPAM MY OTHER PAGES!!Instagram ► https://www.instagram.com/fazerug/TikTok ► https://www.tiktok.com/@rugTwitter ► https://twitter.com/FaZeRugSnapchat ► thefazerug"
"5i8LuEjb5MU","Des Moines man seen rioting at US Capitol booked into Polk County Jail","2021-01-10T00:25:27Z","UCKATGvvbOznaWNZcOBCLGng","KCCI","25","21.11.01","Des Moines","374152","4285","415","2399","https://i.ytimg.com/vi/5i8LuEjb5MU/default.jpg","False","False","Des Moines man seen rioting at US Capitol booked into Polk County JailSubscribe to KCCI on YouTube now for more: http://bit.ly/QY3wuMGet more Des Moines news: http://www.kcci.comLike us: http://facebook.com/kcci8Follow us: http://twitter.com/KCCINewsInstagram: https://www.instagram.com/kcci8/"
"L4N4ZpC0XBA","Bugzy Malone - Notorious feat CHIP (Official Video)","2021-01-07T19:00:10Z","UCLd_hRzn-yr9Nh73XNviNWg","Bugzy Malone","10","21.11.01","Bugzy Malone|Bugzy Malone Notorious|Bugzy Malone new video|Notorious feat Chip|Chip|The Resurrection new album|UK Hip Hop","837257","41724","986","3121","https://i.ytimg.com/vi/L4N4ZpC0XBA/default.jpg","False","False","Stream/Download Notorious (ft. CHIP) now: https://bugzymalone.lnk.to/NotoriousID Pre-order/Pre-save the forthcoming album The Resurrection, out on 12th February 2021, here: https://BugzyMalone.lnk.to/TheResurrectionID  Visit the official store for music, clothing and exclusives: https://BugzyMalone.lnk.to/TheResurrectionIDofficialArtistStoreFor Bugzy Malone merchandise, tour dates, events and music - https://BugzyMalone.lnk.to/SocialsID/ArtistStoreB Malone clothing line - https://BugzyMalone.lnk.to/SocialsSo/ArtistStore2---SOCIAL MEDIA---Twitter - https://BugzyMalone.lnk.to/SocialsID/TwitterInstagram - https://BugzyMalone.lnk.to/SocialsID/InstagramFacebook – https://BugzyMalone.lnk.to/SocialsID/FacebookSoundcloud - https://BugzyMalone.lnk.to/SocialsID/SoundcloudSnap Chat – Bugzy_MaloneBookings - bugzymaloneteam@gmail.com"
"_xJUCsyMQes","Saweetie - Best Friend (feat. Doja Cat) [Official Music Video]","2021-01-07T23:00:20Z","UC2FCUwThC0RAzaQoI0TtpLA","Official Saweetie","22","21.11.01","saweetie|sweetie|tap in|my type|icy grl|icy girl|female hip hop|female rapper|hip hop|R&B|Doja Cat|Featuring Doja Cat|That's my best friend|Best Friend|Best Friend Saweetie Doja Cat|best friend thats my bestfriend lyrics|best friend tiktok|doja cat saweetie song|doja cat saweetie best friend mp3|saweetie ft doja cat|doja cat x saweetie type beat|dojacat|best friend video|best friend song|she's a real bad bitch","16411696","427076","22425","24153","https://i.ytimg.com/vi/_xJUCsyMQes/default.jpg","False","False","Download/Stream Best Friend (feat. Doja Cat): https://Saweetie.lnk.to/BestFriend❄️ICY GANG❄️Tap in with Saweetie to gain exclusive access to the next episode first! Text +1 (510) 250-3890 Follow SaweetieOfficial Website: www.saweetie.comTwitter: https://twitter.com/saweetieFacebook: https://www.facebook.com/OfficialSaweetieInstagram: https://www.instagram.com/saweetie/Credits: Starring: Saweetie, Doja Cat, & King BachDirected by Dave MeyersExecutive Producer: Nathan ScherrerProduced by Roisín Audrey MoloneyProduction Supervisor: Tori StoroshProduction Company: Freenjoy Saweetie Costume Design: Bryon JavarDoja Cat Costume Design: Brett Alan Nelson Director of Photography: Joshua Zucker- PludaProduction Designer: Alec Contestabile Cast Costume Design: Ann-Marie HoangEditor: Alyssa Oh @ Rock Paper ScissorsColorist: Stefan Sonnenfeld @ Company 3VFX: Buf ParisSound Design: Jeff Malen @ Lime Studios 00:42 Lyrics:That’s my bestfriend she a real bad bitchGot her own money she don’t need nigOn the dance floor she had two three drinksNow she twerking she throw it out and come back inThat’s my bestfriend she a real bad bitchDrive her own car she don’t need no lyftIn the strip club know my girl gone tipNow she twerking throw it out and come back inBeep beep is that my bestie in a tesiFresh blow out skin on 10 owe she readyBitch you look goodt with a t at the endImma hype her every time that’s my mothafuckin friendShe been down since the jellies and the bo bo’sNow we steppin out the G in manolo’sWhen we pull up to scene hoes be filled with jealousyIf a bitch get finicky she gone bring that energyI hit her phone with the tea like bitch guess whatAll the rich ass boys wanna fuck on usAll this ass sittin up you can look don’t touchAnd I’m bad bussin bands every time we link upThat’s my bestfriend she a real bad bitchGot her own money she don’t need nigOn the dance floor she had two three drinksNow she twerking she throw it out and come back inThat’s my bestfriend she a real bad bitchDrive her own car she don’t need no lyftIn the strip club know my girl gone tipNow she twerking throw it out and come back inThat’s my bestfriend if you need a freakI aint dumb but mothafucka she my Tweedle DIf she ride for me she don’t need a keyIf you sideways she’ll straighten you as needed beAnd she so bad that I just can’t take that bitch nowhereShe off her fish I said uh uh don’t go thereBitch break her back she protect and attackGet that strap let them buckleFoot on neck give no airWhole world wanna be usMy main bitch she my day 1On my way bitch letcha get drunkCelebrate cause we the baddest in the clubThat’s my bestfriend she a real bad bitchGot her own money she don’t need nigOn the dance floor she had two three drinksNow she twerking she throw it out and come back inThat’s my bestfriend she a real bad bitchDrive her own car she don’t need no lyftIn the strip club, know my girl gone tipNow she twerking throw it out and come back inBest friend you the baddest and you know itUh oh girl I think yo booty growingFck it up in the mirror hit them posesBest friend damn you mfn glowingBest friend damn yo wrist look like it’s frozenUh oh girl I think yo booty growingFck it up in the mirror hit them posesBest friend you mfn soulmate#Saweetie #DojaCat #BestFriend #PrettyBitchMusic"
"mflha5K0zA0","Help, I'm turning into a professional Freestyler","2021-01-08T18:30:10Z","UC3F1oQH65fdRrWPgvJDQTMQ","MERTZY","20","21.11.01","rocket league|rocket league funny|rocket league freestyle|rocket league challenge|salty opponent|toxic player|toxic opponent|randomizing|ballchaser|tryhard|tournament|osm|rlcs|rlrs|esports|freestyle|ceiling shot|jzr|jhzer|freestyle friday|flip reset|reset|heat seeker|heat seeker freestyle|fastest|best freestyle|top freestyle|freestyler|mertzy osm|osm freestyle|ceiling|pulse|temple|fire|pulse fire|funny moments|psycho|teamplay|aerial|compilation|clip|pulse mk","800900","41363","327","3148","https://i.ytimg.com/vi/mflha5K0zA0/default.jpg","False","False","The 7th best Freestyler is back in town, and this time he's here to dominate 2021. Back with another stacked guests list, surely this can't go wrong.► Subscribe to the channel:https://www.youtube.com/MERTZY► Follow the peeps in the video:@Pulse OSM @Pulse Temple  @Pulse Fire  @JZR @Pulse MK. ⯆ Follow me on my socials:Instagram: https://www.instagram.com/themertzyTwitter: https://twitter.com/MertzyRLDiscord: https://discord.gg/MERTZYTwitch: https://twitch.tv/MERTZYProduction Music courtesy of Epidemic Sound: http://www.epidemicsound.com"
"VSpgaN3wuag","ZAYN - Vibez (Official Video)","2021-01-08T17:00:08Z","UCy5FUarBYUHFpPtYVuvzgcA","ZaynVEVO","10","21.11.01","zayn|vibez|zayn vibez|vibez video|new zayn video|#vibez|zayn malik|better|zayn better|better video|zayn gigi|gigi|gigi hadid|zayn 2020|zayn lyrics|zayn video|inzayn|new zayn music|new zayn song|zayn live|pillowtalk|zayn pillowtalk|zayn flames|dusk till dawn|zayn dusk till dawn|zayn sia|whole new world|zayn aladdin|i don’t wanna live forever|zayn taylor swift|zayn let me|entertainer|enertainer video|snakehips","7783742","851612","10682","61790","https://i.ytimg.com/vi/VSpgaN3wuag/default.jpg","False","False","#ZAYN // “Vibez” // Out Now: https://smarturl.it/zVibezNobody Is Listening // 1.15.21 // Pre-Order: https://smarturl.it/zNIL 🎧Put your headphones on to listen in immersive 360 Reality Audio🎧Director: Ben MorProducer: Melissa Llewellyn-AlstonProduction Company: London Alley Entertainment Inc. Watch the official video for “Better”: https://smarturl.it/xBetterx/youtube Listen to more music from Zayn: https://zayn.lnk.to/listenYD  “Vibez” was mixed with an immersive #360RA experience in mind, use headphones for the full effect.Stream “Vibez” in full 360 Reality Audio, now available on Tidal, Amazon and Deezer.Register at the link below to redeem your 3-month free trial!Visit: https://cutt.ly/music_com_Zayn*Quantities are limited, while supplies lastSubscribe to ZAYN’s channel for more content: https://smarturl.it/ZAYNytSubscribe    Follow ZAYN:▶https://www.facebook.com/zayn▶https://www.instagram.com/zayn▶https://twitter.com/zaynmalik___“Vibez”Don’t keep me waiting I’ve been waiting all night to get closerAnd you already know I got it for yaYou know the vibes, know the vibesPut it on ya If we’re moving too fast we can slow up Baby, this far from mediocre no You know the vibes, know the vibes It’s you and me Here in this room Imagining things we could do Won’t tell no lies, no lies to you I need you here, I need you here Mind running wild We touching slow Just say the word, I’m ready to go Anticipation plays after 4 I need you now oh  Baby I’mma get you right, I will When I touch you tell me how it feel Trust me, I’mma make it feel surreal Baby Mind Of Mine I’mma do all the things Type of things that happen in your dreams Get you right where you need to be Just don't keep me Don't keep me waiting I’ve been waiting all night to get closer And you already know I got it for yaYou know the vibes, know the vibes Put it on ya If we’re moving too fast, we could slow up Baby, this far from mediocre no You got the vibes, got the vibes  Baby I’mma get you right, I willWhen I touch you tell me how it feel Trust me, I’mma make it feel surrealBaby Mind of MineI’mma do all the things Type of things that happen in your dreamsGet you right where you need to be Just don't keep me  Don’t keep me waiting I’ve been waiting all night to get closer Yeah you already know I got it for yaYou know the vibes, know the vibesPut it on yaIf were moving to fast, we could slow up Baby, this far from mediocre no You got the vibes, got the vibes#zayn #vibez #360RA"
"B6bJ_vTslyo","The last episode of the “Life Series”: The life of white radish!一生系列产品最后一个视频——萝卜的一生丨Liziqi Channel","2021-01-09T11:45:17Z","UCoC47do520os_4DBMEFGg4A","李子柒 Liziqi","26","21.11.01","liziqi|liziqi vlogger|中國美食|中華傳統文化|Chinese food|饮食文化|中国风|田园|美食|ly tu that|李子柒|lý tử thất|李子柒 最新|李子柒 2020|李子柒 一生系列|李子柒 更新|萝卜的一生","3208465","184412","24466","71578","https://i.ytimg.com/vi/B6bJ_vTslyo/default.jpg","False","False","Please  subscribe to 【李子柒 Liziqi 】Liziqi Channel on YouTube if you like my videos: https://goo.gl/nkjpSx #李子柒#lýtửthấ#Liziqi#ChineseCuisine #ChineseFoodMake pickles on Minor Snow, and cured meat on Major Snow. The freezing wintry days summon the lunar new year. Isn’t it the best time to pickle the food you have around!Pickled mustard tuber, dried white radish, preserved chicken, meat, and sausages…Hang them up!Do you know how white radish flowers wither and leave their seeds deep in the ground;And how the little ones sprout and grow up into full, long tuberous roots?This is the last episode of the “Life Series”, And farewell to “The life of …”小雪腌菜，大雪腌肉。寒冬腊月的，年关将近。可不就是各种腌嘛！榨菜头 萝卜干、腊鸡  腊肉  香肠通通挂起来！萝卜怎么落花成籽，怎么埋种地下。怎么发芽，又是如何长大……这是《一生系列》的最后一个视频了，XX的一生，就停在这里了吧！ 【李子柒 Liziqi 】 https://goo.gl/nkjpSx--------------------------------------------------------------------liziqi李子柒更多精彩视频推荐/More wonderful video recommendations：liziqi李子柒精选视频/decent video selection：https://is.gd/qe9xuc李子柒●花开有声 | Soud of blooming flowers： https://is.gd/tyr1ja李子柒 ●饮食以节 | Chinese festival food： https://is.gd/3LsFnu李子柒 ●适时而食 | Seasonal diet： https://is.gd/JmLJH3东方非遗传承 | Oriental intangible cultural heritage ： https://is.gd/atatyo传统工艺 | Traditional handicraft： https://is.gd/FPl4dfSpring 春之卷：https://is.gd/EBwo2nSummer 夏之卷：https://is.gd/i1jJ46Autumn 秋之卷：https://is.gd/YBVeL2Winter 冬之卷：https://is.gd/3JqW8D#李子柒#liziqi"
"C7Tl7Zn-KRE","The Hoonicorn's Last Ride? Ken Block's Final Drive in the 1400hp AWD Mustang Hoonicorn V2","2021-01-08T18:00:03Z","UCpCJ0y-_y03qPlG4zrYAAvQ","Ken Block","2","21.11.01","Ken Block|hoonicorn|Ken Block leaves Ford|Hoonicorn Vs The World|Hoonicorn Vs.|gymkhana|Ken Block Retirement|Ken block Mustang|Ken Block Fired|Climbkhana|twin turbo mustang|Hoonigan|hoonigan racing|RTR mustang","2347852","58085","1495","7250","https://i.ytimg.com/vi/C7Tl7Zn-KRE/default.jpg","False","False","Ken Block and Ford Motor Company’s exclusive partnership has brought in some real hardware over the past decade in rally and rallycross. 19 race wins plus 17 other podium finishes, 2 X Games medals, well over a billion video views across Block’s social media platforms, and the first ever World Rally Championship points scored for the brand by an American driver. As of January 2021, that exclusivity comes to an end, with Block becoming a free agent. And that means his options behind the wheel are now wide open. “Working  with Ford over the past decade has been awesome.” says Ken Block. “From racing all over the world, to accumulating  a half billion views from Gymkhana THREE to Gymkhana TEN, to creating the Emmy nominated series The Gymkhana Files for Amazon Prime - along with building a fleet of Fords including the iconic AWD Mustang Hoonicorn and F-150 Hoonitruck - it’s been a great partnership. It’s simply been a dream come true to work with the company that built the truck that my Dad drove when I was a teenager. I’m super appreciative to Ford for the support over the years, but I am also looking forward to what an unrestricted 2021 holds, and the ability to spread my wings a bit and play with a lot other toys.2020 was a big year for Block and his Ford vehicles. He took the overall win at Rally Barbados in a WRC2 Ford Fiesta, won his class (and 3rd overall) at Rally Legend in San Marino in his Ford Escort Cossie V2, and also won the first ever Projekt E race of the FIA World RallyCross Championship in Holjes, Sweden, in a Ford Fiesta. Along with winning races, Block and Hoonigan launched the all-new viral video series,- Hoonicorn Vs The World. Spanning 11 episodes, the series features Ken racing his 1965 Ford Mustang RTR Hoonicorn against a variety of wild vehicles including a McLaren Senna and the World’s Fastest Donk. The series has been viewed over 34 million times since its launch in late November. What does the next chapter have in store? Ken Block and Hoonigan Racing Division will be announcing new partnerships very soon. In the meantime, enjoy this video of Ken’s favorite Ford – the 1,400 horsepower AWD Mustang Hoonicorn V2 – get taken on its “last ride”."
"p-m0XnRHWMo","VFX Artists React to Bad & Great CGi 38 (ft. Andrew Kramer)","2021-01-09T17:00:31Z","UCSpFnDQr88xCZ80N-X7t0nQ","Corridor Crew","24","21.11.01","VFX|CGI|visual effects|vfx artists react|hollywood|movies|shot breakdown|behind the scenes|andrew kramer|videocopilot|the walking dead|DC comics|district 9|legends of tomorrow","1165892","69993","503","4042","https://i.ytimg.com/vi/p-m0XnRHWMo/default.jpg","False","False","The first 1,000 people to use this link will get a 2 month free trial of Skillshare Premium Membership: https://skl.sh/corridorcrew14CONSIDER SUBSCRIBING ► http://bit.ly/Subscribe_Corridor_CrewWatch Season 5 From Beginning ► https://bit.ly/Crew_Season_5This Episode ►The Crew is joined by VFX legend Andrew Kramer as they react to some of Hollywood's zestiest CGi moments: What makes a visual effect bad? What makes one great?For the highest quality VFX resources, check out out video copilot ► https://www.videocopilot.net/FOLLOW ►Instagram: http://bit.ly/_Corridor_InstagramSub-Reddit: http://bit.ly/_Corridor_Sub-RedditSUPPORT ► Join Our Website: https://bit.ly/Crew_MembershipBuy Merch: http://bit.ly/Corridor_StoreOUR GEAR & PARTNERS  ►Most Used Equipment: http://bit.ly/CorridorCrew_GearPerfect Camera: https://bhpho.to/2FJpQmRPuget Systems Computers: http://bit.ly/PC_Puget_WorkstationsActionVFX - https://bit.ly/TheBest_ActionVFXMUSIC ►Epidemic: http://bit.ly/Corridor_Music click this link for a free month!Check out Savants Music! ► http://bit.ly/Savant_Music"
"8dCSDdwtnQY","Arsenal v Newcastle United | Key Moments | Third Round | Emirates FA Cup 2020-21","2021-01-09T20:32:24Z","UCChcWqwYXCEs657MQ00qVWA","The Emirates FA Cup","17","21.11.01","arsenal|newcastle|arsenal v newcastle|arsenal highlights|newcastle highlights|fa cup|emirates fa cup|fa cup highlights|fa cup third round|third round|emirates fa cup third round|third round highlights|emile smith rowe|pierre emerick aubameyang|smith rowe goal|emile smith rowe arsenal|smith rowe fa cup goal|smith rowe goal vs newcastle","860542","9370","262","771","https://i.ytimg.com/vi/8dCSDdwtnQY/default.jpg","False","False","Arsenal host Newcastle united in the Emirates FA Cup third round tie.Follow @EmiratesFACup on Twitter for in-game highlights and match updates!https://twitter.com/emiratesfacupSubscribe:https://www.youtube.com/thefacupTo find out more about The Emirates FA Cup visit:TheFA.com/EmiratesFACupThe Emirates FA Cup on Facebookhttp://www.facebook.com/TheFACup"
