video_id,title,publishedAt,channelId,channelTitle,categoryId,trending_date,tags,view_count,likes,dislikes,comment_count,thumbnail_link,comments_disabled,ratings_disabled,description
"lTBz1Fx7DVw","Last To Get Knocked Out Wins iPhone 12 ft Beta Squad","2021-01-10T18:25:32Z","UC_8JxHQrJHC4rUsBtoPY4wQ","KingKennyTv","24","21.11.01","Last To Get Knocked Out Wins iPhone 12 ft Beta Squad|Beta Squad|Last to get knocked out wins PS5|Last to|Last to wins iphone 12 Pro|knocked out|chunkz|niko omilana|aj shabeel|johnny carey|sharky|kingkennytv|last to get knocked out wins|wins iphone 12|win iphone 12|Last to get knocked out|last to get|Last to get knocked out wins iPhone 12|iphone 12|iphone","274892","37159","257","2025","https://i.ytimg.com/vi/lTBz1Fx7DVw/default.jpg","False","False","Last To Get Knocked Out Wins iPhone 12 ft @Beta Squad In this video @Chunkz @Sharky @Johnny Carey @Aj Shabeel and myself all competed in a boxing tournament to win an iPhone 12 Pro Max. We also had the best referee of all time, @Niko Omilana LOL enjoy.Subscribe: http://bit.ly/SubscribeKingKennyFollow Me To Keep Updated!InstaGRAM : https://www.instagram.com/kingkennytv/Twitter : https://twitter.com/KingKennytvFacebook :https://www.facebook.com/KingKennyTv/Twitch : https://www.twitch.tv/kingkennytvSnapchat: SkullparkerFamily Friendly PG Clean"
"V8JW7sry17U","In The Tunnel at MAN UTD & Rashford Match Shirt Giveaway! | Away Days | Ben Foster - The Cycling GK","2021-01-10T18:00:17Z","UCi33DX7KG3M3bI0ipjOP2Eg","Ben Foster - The Cycling GK","17","21.11.01","Ben Foster|The Cycling GK|Old Trafford|Man UTD|ManU|MUFC|Manchester United|FA Cup|Watford FC|Rashford|Marcus Rashford|EPL|FA|OT|Scott McTominay Goal|Manchester United v Watford|Manchester United Highlights|FA Cup Highlights|Ben Foster Man Utd|Ben Foster Go Pro|Cycling GK|Cycling GK Man Utd|Oakley|Rapha|Kask|Garmin|Specialized|zipp|zip|zippspeed|SRAM","353059","27490","72","4224","https://i.ytimg.com/vi/V8JW7sry17U/default.jpg","False","False","Want to win Marcus Rashford's match shirt from this game!?!? Of course you do!!Click the links below, follow both Instagram accounts, like and comment on the Rashford shirt picture on either Instagram channel, and I’ll pick one lucky winner in two weeks time!Ben Foster on Instagram 👉 https://www.instagram.com/benfosters/The Cycling GK on Instagram 👉  https://www.instagram.com/thecyclinggk/The dream FA Cup draw!Manchester United away!Plenty of behind the scenes access from Old Trafford, in the tunnel, our temporary changing rooms, and even some Scott McTominay, who just happens to be a big Cycling GK fan!Out on my bike in the snow on the Friday, arriving at our team hotel, what we eat to prepare for the game and then on the coach on our way to the famous stadium.Thanks for watching!Ben Foster - The Cycling GKFull terms and conditions:We accept sole responsibility for the giveaway and it is in no way affiliated to YouTube.Entry was open to anyone who follows both Instagram accounts and commented on the Rashford picture, subscribed to the channel, and liked this video on my YouTube channel until the closing time of 24th Jan 2021No alternative prizes will be offered and the prize has no cash value.18+, UK only prize draw. One entry per person. Closes  24/01/21.https://www.garmin.com/en-GB/https://www.rapha.cc/gb/enhttps://www.specialized.com/gb/en"
"5Fg9oZk-5uA","I Bought Everything In 5 Stores","2021-01-09T21:01:25Z","UCX6OQ3DkcsbYNE6H8uQQuVA","MrBeast","24","21.11.01","[none]","22835114","2246620","13415","147771","https://i.ytimg.com/vi/5Fg9oZk-5uA/default.jpg","False","False","Please subscribe this video costed so much moneyBuy Merch Here!! - https://shopmrbeast.com/Beast Philanthropy - https://www.youtube.com/channel/UCAiLfjNXkNv24uhpzUgPa6ASUBSCRIBE OR I TAKE YOUR DOG╔═╦╗╔╦╗╔═╦═╦╦╦╦╗╔═╗║╚╣║║║╚╣╚╣╔╣╔╣║╚╣═╣ ╠╗║╚╝║║╠╗║╚╣║║║║║═╣╚═╩══╩═╩═╩═╩╝╚╩═╩═╝----------------------------------------------------------------follow all of these or i will kick you• Facebook - https://www.facebook.com/MrBeast6000/• Twitter - https://twitter.com/MrBeastYT•  Instagram - https://www.instagram.com/mrbeast--------------------------------------------------------------------"
"rY2xbodmGj8","SNEAKING Into A Movie Theater For 24 HOURS!","2021-01-10T16:00:32Z","UCwIWAbIeu0xI0ReKWOcw3eg","Unspeakable","22","21.11.01","unspeakable|vlog|vlogs|unspeakablegaming|prank|comedy|challenge|laugh|funny|moments|craziest|pranks|crazy|no cursing|no swearing|how to|parody|troll|video|react|family friendly|funniest|adventure|trolling|unspeakable vlogs|real life|life|unspeakable real life|unspeakableplays|movie theater|24 hour|overnight challenge|24 hour challenge|for kids|movie theater prank|24 hours","1805071","58312","2083","6644","https://i.ytimg.com/vi/rY2xbodmGj8/default.jpg","False","False","NEW MERCH! - https://www.unspeakable.com/Follow all of these or I will steal your cookies.INSTAGRAM 1 - http://instagram.com/unspeakableINSTAGRAM 2 - https://www.instagram.com/Unspeakableshop/TIK TOK -  https://vm.tiktok.com/tyG2Rd/TIK TOK 2.0 - https://www.tiktok.com/@unspeakablegameplaysFACEBOOK - https://www.facebook.com/UnspeakableVlogsFACEBOOK 2.0 - https://www.facebook.com/UnspeakableClothingSubscribe to my other channels or I will eat your computer.MINECRAFT - https://www.youtube.com/user/UnspeakableGaming?sub_confirmation=1EPIC GAMES - https://www.youtube.com/channel/UC1n_yB_W-FZCbwajZPcs8Jw?sub_confirmation=1VLOGS - https://www.youtube.com/channel/UCwIWAbIeu0xI0ReKWOcw3eg?sub_confirmation=1VLOGS 2.0 - https://www.youtube.com/channel/UCet_y01v87pE7MPGikjTQQw?sub_confirmation=1NEW MERCH - https://www.youtube.com/channel/UCBUOxKtRd79qLwkLTPsFCUA?sub_confirmation=1THE NOOB - https://www.youtube.com/channel/UCA1LBqaJbeRPyjL3LmHjwqQ?sub_confirmation=1Thanks for watching! Likes are greatly appreciated! Subscribe to be notified when my next video is live!"
"zV8SzNCJyJU","SEND IT or SMASH IT - ft. Lauren Alexis","2021-01-10T19:17:25Z","UCmpWLoKQBVd5YPz0cYan_Xg","Callux","24","21.11.01","callux","549814","56565","307","1449","https://i.ytimg.com/vi/zV8SzNCJyJU/default.jpg","False","False","Use code “CALLUX” for 20% off for the first 48 hours, 10% afterwards!RhinoShield All Cases: http://bit.ly/rscalluxRhinoShield Collab Designs: http://bit.ly/calluxrscollabLauren: https://twitter.com/LaurenAlexis_xhttps://www.instagram.com/laurenalexis_x/https://twitter.com/calluxhttps://instagram.com/callux__MY COMPANIES:notwowaysWebsite: http://www.notwoways.comInstagram: https://instagram.com/notwowaysTwitter: https://twitter.com/notwowaysAFTER PARTYWebsite: http://www.afterparty.studioTWITTER: https://twitter.com/AfterPartyLDNINSTA: https://www.instagram.com/afterpartystudios__If you see this comment saying ' OH BOI 'Business email: business @ callux.co.uk"
"ANcC-IrQn4Y","i got robbed £20,000 - they stole everything","2021-01-10T16:00:06Z","UC8noP549VXCDSUkrNzGPYPQ","touchdalight","24","21.11.01","I got|robbed|for|£20000|they|took|everything|left with nothing|storytime|story|touchdalight|millie t|ben morris|police|content|vlog|vlogging|I got robbed|someone broke into my house|live footage","117192","11065","300","649","https://i.ytimg.com/vi/ANcC-IrQn4Y/default.jpg","False","False","i now don't feel safe in my own house...great.･: My Social Medias ･: ~  merch - http://touchdalight.bigcartel.com/~ twitter - https://twitter.com/touchdalight~ instagram - http://instagram.com/touchdalight~ snapchat - carmie_sellitto~ tiktok - @touchdalightContact me personally (BUSINESS ONLY) - carminosellitto@gmail.com"
"snrPqH84tuc","I WAS ALL ALONE ON MY BIRTHDAY! (THEY FORGOT)","2021-01-09T22:36:42Z","UC56D-IHcUvLVFTX_8NpQMXg","Brent Rivera","24","21.11.01","[none]","3323919","226939","2788","41783","https://i.ytimg.com/vi/snrPqH84tuc/default.jpg","False","False","LIKE THIS VIDEO TO WISH ME A HAPPY BIRTHDAY :) Wanna be next week's shoutout!? like this video and comment 'done'✩new relatable hoodies !! ✩ www.relatableapparel.comSpecial Guests: @ANNA SHUMATE @Alexa Adams Follow the Gang!! The group channel: @Amp World    Ben Azelart -  @Ben Azelart Lexi Hensler @Lexi Hensler Stokes Twins: @Stokes Twins Lexi Rivera - @Alexa Rivera Jeremy Hutchins: @Jeremy Hutchins   Andrew Davila - @Andrew Davila  Dom Brack -  @Dominic Brack  Mason Fulp: @Mason Fulp   Pierson: @pierson Eva: @MyLifeAsEva  hang out with me on social media:SnapChat, Add me: TheBrentRiveraInstagram: @BrentRiveraTwitter: @BrentRiveraFacebook: @BrentRiveraTikTok: @BrentRiveraI have all rights to use this audio in this video according to Final Cut Pro's/YouTube's terms of use."
"fLVdSHCvRd4","Juventus 3-1 Sassuolo | Ramsey and Ronaldo strike late to help hosts up to fourth | Serie A TIM","2021-01-10T22:45:50Z","UCBJeMCIeLQos7wacox4hmLQ","Serie A","17","21.11.01","Ronaldo|Serie A|Dybala|highlights|Juventus|AC Milan|Inter Milan|Napoli|Roma|CR7|Cristiano Ronaldo|goals|full highlights|watch|stream|partita|migliori gol|migliori al mondo|gol del mese|federcalcio|calcio|Italia|lukaku|Lazio|zlatan|ibrahimovic|Ribery|Juventus Sassuolo|Pirlo|Danilo|Danilo goal|Ramsey Goal|Arsenal|Ramsey prem|ramsey juventus|ramsey goal|cristiano ronaldo goal|CR7 vs sassuolo|juventus highlights|matchid=A||2020-21||UNICO||UNI||17||JUVSAS","3342260","87858","1424","3069","https://i.ytimg.com/vi/fLVdSHCvRd4/default.jpg","False","False","CR7 goal secured Juventus’ 3-1 win over Sassuolo and was his 15th Serie A TIM goal this season (most in the league) | Serie A TIM This is the official channel for the Serie A, providing all the latest highlights, interviews, news and features to keep you up to date with all things Italian football.Subscribe to the channel here! https://bit.ly/2OM2Eax Find out more about the Serie A at: http://www.legaseriea.it/en/ Questo è il canale ufficiale della Serie A, dove potrai avere accesso ai momenti salienti, alle interviste, alle notizie e alle funzionalità del momento per rimanere aggiornato sulle ultime novità del campionato.Iscriviti qui al canale! https://bit.ly/2OM2EaxPer maggiori informazioni sulla Serie A: http://www.legaseriea.it/it"
"sJn8dG9iSaw","Among Us Logic 13 | Cartoon Animation","2021-01-10T00:00:08Z","UCToxKVrkEuAONR4rFIJ_DyQ","GameToons","1","21.11.01","among us|among us logic|animation|funny animation|cartoon animation|game toons|gametoons|cartoon|animated|among us new map|airship|among us animation|among us hacks|among us funny|kid friendly|family friendly|gt|revive","2494114","94923","2277","12744","https://i.ytimg.com/vi/sJn8dG9iSaw/default.jpg","False","False","They are AMONG US skin pack ➡️ https://cutt.ly/TheyAreAmongUsGameToons - video sponsored by Logdotzip► SUBSCRIBE to GameTunes! -https://www.youtube.com/channel/UCbbCaPmU-AvYQFMu6KCnyjw?sub_confirmation=1► Check out our MERCH! -https://newscapepro.com/collections/gametoons-1A new player enters the lobby and discovers a way to revive dead crewmates. Will Player join them and cheat in order to get his first victory? Featuring:🡆 Abigail Turner - https://www.abigailturnervo.com/Don't forget to like, comment, subscribe and share to show your support for this channel!Follow us here for all sorts of cool stuff!► STORE: https://newscapepro.com/collections/gametoons-1  👕👚🕶► INSTAGRAM: https://www.instagram.com/gametoonsofficial/?hl=en 📸► FACEBOOK: https://www.facebook.com/GameToonsYT 📘► TIK TOK: https://www.tiktok.com/@gametoonsofficial?lang=en 🎵► TWITTER: https://twitter.com/GameToons 🐤"
"AHmSPAjn4y0","We Have Something To Tell You...","2021-01-10T18:00:07Z","UCahx478FV8W0qz4LGTrs1CA","Brandonio","24","21.11.01","brandonio|brandonio sister|user friendly|brandonio challenge|brandonio girlfriend|we have something to tell you|brandonio new video|brandonio moving out|moving out|announcement|brandonio and erin bowyer|brandonio apartment|brandonio news","123959","8366","83","1237","https://i.ytimg.com/vi/AHmSPAjn4y0/default.jpg","False","False","We Have Something To Tell You...LEAVE A LIKE & COMMENT BELOW ONCE DONE & I'LL HEART YOUR COMMENT❤️NEW VIDEO EVERY SUNDAY 6PM (UK TIME)Make sure you SUBSCRIBE with ALL NOTIFICATIONS turned on so you can be on time to EVERY video🔔 Follow my journey and help me hit my dream of 1 Million Subscribers!!••••••••••••••••••••••••••••••••••••••••••••••••••••••••••••••••••••••••••••••••••••••MERCH STOREhttp://www.brandoniostore.com/•••••••••••••••••••••••••••••••••••••••••••••••••••••••••••••••••••••••••••••••••••••••ALL VIDEOS: https://www.youtube.com/watch?v=tThFKTTx1Ec&list=PL8Y4bbcq6EiLGPb8Wbxr460PRtECZaqjn•PRANKS: https://www.youtube.com/watch?v=lSd6alhwKQU&list=PL8Y4bbcq6EiJL45wwn9TlM9jnUMdLD9lH••••••••••••••••••••••••••••••••••••••••••••••••••••••••••••••••••••••••••••••••••••••FOLLOW MY SOCIALS FOR GOOD LUCK😉(I follow back a lot)• Instagram: Brandonio_ https://www.instagram.com/brandonio_/• Home Instagram: berinhome https://www.instagram.com/berinhome/?hl=en• Snapchat: BrandonioSnaps• Twitter: https://twitter.com/BrandonioTweets• TikTok: Brxndonio https://www.tiktok.com/@brxndonio?lang=en• Erins YouTube Channel: https://www.youtube.com/channel/UCsqPiQ5MVY9xCG9Dn1HppfQ• Erins Instagram: erinbowyer_ https://www.instagram.com/erinbowyer_/• Sisters Instagram: Holly_Bxnnxtt https://www.instagram.com/holly_bxnnxtt/••••••••••••••••••••••••••••••••••••••••••••••••••••••••••••••••••••••••••••••••••••••Business Enquiries:brandohvlogs@gmail.com••••••••••••••••••••••••••••••••••••••••••••••••••••••••••••••••••••••••••••••••••••••Thank you SO much for your support, every single one of you genuinely mean so much to me, I'll always appreciate what you do to support me & I'll always show my support back. YOU never go unnoticed trust me, what we have is so different & this is for life xuser friendly , family friendly , brandonioSTAY TRUE TO YOURSELF🙏🏻"
"72z7sr2ZLJs","Former Homeland Security head's advice following Capitol attack: Buckle up","2021-01-10T14:25:00Z","UCVT1tPkR-fUVlO652EcO3ow","CBS Sunday Morning","25","21.11.01","CBS Sunday Morning|CBS News|news|former homeland security|secretary michael chertoff|cbs news|david martin|trump supporters|police|electoral college","654186","9090","1610","4320","https://i.ytimg.com/vi/72z7sr2ZLJs/default.jpg","False","False","Former Homeland Security Secretary Michael Chertoff talks with CBS News national security correspondent David Martin about the failure of the Capitol Police to prevent armed Trump supporters from breaching a Joint Session of Congress, despite threats of violence posted on social media in the runup to the Electoral College vote tabulation.Subscribe to the CBS Sunday Morning Channel HERE: http://bit.ly/20gXwJTGet more of CBS Sunday Morning HERE: http://cbsn.ws/1PlMmAzFollow CBS Sunday Morning on Instagram HERE: http://bit.ly/23XunIhLike CBS Sunday Morning on Facebook HERE: https://www.facebook.com/CBSSundayMorning/Follow CBS Sunday Morning on Twitter HERE: http://bit.ly/1RquoQbGet the latest news and best in original reporting from CBS News delivered to your inbox. Subscribe to newsletters HERE: http://cbsn.ws/1RqHw7TGet your news on the go! Download CBS News mobile apps HERE: http://cbsn.ws/1Xb1WC8Get new episodes of shows you love across devices the next day, stream local news live, and watch full seasons of CBS fan favorites anytime, anywhere with CBS All Access. Try it free! http://bit.ly/1OQA29B---CBS Sunday Morning features stories on the arts, music, nature, entertainment, sports, history, science, Americana and highlights unique human accomplishments and achievements. Check local listings for CBS Sunday Morning broadcast times."
"ci5JZR3WWA8","19 Secret Minecraft Features You’ll Use Right Away","2021-01-10T16:33:18Z","UC3xZYc4SZUGfRERIvDRGqDQ","Skip the Tutorial","20","21.11.01","skipthetutorial|skip the tutorial|19 secret minecraft features you'll use right away|secret minecraft features|minecraft features you didn't know about|skip the tutorial minecraft|minecraft|minecraft 1.16 secret features|minecraft secret features|minecraft features|minecraft secrets|minecraft secrets you didn't know about|things minecraft doesn't tell you|things minecraft doesn't tell you about|minecraft f3 tricks|minecraft hidden features|minecraft secret","415876","25365","589","2120","https://i.ytimg.com/vi/ci5JZR3WWA8/default.jpg","False","False","19 Secret Minecraft Features You’ll Use Right Away! Minecraft doesn't tell you much about what to do in the game, so sometimes the best features can pass you by. In that case, let's go over some of the best 'hidden' or untold features in Minecraft 1.16 that you'll start using right away. From the sneaky F3 debug commands to the fastest way to grow your crops and more, let's see what features exist in minecraft that you maybe didn't know about in this Skip the Tutorial minecraft list video!▪Want more? Subscribe Today! ▶https://goo.gl/ZDDJit-OTHER LINKS-▪Follow me on Twitter ▶https://twitter.com/skipthetweets▪Join the Discord ▶https://discord.gg/eqxaSVH▪Check out my Twitch ▶https://www.twitch.tv/skipthetutorial▪Check out my Instagram ▶https://instagram.com/skipthephotos▪Character done by ChickenWithTie ▶https://goo.gl/wJ7879Footage collected by Frankie MundoResearch and map by Jonah WaltersEdited by https://www.haleyascharf.com------Texture Pack: Vanilla Tweaks https://vanillatweaks.net/picker/resource-packs/------Some music used in this video is courtesy of Mewmore. Make sure to follow their tracks at https://www.youtube.com/user/Mewmore------Portions of this video are copyrighted and owned by Nintendo, and their use is allowed by the Nintendo Game Content Guidelines for Online Video & Image Sharing Platforms (https://www.nintendo.co.jp/networkservice_guideline/en/index.html?n).  All other original content, unless expressly noted otherwise, is ©2021, by the Skip the Tutorial creator, all rights reserved.------Other Credits:How to Properly Use an Anvil and Apply more than 30 Enchantments to an Item.https://youtu.be/wMDYntXnKSQ"
"BzXA8Ji9VU8","Rushing My Girlfriend To The Hospital On Her Birthday","2021-01-09T17:30:12Z","UC949o8thQEP15p9_VK69Vbw","Connor And Liana","24","21.11.01","connor and liana|she broke her arm|rushing my girlfriend to the hospital|rushing my girlfriend to the hospital on her birthday|broken arm|gone wrong|hospital vlog|broken wrist|she broke her wrist|hoverboard accident|hoverboard fail|connor and liana pranks|connor and liana stalker","286857","11128","351","2999","https://i.ytimg.com/vi/BzXA8Ji9VU8/default.jpg","False","False","This could go down as her worst birthday EVER! and I feel so bad...New videos every Monday, Wednesday and Saturday!Join the CLFAM VIP CLUB and become a member today to get one on one Zoom calls and Exclusive merch:https://bit.ly/37VDOzB---------------------------------------------------Second Channel:https://bit.ly/2NiCYmXGaming Channel:https://bit.ly/2GyR83J---------------------------------------------------Other Socials:Facebook: https://www.facebook.com/connorandlianaTwitter: @LianaAndConnorInstagram: @ConnorDarlington , @Liana_jadeeTIKTOK: @Connor , @LianaJadeeSend us something to our POBOX:POBOX10846LEICESTERLE19 9DR"
"khkKfMotNoI","Toyah & Robert's - Sunday Lockdown Lunch - Enter The Sandman","2021-01-10T12:00:09Z","UC9rYtOXUyIDQszsdgBzJy5A","Toyah","10","21.11.01","[none]","340962","7084","210","2127","https://i.ytimg.com/vi/khkKfMotNoI/default.jpg","False","False","Enter The Sandman, and enter the...... ermm exercise bike!Order a Personalised Artwork by Toyah or a Personalised Aphorism by Robert athttps://toyahshop.ccsproducts.co.uk/Order a personalised video message to keep forever..... .from Toyah Willcox: https://celebvm.com/toyahwillcoxfrom Robert Fripp: https://celebvm.com/robertfripp"
"eK5OcmL1vRA","Werner and Havertz on target in comfortable Chelsea win | FA Cup third round","2021-01-10T16:17:35Z","UCW6-BQWFA70Dyyc7ZpZ9Xlg","BBC Sport","17","21.11.01","BBC|BBC Sport|2020|football|Match of the Day|MOTD|Highlights|Match highlights|summary|football highlights|fa cup highlights|fa cup|third round|chelsea highlights|chelsea 4-0 morecambe|chelsea vs morecambe|chelsea vs morecambe highlights|timo werner|werner goal vs morecambe|timo werner goal vs morecambe|werner goal|havertz|kai havertz goal|havertz goal|kai havertz|callum hudson odoi|hudson odoi goal|mason mount|mount goal vs morecambe|mount goal","88481","1617","28","307","https://i.ytimg.com/vi/eK5OcmL1vRA/default.jpg","False","False","Chelsea see off League Two Morecambe with a 4-0 victory at Stamford Bridge in the third round of the FA Cup.=============SUBSCRIBE so you never miss out on our best videos➡️➡️http://bit.ly/1sFodyu Uploads every Monday - Wednesday - Friday.=============Find us here: BBC Sport: http://www.bbc.co.uk/sport Facebook: https://www.facebook.com/BBCSport/ Twitter: https://twitter.com/BBCSport Instagram: https://www.instagram.com/bbcsport/#bbcsport #chelsea #facupWerner and Havertz on target in comfortable Chelsea win | FA Cup third round"
"LPQFubwZzds","[제35회 골든디스크] (FULL) 방탄소년단 - 'Dynamite(Slow Jam Remix)' 외 2곡♪｜JTBC 210110 방송","2021-01-10T10:27:30Z","UCesY-UN9tgibpFJ-lw3y_1A","Golden Disc Awards","24","21.11.01","골든디스크어워즈|골든디스크시상식|골든|골디|디스크|jtbc|음악|음반|노래|시상식|특집프로그램|특집|제35회골든디스크어워즈|제35회골든디스크어워즈큐라프록스|음반부문|보이그룹|방탄소년단|BTS|국내|댄스|Black Swan|ON|Life Goes On|Dynamite","2158545","318000","2282","13510","https://i.ytimg.com/vi/LPQFubwZzds/default.jpg","False","False","#제35회골든디스크어워즈 #방탄소년단 #BTS■ 제35회 골든디스크어워즈 with 큐라프록스 음반 부문(FULL) 방탄소년단 - 'Black Swan' + 'ON'+ 'Life Goes On' + 'Dynamite(Slow Jam Remix)'"
"WrXfJJEu-Oc","Buccaneers vs. Washington Football Team Super Wild Card Weekend Highlights | NFL 2020 Playoffs","2021-01-10T04:44:19Z","UCDVYQ4Zhbm3S2dlz7P1GBDg","NFL","17","21.11.01","NFL|Football|offense|defense|American Football|highlight|highlights|game|sport|play|plays|season|postseason|playoffs|2020|touchdown|td|game highlights|super wild card weekend|best plays|top plays|buccaneers|bucs|tampa bay|tb|washington football team|washington|was|bucs washington game highlights|bucs highlights|washington highlights|bucs td|washington td|wild card","2588369","23387","1131","5204","https://i.ytimg.com/vi/WrXfJJEu-Oc/default.jpg","False","False","The Tampa Bay Buccaneers take on the Washington Football Team during Super Wild Card Weekend of the 2020 NFL postseason.Subscribe to NFL: http://j.mp/1L0bVBuCheck out our other channels:Para más contenido de la NFL en Español, suscríbete a https://www.youtube.com/nflenespanolNFL Fantasy Football https://www.youtube.com/nflfantasyfootballNFL Vault http://www.youtube.com/nflvaultNFL Network http://www.youtube.com/nflnetworkNFL Films http://www.youtube.com/nflfilmsNFL Rush http://www.youtube.com/nflrushNFL Play Football https://www.youtube.com/playfootballNFL Podcasts https://www.youtube.com/nflpodcasts#NFL #NFLPlayoffs #SuperWildCard"
"bMzpGpSUqWE","LaMelo Ball Posts First Triple-Double At Age 19","2021-01-10T02:30:53Z","UC9-OpMMVoNP5o10_Iyq7Ndw","Bleacher Report","17","21.11.01","bleacher report|br|nba|lamelo ball|lamelo ball highlights|lamelo ball 19|lamelo ball charlotte hornets|lamelo ball rookie highlights|lamelo ball nba|lamelo ball triple-double|lamelo ball nba history|lamelo ball best passes|lamelo ball best highlights|lamelo ball 2021|lamelo ball 2021 highlights|lamelo ball vs. trae young|lamelo ball hornets|lamelo ball best assists|lamelo ball mix|lamelo ball fadeaway|lamelo ball 3-pointer|charlotte hornets|atlanta hawks","1027039","13736","310","2278","https://i.ytimg.com/vi/bMzpGpSUqWE/default.jpg","False","False","It only took 10 games for LaMelo Ball to make NBA history as he became the youngest player to post a triple-double. He finished with 22 PTS, 12 REB and 11 AST. Subscribe: https://www.youtube.com/user/BleacherReport?sub_confirmation=1Follow on IG: http://www.instagram.com/f/bleacherreportFollow us on Twitter: http://www.twitter.com/bleacherreportLike us on Facebook: http://www.facebook.com/bleacherreport#LaMeloBall #CharlotteHornets #NBA"
