video_id,title,publishedAt,channelId,channelTitle,categoryId,trending_date,tags,view_count,likes,dislikes,comment_count,thumbnail_link,comments_disabled,ratings_disabled,description
"HCJXgt8fPlg","FRESH Challenged US in Fortnite","2021-01-05T17:04:32Z","UCTgQTM6B97Tk5FPNOWZMB1Q","x2Twins","20","21.11.01","x2twins|x twins|twins|fortnite|oce|battle royale|x2jesse|jesse|x2jordan|jordan|season 5|fresh|challenge|lazarbeam|kill challenge","2338921","50460","2259","3318","https://i.ytimg.com/vi/HCJXgt8fPlg/default.jpg","False","False","So FRESH and LAZARBEAM challenged us to this Kill Challenge. We had to get as many kills in one hour... and we absolutely popped off. This absolutely insane... we hope you enjoy!Leave a LIKE and SUBSCRIBE for more videos!Hit that NOTIFICATION bell to never miss a video!USE CODE X2TWINS in the Fortnite item shopWatch us live everyday here ► https://www.twitch.tv/x2twinsFollow us here!► TWITTER - https://twitter.com/x2twins► INSTAGRAM - https://www.instagram.com/x2twinss► DISCORD - https://discord.gg/x2twins► TIKTOK - https://vm.tiktok.com/cQgdDd/"
"KJBzkUNZ7s0","YUNGBLUD - mars (Behind The Scenes)","2021-01-06T18:00:11Z","UC5UPzrHY7vVjx_CvzAS90Ew","YUNGBLUDVEVO","10","21.11.01","YUNGBLUD|mars|(The|Making|Of)|Locomotion|Recordings/Interscope|Records|Alternative","139240","21763","51","1363","https://i.ytimg.com/vi/KJBzkUNZ7s0/default.jpg","False","False","weird! is out now! Stream and Download: https://yungblud.lnk.to/weirdalbumwatch more official YUNGBLUD videos: https://YUNGBLUD.lnk.to/MusicVideossubscribe to YUNGBLUD: https://YUNGBLUD.lnk.to/Subscribeabout YUNGBLUD:welcome to the black hearts club. we are the underrated youth. come with me through this journey and subscribe for moreconnect with YUNGBLUD online:visit the official YUNGBLUD website: https://YUNGBLUD.lnk.to/websitefollow YUNGBLUD on instagram: https://YUNGBLUD.lnk.to/instagramfollow YUNGBLUD on facebook: https://YUNGBLUD.lnk.to/facebookfollow YUNGBLUD on tiktok: https://YUNGBLUD.lnk.to/tiktok#yungblud #mars #behindthescenes"
"jwwa7qzonoY","'Woman shot dead' after pro-Trump mob storms US Capitol","2021-01-06T23:31:58Z","UCoMdktPbSTixAyNGwb-UYkQ","Sky News","24","21.11.01","SKY|NEWS|CAPITOL|US|BUILDING|PROTESTERS|STORM|INVADE|CLASH|POLICE|DONALD|TRUMP|STOPTHESTEAL|PRESIDENT|USA|AMERICA|AMERICAN|EYE WITNESS|ELECTION|GEORGIA|ELECTORAL COLLEGE|JOE BIDEN|KAMALA HARRIS|REPUBLICAN|QANON|TWITTER|SIEGE|IED|PRESIDENT ELECT|INAUGURATION","2311716","12854","4019","11221","https://i.ytimg.com/vi/jwwa7qzonoY/default.jpg","False","False","Police have confirmed that a woman who was shot earlier during the Capitol riots has died due to her injuries.Earlier today supporters massed outside Congress - and then forced their way in - leading to the suspension of the session which was due to confirm Joe Biden as the next President.SUBSCRIBE to our YouTube channel for more videos: http://www.youtube.com/skynews Follow us on Twitter: https://twitter.com/skynews  Like us on Facebook: https://www.facebook.com/skynews Follow us on Instagram: https://www.instagram.com/skynews For more content go to http://news.sky.com and download our apps:  Apple: https://itunes.apple.com/gb/app/sky-news/id316391924?mt=8 Android https://play.google.com/store/apps/details?id=com.bskyb.skynews.android&hl=en_GBSky News videos are now available in Spanish here/Los video de Sky News están disponibles en español aquí https://www.youtube.com/channel/UCzG5BnqHO8oNlrPDW9CYJog"
"aaZq6SXXNt4","Black Clover - Opening 13 | Grandeur","2021-01-05T11:52:00Z","UC6pGDc4bFGD1_36IKv3FnYg","Crunchyroll Collection","1","21.11.01","crunchyroll|anime|anime trailer|anime preview|anime full episode|crunchyroll collection|daily clips|anime pv|anime op|anime opening|anime highlights|black clover|ブラッククローバー|black clover opening 13|black clover op 13|snow man|grandeur","3347466","129937","2050","17130","https://i.ytimg.com/vi/aaZq6SXXNt4/default.jpg","False","False","The Spade Kingdom Arc Has Begun! 🔥Artist: Snow ManSong: GrandeurWatch Black Clover on Crunchyroll: https://got.cr/Watch-BCCrunchyroll Collection brings you the latest clips, OPs, and more from your favorite anime! Don't have time for a full episode but want to catch up on the best scenes? We've got them! FREE 14-DAY CRUNCHYROLL TRIAL 🌟 https://got.cr/14DaysFree#blackclover #snowman #grandeur"
"XfX1VtwW9L4","i speedrun bad minecraft","2021-01-05T23:00:19Z","UCQSEAbOs6vsJfy7WN7iYaGQ","EazySpeezy","20","21.11.01","EazySpeezy|minecraft|bad minecraft|minecraft speedrun|speedrun|speedrunning|world record|wr|speedrun world record|mine craft|minecraft world record|bad minecraft speedrun|bad minecraft world record|cursed minecraft|cursed|minecraft mod|cursed minecraft speedrun|minecraft realistic|minecraft with realistic physics|realistic physics|memeruns|memerun|meme speedrun|funny speedrun|speedruns|glitch|any%|fail|agdq|gdq|games done quick|summoning salt|karl jobst|meme","2245388","63557","2208","2785","https://i.ytimg.com/vi/XfX1VtwW9L4/default.jpg","False","False","technically i got 4 minecraft world records today. i'm so great at speedrunning!Watch live at: http://twitch.tv/EazySpeezy▶ Twitter: https://twitter.com/EazySpeezy▶ Discord: https://discord.gg/Fz6DtdqCheck out the game creator here: https://youtube.com/c/StevenstuffDownload the game here: https://stevensstuff.itch.io/floppy-minecraftMy channel generally focuses on a more casual side of speedruns. With these videos I want to show off cool speedruns, explain how they work, and entertain. Hopefully you enjoy the content and maybe even take up speedrunning yourself, because it is truly a lot of fun!And yeah, today we tried speedrunning bad minecraft. This is a cursed minecraft mod and I think you can see why. I mean we have guns. I think that just shows how cursed it is. Also there are realistic physics like falling tree... and guns... I don't know why I'm so caught up about that. Whatever, enjoy the speedruns and you definitely will because each one of them is a world record... on a game that no one else speedruns... okay I should just stop talking.Also I'm gonna do this cause all the cool kids do:Not Minecraft, But Water Rises or Minecraft, But Lava Rises, or any other but challenge like that. This is a speedrun / speedrunner of Minecraft against a very much cursed game.#EazySpeezy #Minecraft #Speedrun"
"TX86yD440bc","Disneyland Paris - En 2021, il est temps de rêver plus fort encore ✨","2020-12-31T23:00:14Z","UC1t74cS15eURW0YCpsRaDuw","Disneyland Paris","19","21.11.01","Disneyland Paris|disney|disneyland|paris|bonne|année|bonne année|2021|Happy|New|Year|Happy New Year|nieuwjaar|anguri|feliz año nuevo|Feliz Ano Novo|Walt Disney|happy new year 2021|marvel|frozen|reine des neiges|happy 2021|new year|yt:cc=on|walt disney|2020|castle|dream|rêve","254935","5622","60","277","https://i.ytimg.com/vi/TX86yD440bc/default.jpg","False","False","Toutes les équipes de Disneyland Paris vous souhaitent une bonne et heureuse année et vous font part de leurs meilleurs vœux pour cette année 2021. Une nouvelle année pour recommencer à croire en vos rêves.Rejoignez-nous ! https://www.youtube.com/user/disneylandparis/?sub_confirmation=1 ET cliquez sur la cloche 🔔 pour être informé des dernières vidéos mises en ligne ! ℹ️ https://www.disneylandparis.com/fr-fr/ Suivez nous sur... YouTube ► https://www.youtube.com/user/disneylandparis/?sub_confirmation=1Website ► https://www.disneylandparis.com/fr-fr/ Facebook ► https://fr-fr.facebook.com/DisneylandParisfr/ Twitter ► https://twitter.com/disneylandparis Instagram ► https://www.instagram.com/disneylandparis/#DisneylandParis #HappyNewYear #2021"
"B2GqaDosVOs","Who is the best Rocket League Content Creator in the World? (USA Musty VS. EU JZR)","2021-01-05T22:27:46Z","UCb-_aAU19O2BSDI2PDPK83w","NRG Rocket League","20","21.11.01","nrg rocket leage|nrg rocket league comms|nrg pro comms|rocket league|nrg|sizz|rocket league esports|nrg jstn 0 second goal|nrg jstn highlights|squishymuffinz nrg|squishymuffinz flick|GarrettG|musty|nrg musty|musty flick|amustycow|rocket league codes|Rocket league fortnite challenges|benjyfishy|nrg fortnite|how to mustyflick|how to musty flick|rumble rocket league rips|jstn fakes|nrg rl comms|nrg rocket comms|jstn|best of 2020|funniest moments of 2020","280036","12518","157","631","https://i.ytimg.com/vi/B2GqaDosVOs/default.jpg","False","False","In our NEWEST NRG Rocket League video Musty and JZR fight to see who the best Rocket League Content Creator in the World is... Will NA or EU come out on top? 😳 . Please give this video a like, comment and subscribe for the best content on YT! Sponsors:► TurtleBeach: https://www.turtlebeach.com/pages/nrg...► Roccat: https://en.roccat.org/► LLS: https://www.lls.org► EventsDC: http://www.eventsdc.com/► iBuyPower: http://bit.ly/NRGibuypower► National Guard: http://nationalguard.com/► BlockFi: https://www.blockfi.com/NRG► Visine: https://www.visine.com/eye-drops► Merch: https://lilshop.com/NRG► Instagram: https://instagram.com/nrggram/► Twitter: https://twitter.com/NRGgg► TikTok: https://tiktok.com/@nrg ► Facebook: https://facebook.com/NRGwin► Website: https://nrg.gg/► YouTube: https://youtube.com/nrgesports► Discord: https://discord.gg/nrg► Twitch: https://twitch.tv/NRGggWho is the best Rocket League Content Creator in the World? (USA Musty VS. EU JZR)#rocketleague #NRG #rlcs"
"Vs27N9v04gc","The Mandem's Whatsapp Group Buy A Bando In Croydon | Home Under The Hammer time","2021-01-05T19:50:44Z","UCzR6TFzq7UwZbGEGoS2RGow","Mo Gilligan","22","21.11.01","[none]","149235","7166","89","444","https://i.ytimg.com/vi/Vs27N9v04gc/default.jpg","False","False","Homes Under The Hammer Time Is back back for 2021. (Sorry for the wait)Mo Gilligan brings his Homes Under the Hammer reaction videos to Youtube.Welcome to the official channel for Mo Gilligan Be sure to subscribe so you can stay up to date with Mo’s journey behind the scenes and check out his podcastFollow Mo on Twitter/Instagram: https://twitter.com/mothecomedian | https://www.instagram.com/mothecomedian/Like the page on Facebook: https://www.facebook.com/mogilligan/Join the Mo Gilligan mailing list on www.mogilligan.com for updates on shows and events."
"Q5vUrp0EqKI","Jamal Lowe CELEBRATED In-Front Of My GoPro vs Swansea City | Away Days | Ben Foster - TheCyclingGK","2021-01-04T17:01:32Z","UCi33DX7KG3M3bI0ipjOP2Eg","Ben Foster - The Cycling GK","17","21.11.01","Ben Foster|The Cycling GK","886761","41387","243","2218","https://i.ytimg.com/vi/Q5vUrp0EqKI/default.jpg","False","False","You are not gonna wanna miss this absolute banger of a video. It's got the lot.We've got behind-the-scenes footage of us travelling to Wales to play Swansea City in the Championship by plane; a game of Countdown with former Manchester United and England midfielder Tom Cleverley; brilliant footage of the cringing and awkward initiation songs by new Watford FC players and staff and what I did with my Fantasy Premier League wildcard.Oh, and there is, of course that ledge celebration to the camera by that naughty rascal Jamal Lowe. Love that from him.Follow me on Twitter 👉🏼  https://twitter.com/benfosterLike me on Instagram 👉🏼  https://www.instagram.com/benfosters/Like The Cycling GK on Instagram:  👉🏼  https://www.instagram.com/thecyclinggk/"
"whs63HyYcT0","Congress Confirms Biden And Harris Electoral College Win | NBC News","2021-01-07T09:15:52Z","UCeY0bbntWzzVIaj2z3QigXg","NBC News","25","21.11.01","News|U.S. News|Decision 2020|Decision 2020 - Election Results|NBC News|Congress|nbc|breaking news|us news|world news|politics|nightly news|current events|top stories|pop culture|Biden And Harris|Electoral College Win|Electoral College|President-elect Joe Biden|Vice President-elect|electoral college votes|kamala harris|us election 2020|election 2020 update|congress news 2021|presidential election update|biden 2020|kamala 2020|presidential election","623328","9234","1277","3420","https://i.ytimg.com/vi/whs63HyYcT0/default.jpg","False","False","After a day of riots at the Capitol, Congress counted the Electoral College votes and confirmed the win for President-elect Joe Biden and Vice President-elect Kamala Harris.» Subscribe to NBC News: http://nbcnews.to/SubscribeToNBC» Watch more NBC video: http://bit.ly/MoreNBCNewsNBC News Digital is a collection of innovative and powerful news brands that deliver compelling, diverse and engaging news stories. NBC News Digital features NBCNews.com, MSNBC.com, TODAY.com, Nightly News, Meet the Press, Dateline, and the existing apps and digital extensions of these respective properties.  We deliver the best in breaking news, live video coverage, original journalism and segments from your favorite NBC News Shows.Connect with NBC News Online!NBC News App: https://apps.nbcnews.com/mobileBreaking News Alerts: https://link.nbcnews.com/join/5cj/bre...Visit NBCNews.Com: http://nbcnews.to/ReadNBCFind NBC News on Facebook: http://nbcnews.to/LikeNBCFollow NBC News on Twitter: http://nbcnews.to/FollowNBCFollow NBC News on Instagram: http://nbcnews.to/InstaNBC#USCapitol #ElectoralCollege #NBCNewsCongress Confirms Biden And Harris Electoral College Win | NBC News"
"jZ9AJ8TCjrk","Reading Homophobic Comments","2021-01-05T17:20:11Z","UC1AH7xvzpGOArDbD5kuk25A","Alex Elmslie","24","21.11.01","[none]","245601","33592","573","3151","https://i.ytimg.com/vi/jZ9AJ8TCjrk/default.jpg","False","False","I read the comments about what coming out bisexual was like...Subscribe and become an Internet Sensation!👕 INTERNET SENSATION SHIRTS 👕http://www.internetsensation.shop● HIGHLIGHTS - @ImAllexx Live ● EBOYS -  @Eboys ● EBOYS PODCAST - @The Eboys Podcast ● TIKTOK - @ImAllexx ● TWITTER -   @ImAllexx  ● INSTAGRAM - @imallexx● OUTRO MUSIC - Andrew Applepie - Feel It In My FaceAlex Elmslie or ImAllexx is a YouTube channel based off commentary on events and interests."
"8NotIDOIPnc","my ex's best friend/bloody valentine (New Year's Rockin' Eve Performance 2020/Medley)","2021-01-06T04:39:35Z","UC2a9zmrdjvLsrRgi4G4blWw","MGKVEVO","10","21.11.01","Machine Gun Kelly|MGK|New years rockin eve|New Years|MGK new Years|MGK bloody valentine|MGK drunk face|MGK all I Know|drunk face|all I know|bloody valentine","592507","37645","753","2679","https://i.ytimg.com/vi/8NotIDOIPnc/default.jpg","False","False","Machine Gun Kelly performs my ex's best friend & bloody valentine on New Years Rockin Eve!Machine Gun Kelly - Tickets To My Downfall is available now! https://smarturl.it/TTMDmgkFollow Machine Gun Kelly:https://twitter.com/machinegunkellyhttps://www.facebook.com/machinegunke...https://www.instagram.com/machinegunk...#MachineGunKelly #NewYearsRockinEve"
"n8BVdIoRXi4","KSI Is The Funniest Minecraft Player Ever","2021-01-04T22:15:13Z","UC_8NknAFiyhOUaZqHR3lq3Q","Quackity","24","21.11.01","Twitch|Twitch Stream|twitch.tv|Quackity|QuackityHQ|QuackityHQ Full Stream|Quackity Stream|QuackityHQ Stream|Quackity Twitch|KSI|Dream|Dream SMP|Dream SMP KSI|Quackity KSI|KSI playing minecraft|KSI plays Minecraft|Quackity and KSI play Minecraft|Sidemen play Minecraft|KSI joins the Dream SMP|KSI is a NOOB on Minecraft|KSI SideCraft|KSI Sidecraft Minecraft|KSI is a teacher in Minecraft|dreamsmp tommy|dream ninja|tommy ninja|tommy dreamsmp|tommyinnit","4869739","355159","4357","11168","https://i.ytimg.com/vi/n8BVdIoRXi4/default.jpg","False","False","KSI plays Minecraft with me and it was the funniest thing everFULL STREAM: https://www.youtube.com/watch?v=Qf-5pIty6VoDISCORD: https://discord.gg/QuackityTWITTER: https://twitter.com/QuackityHQSTEAM: http://steamcommunity.com/id/QuackityTWITCH: https://www.twitch.tv/quackityhqINSTAGRAM: https://www.instagram.com/quackity/KSI today decided to play Minecraft with me, quackity, on the DreamSMP which is a Minecraft server owned by Dream in Minecraft, so KSI being KSI and Minecraft being Minecraft I decided it was a great idea for me, quackity, to bring KSI onto DreamSMP which is the Minecraft server owned by Dream. This is gonna be amazing because KSI knows nothing about Minecraft let alone the DreamSMP server. So many big creators have came on the DreamSMP like Ninja and Pokimane but this time around it's KSI's time to shine on Dream's Minecraft server DreamSMP.Helped Edit: https://youtube.com/wheatskin"
"UDH1gkHjMMM","This is not how he expected to start the year..","2021-01-06T19:00:04Z","UCMrsA8lOl3F4j3DHNfDAkVA","SaffronBarkerVlogs","24","21.11.01","saffron|barker|second|channel|daily|vlogs|vlogging|blogging|together","216609","8121","171","385","https://i.ytimg.com/vi/UDH1gkHjMMM/default.jpg","False","False","YOU CAN SUBSCRIBE FOR WEEKLY VIDEOS HERE! http://bit.ly/2clXIs6SUBSCRIBE TO MY MAIN CHANNEL HERE!http://bit.ly/2aZlmgJListen to my podcast here!! https://linktr.ee/mummademedoitofficial MY LINKS:• MAIN CHANNEL: http://bit.ly/2aZlmgJ  • MERCH STORE: http://saffronbarker.bigcartel.com/• TWITTER: https://twitter.com/SaffronBarker• INSTAGRAM: https://instagram.com/saffronbarker• Snapchat: saffronbarkerrThankyou so much for watching and for all your support! I am forever grateful to each and every one of you for all the support you give me with liking,commenting sharing my videos & being active on my social media! & following me on this journey!!  mwahhhh x----------------------------------------------------------------------BUSINESS ONLY : saffronbarker@mcsaatchisocial.com"
"JBLcmc5m_UM","The National Lottery ‘Lotto' draw results from Wednesday 6th January 2021","2021-01-06T20:04:17Z","UCnOiv4Hp3fu43NDHl335cvQ","The National Lottery","24","21.11.01","Lotto|National Lottery|The National Lottery|Lotto results|The National Lottery results|The National Lottery show|Live stream|Live","66003","149","56","0","https://i.ytimg.com/vi/JBLcmc5m_UM/default.jpg","False","False","The National Lottery draw results for Lotto recorded and streamed live at 8pm on Wednesday 6th January 2021. Rules and Procedures (and Account Terms if playing online) apply. Players must be 16+ and physically located in the UK or IoM.To enter the next available draw, visit http://www.national-lottery.co.uk/games/lotto/You can also check your Lotto tickets on our website: http://www.national-lottery.co.uk/results/lotto/checker"
"0u5V8zMLZAU","Saka with a cool finish! | Behind the scenes at Arsenal training centre","2021-01-06T14:04:47Z","UCpryVRk_VDudG8SHXgWcG0w","Arsenal","17","21.11.01","Arsenal|Arsenal FC|Arsenal Football Club|Football|Club|EPL|Premier League|Soccer|Sport|Team|aubameyang|lacazette|bernd leno|Mesut ozil|bellerin|hector bellerin|dani Ceballos|Kieran Tierney|willian|granit xhaka|gabriel martinelli|bukayo saka|Thomas partey|Gabriel Magalhaes|William Saliba|David Luiz|Nicolas Pepe|arsenal highlights|arsenal training|mikel arteta|arsenal vs|behind the scenes|exclusive|unseen|emile smith rowe|pablo mari","260477","7358","96","989","https://i.ytimg.com/vi/0u5V8zMLZAU/default.jpg","False","False","The boys are hard work at London Colney and you can go behind the scenes to see what happened. #arsenal #bukayosaka #tierney Enjoy match highlights, training and behind the scenes to get closer to the likes of Pierre-Emerick Aubameyang, David Luiz, Vivianne Miedema, Nicolas Pepe, Alexandre Lacazette, Leah Williamson, Mesut Ozil, Bernd Leno, Danielle van de Donk, Willian, Hector Bellerin, Jordan Nobbs, Bukayo Saka, Kim Little, Gabriel Martinelli, Thomas Partey and more.Subscribe to the Official Arsenal YouTube Channel: https://arsn.al/youtubeFollow us on Facebook: https://arsn.al/facebookFollow us on Twitter: https://arsn.al/twitterFollow us on Instagram: https://arsn.al/instagramFollow us on TikTok: https://arsn.al/tiktokThis is the Official YouTube channel for Arsenal Football Club.For more match action, highlights and training videos, make sure you become a digital member and sign up to Arsenal Player. It's FREE and is the Home of the Game: https://arsn.al/arsenalplayerArsenal Football Club were formed in 1886 and amassed 13 League titles, 14 FA Cups. Some of their greatest players include: Thierry Henry, Dennis Bergkamp, Tony Adams, Ian Wright, Robert Pires, Liam Brady, Patrick Vieira, Cliff Bastin and Charlie George."
"63XYLHCK-Uw","$10,000 Challenge Forfeit In Dubai Ft. Calfreezy","2021-01-04T19:36:09Z","UCHhfSXoDG6gSgpOvLH4wrRw","Behzinga","20","21.11.01","behzinga|beh2inga|sidemen|moresidemen","1090547","64809","1008","1374","https://i.ytimg.com/vi/63XYLHCK-Uw/default.jpg","False","False","💈 Manscaped: Get 20% OFF + Free Shipping Applied At Checkout - https://manscaped.com/zinga💪 Gymshark: https://gym.sh/EthanGS🏋️‍♂️ Bulk Official: http://tidd.ly/9e0caa89💾 Second Channel: https://goo.gl/zj8iLh🐦Twitter: https://goo.gl/vLFjVi📸 Instagram: https://goo.gl/kZFDby🦒 Freezy: https://www.youtube.com/user/Calfreezy🍟 Chip: https://www.youtube.com/user/TheBurntChipHD---------------------------------------------------------------------------------------👨‍👦‍👦 Sidemen Channel: https://goo.gl/75JAoW👕 Sidemen Clothing: https://goo.gl/3PvKDU📘 Sidemen Book: https://goo.gl/iFMyRx🎮 Custom Controllers: https://goo.gl/7mf2bs📹 How I Record My Gameplay: https://goo.gl/L4UUcA💻 My Custom PC: https://goo.gl/2QPvxR---------------------------------------------------------------------------------------#Behzinga #Sidemen #ADVideo Uploaded by Behzinga, Beh2inga."
"nsAw8fYOXnU","HIGHLIGHTS | SPURS 2-0 BRENTFORD | Tottenham Hotspur reach Carabao Cup final!","2021-01-06T09:25:29Z","UCEg25rdRZXg32iwai6N6l0w","Tottenham Hotspur","17","21.11.01","Spurs|Tottenham Hotspur|토트넘|손흥민|Spurs 2-0 Brentford|Brentford|Spurs Carabao Cup|Heung min Son|Son|Son Brentford|Moussa Sissoko","1355097","22156","464","1568","https://i.ytimg.com/vi/nsAw8fYOXnU/default.jpg","False","False","Watch full highlights from Tottenham Hotspur's 2-0 Carabao Cup semi-final win against Brentford where goals from Moussa Sissoko and Heung-min Son fired Spurs into the Carabao Cup final at Wembley Stadium!"
"guI7oxnXOKY","TROLLING KSI with a W2S DISSTRACK! (Proximity Chat Among Us)","2021-01-04T16:44:40Z","UCvwgF_0NOZe2vN4Q3g1bY-A","Vikkstar123","20","21.11.01","Vikkstar|Vikkstar123|Vikkstar123HD|Sidemen|The Sidemen|Fortnite|Fort Nite|Fortnite Battle Royale|Fortnite Gameplay|Fortnite Custom Games|Fortnite Playground Mode","1289136","61081","790","1031","https://i.ytimg.com/vi/guI7oxnXOKY/default.jpg","False","False","More Among Us Enjoy!Follow me on TWITTER: http://twitter.com/#!/Vikkstar123Follow me on  INSTAGRAM: http://instagram.com/VikkstagramSidemen Clothing: http://sidemenclothing.com/Sidemen PCs: http://bit.ly/Vikkstar123My capture card: http://e.lga.to/vCheck out my other channels linked below:Minecraft: http://www.youtube.com/Vikkstar123HDLets Play: http://www.youtube.com/VikkstarPlays"
"DUvMy0fLVI4","WE'VE MOVED IN TOGETHER / EMPTY APARTMENT TOUR","2021-01-05T16:11:02Z","UCMOTCjsUTvu_O4Rj1i06VtA","Misha Grimes","26","21.11.01","empty flat|empty flat tour|empty apartment|empty apartment tour|apartment tour|misha grimes|flat tour|tour|house tour|moving house|moving|moving with my boyfriend","92537","3837","112","441","https://i.ytimg.com/vi/DUvMy0fLVI4/default.jpg","False","False","AHHHHH hello everyone & welcome to the most exciting and crazy adventure me & Jake are about to embark on because WE HAVE MOVED IN TOGETHER!! AHHHHHH So we thought we would kick things off with an EMPTY APARTMENT TOUR & I hope you guys enjoy xox -TOP REQUESTED ITEMS-EQUITMENT - CAMERA * https://rstyle.me/+vpZ9wTrkRasWo1ZM4ORMRARING LIGHT * https://rstyle.me/+lFxUu2iNyhsHgfLy-QimBAPHONE RING LIGHT & STAND * https://rstyle.me/+uWMoaoerF0bmCIxsvNxzzwAPPLE WATCH * https://rstyle.me/+1KjbsTBCxKqDtMSB8co_YQLAPTOP * https://rstyle.me/+DvD1DwUkGnSG-uN6UDDKfAEDITING SOFTWARE - FINAL CUT PRO - EVERDAY MAKEUP - FOUNDATION * https://rstyle.me/+cI459m8EpfCLOksmgct0TgCONCELAR * https://rstyle.me/+t3tx0eiEK9uOf-bF2uMYZwBEST MASCARA * https://rstyle.me/+duRCE47qqxy0l-pq5vrGFw BRONZER (in shade Give me Sun) * https://rstyle.me/+nugKJOYYpA5olryBA-7B_A SUBSCRIBE to my channel: https://www.youtube.com/channel/UCMOTCjsUTvu_O4Rj1i06VtAINSTAGRAM: https://www.instagram.com/misha_grimes/TIK TOK - https://vm.tiktok.com/ZSQdkQRd/PODCAST - https://open.spotify.com/show/2ecozfpvhZhTU1i1ataE6iEMAIL: mishagsocial@hotmail.com"
"iIZWNsBe6cM","Kim Kardashian & Kanye West Headed for Divorce","2021-01-06T13:14:50Z","UChi08h4577eFsNXGd3sxYhw","Breakfast Club Power 105.1 FM","24","21.11.01","the breakfast club|breakfast club|power1051|celebrity news|radio|video|interview|angela yee|charlamagne tha god|dj envy","346990","4631","402","2237","https://i.ytimg.com/vi/iIZWNsBe6cM/default.jpg","False","False","Subscribe NOW to The Breakfast Club: http://ihe.art/xZ4vAcAGet MORE of The Breakfast Club:► LISTEN LIVE: http://power1051fm.com/► CATCH UP on What You Missed: http://ihe.art/Dx2xSGN► FOLLOW us on Instagram: https://www.instagram.com/BreakfastClubAM/► FOLLOW us on Twitter: https://twitter.com/BreakfastClubAM► LIKE us on Facebook: https://www.facebook.com/BreakfastClubAM/Executive Producer: Eddie F.APD/Producer: Daniel Greene - @d7greeneBoard Producer: DJ Dramos - @djdramosProducer: Taylor Hayes - @funsize_tCamera/Video Editor: Nick Cio - @isaywesayAssistant Editor: Breanna Chianne - @iamb_chianneThe Breakfast Club features celebrity interviews, Charlamagne tha God’s Donkey of the Day, Angela Yee’s Rumor Reports, DJ Envy’s mixes and so much more! Every guest visiting the world’s most dangerous morning show is grilled with their signature blend of honesty and humor. The results are the best interviews to be found on radio.#BreakfastClub#RumorReport"
