video_id,title,publishedAt,channelId,channelTitle,categoryId,trending_date,tags,view_count,likes,dislikes,comment_count,thumbnail_link,comments_disabled,ratings_disabled,description
"yFzQRMXEuqU","大籽 - 白月光與硃砂痣【動態歌詞】「白月光在照耀 你才想起她的好」♪","2021-01-06T13:00:33Z","UC_ol0nA8RUpyRTleAcu8JVw","Angelic Music World","10","21.13.01","Angelic Music World|大籽|白月光與硃砂痣","555862","11297","92","191","https://i.ytimg.com/vi/yFzQRMXEuqU/default.jpg","False","False","❖ 請訂閱 Angelic Music World ❖❖ Follow our Instagram: https://www.instagram.com/angelicmusicworld/ ❖▬▬▬▬▬▬▬▬▬▬▬▬▬▬▬▬▬▬▬▬▬▬▬▬▬▬▬▬▬大籽 - 白月光與硃砂痣詞：黃千芊/王佳瀅曲：黃千芊/田桂宇編曲：趙鵬/楊爽製作人：田桂宇和聲：夏初安混音：張鳴利出品：創際音樂從前的歌謠 都在指尖繞得不到的美好 總在心間撓白飯粒無處拋 蚊子血也抹不掉觸不可及剛剛好 日久天長讓人惱那時滾燙的心跳 也曾無處遁逃像一團烈火燃燒 燒盡跨不過的橋時光匆匆地跑 火焰化作月遙遙再無激蕩的波濤 也從不在夢裡飄搖白月光在照耀 你才想起她的好硃砂痣久難消 你是否能知道窗前的明月照 你獨自一人遠眺白月光是年少 是她的笑那時滾燙的心跳 也曾無處遁逃像一團烈火燃燒 燒盡跨不過的橋時光匆匆地跑 火焰化作月遙遙再無激蕩的波濤 也從不在夢裡飄搖白月光在照耀 你才想起她的好硃砂痣久難消 你是否能知道窗前的明月照 你獨自一人遠眺白月光是年少 是她的笑白月光在照耀 你才想起她的好硃砂痣久難消 你是否能知道窗前的明月照 你獨自一人遠眺白月光是年少 是她的笑▬▬▬▬▬▬▬▬▬▬▬▬▬▬▬▬▬▬▬▬▬▬▬▬▬▬▬▬▬☛官方音樂平台上架  ►QQ音樂: https://c.y.qq.com/base/fcgi-bin/u?__=WiPAYTh▬▬▬▬▬▬▬▬▬▬▬▬▬▬▬▬▬▬▬▬▬▬▬▬▬▬▬▬▬☛想更了解歌手  ►微博: https://weibo.com/u/6315306610▬▬▬▬▬▬▬▬▬▬▬▬▬▬▬▬▬▬▬▬▬▬▬▬▬▬▬▬▬☛Artwork by Rien.: https://www.pixiv.net/artworks/86587202  ►Twitter: https://twitter.com/kakihito2011  ►Pixiv: https://www.pixiv.net/users/1684638▬▬▬▬▬▬▬▬▬▬▬▬▬▬▬▬▬▬▬▬▬▬▬▬▬▬▬▬▬☛Music Promotion  ►Email: angelicmusicworld@gmail.com▬▬▬▬▬▬▬▬▬▬▬▬▬▬▬▬▬▬▬▬▬▬▬▬▬▬▬▬▬☛DistributionFor releasing under our Record Label, please send your demo (Unreleased) to ►Email: angelicmusicworld@gmail.com(We will review your request in six hours.)▬▬▬▬▬▬▬▬▬▬▬▬▬▬▬▬▬▬▬▬▬▬▬▬▬▬▬▬▬★COPYRIGHT / LICENSING★►All rights belong to their respective owners. _Angelic Music World_#大籽 #白月光與硃砂痣"
"a1omXbLpkkA","BEGINI SOSOK KAPTEN AFWAN DI MATA MANTAN PRAMUGARI SRIWIJAYA AIR | RUMPI (11/1/21) P1","2021-01-11T12:24:27Z","UCIohHXwCEKxWCLvAguJ-GjA","TRANS TV Official","24","21.13.01","#NontonRumpiSamaSaya #SantuySamaSaya #NontonTransTV","1071452","21404","541","1569","https://i.ytimg.com/vi/a1omXbLpkkA/default.jpg","False","False","RUMPI=== TAYANG SETIAP SENIN - JUM'AT PUKUL 14.00 WIB===PART 1: https://youtu.be/a1omXbLpkkAPART 2: https://youtu.be/sza0sqSOuvcPART 3: https://youtu.be/hLY26fy-T1MPART 4: https://youtu.be/ANCra0FDdJk===Kumpulan video semua peristiwa selebritis terkenal dibahas apa adanya. Lalu semua dibahas dan disingkap tanpa rahasia, langsung dari sumber terpecaya, bersama Feny Rose yang selalu membahana.===WEBSITE - http://www.transtv.co.idTWITTER - https://twitter.com/TRANSTV_CORPFACEBOOK - https://www.facebook.com/TransTVMediaINSTAGRAM - https://www.instagram.com/TRANSTV_CORP#SantuySamaSaya #NontonRumpiDiTransTV #Rumpi11Januari2021"
"5p5UgtPzoT0","Chat Terakhir Penumpang Sriwijaya Air, Sebelum Hilang Kontak, Minta Sang Istri Menunggunya Pulang","2021-01-10T02:45:19Z","UCwFc1bMj5KFxX8BJ1wBRuzw","Tribun MedanTV","25","21.13.01","Tribunnews|Tribunmedan","2828890","17774","1046","1956","https://i.ytimg.com/vi/5p5UgtPzoT0/default.jpg","False","False","https://medan.tribunnews.com/2021/01/10/chat-terakhir-penumpang-sriwijaya-air-sebelum-hilang-kontak-minta-sang-istri-menunggunya-pulangTRIBUN-MEDAN.COM - Cerita haru menyelimuti insiden kecelakaan pesawat Sriwijaya Air SJ182 yang dikabarkan jatuh di sekitar Kepulaan Seribu, Sabtu (9/1/2021).Seperti yang terjadi pada suami Aldharefa yang menjadi salah satu penumpang dalam pesawat nahas Sriwijaya Air.Aldha tidak menyangka, chat WA dari suaminya beberapa menit sebelum boarding menjadi komunikasi terakhir pasangan suami istri tersebut.Sebelum pesawat Sriwijaya Air SJ182 jatuh, suaminya mengirim sebuah pesan WA (WhatsApp) penuh haru kepada istrinya.Berikut isi percakapan terakhir Aldharefa dengan sang suami Ockybisma sekitar pukul 14.23 WIB.Aldharefa: I Love You Apih, jangan lupa berdoa ya.Ockybisma: Iyaa amihhku emoll. Tungggu apihh yaa sayangku.Aldharefa: Iya sayangkuuu, Delay ya apih?Ockybisma: Takeoff yaa sayangku.Mendengar kabar Pesawat Sriwijaya Air hilang kontak, mulai pukul 15.41-15.50 WIB, Aldha terus berusaha mencoba menghubungi suaminya.Namun, pesan yang dikirimkan lewat WhatsApp tak kunjung masuk dan hanya centang satu (pending).Aldharefa: Apih, Apih, Sayang, Apih udah landing belum, Apihhh, bales apih.Apih, Apih bales, Apihhhh, Apih bales, Apih tolong bales, Sayangku.Pesan yang berulang kali dikirimkan oleh Aldharefa tak juga mendapat balasan.Pihh balas pihh, kamu pasti kuat sayang. Kamu bisa bertahan, tulis Aldha.Kesedihan yang dirasakan Aldha, ia bagikan lewat insta story Instagram miliknya.Dalam insta story berikutnya, Aldha membagikan foto ia bersama dengan suami tercinta.Dengan sebuah caption yang sangat menyentuh.Suamiku kamu pasti bisa bertahan, tuturnya.Rasa kesedihan yang dirasakan oleh Aldha semakin menjadi-jadi, tatkala telah beredar luas pesawat yang di naiki sang suami jatuh di sekitar Kepulauan Seribu tepatnya di Pulau Laki.Aldha lalu menuliskan sebuah pesan lewat insta story miliknya.Mohon doanya teman-teman, semoga ada mukjizat dari Allah selamat suamiku. Semoga tanpa kurang apapun, jelasnya.Baca selengkapnya di www.tribun-medan.com"
"H1L8HDrxQHM","Detik-detik Penyelaman Kopaska, Puing Pesawat Hancur di Bawah Laut","2021-01-10T07:27:06Z","UC5BMIWZe9isJXLZZWPWvBlg","KOMPASTV","25","21.13.01","Penemuan Sriwijaya Air|Kopaska|Penyelaman Sriwijaya Air|Pencarian SJ 182|Puing Pesawat|Detik-detik Penyelaman Kopaska|Puing Pesawat Hancur di Bawah Laut|kompas|berita kompas|berita kompastv|kompas news|kompastv|kompas tv|kompastv live streaming|kompas tv live streaming|live streaming|indonesia|news|youtube news","4686936","42563","1522","4142","https://i.ytimg.com/vi/H1L8HDrxQHM/default.jpg","False","False","JAKARTA, KOMPAS.TV - Anggota tim penyelam Kopaska TNI AL, Mayor Laut Edi Tirtayasa mengatakan bahwa pesawat Sriwijaya Air SJ 182 ditemukan dengan kondisi hancur berkeping-keping di tempat penyelaman sekitar Perairan Kepulauan Seribu, Jakarta.Saat menyelam, Edi melihat serpihan pesawat dengan ukuran kecil.Di dalam laut ada serpihan pesawat. Pesawat hancur total, ujar Edi di tengah kegiatan penyelaman di perairan Kepulauan Seribu, Jakarta pada Minggu (10/1/2021) pagi.Adapun bagian pesawat yang ditemukan antara lain berupa pecahan ban pesawat, pelampung penumpang, bagian kelistrikan pesawat, bagian badan pesawat warna biru merah, moncong pesawat, dan bagian pesawat lainnya.Potongan bagian pesawat sudah diangkut ke KRI Kurau. Sebelumnya, tim Kopaska TNI AL menemukan bagian pesawat Sriwijaya Air SJ 182 setelah melakukan penyelaman di sekitar Pulau Lancang dan Pulau Laki, Kepulauan Seribu, Jakarta pada Minggu (10/1/2021) pagi."
"eYePkqzxGnM","Search underway for missing Indonesian passenger jet | 9 News Australia","2021-01-10T08:07:14Z","UCIYLOcEUX6TbBo7HQVF2PKA","9 News Australia","25","21.13.01","Nine News Australia|Channel 9|Nine news|channel 9 news|Australia News|Australian News|Sydney News|Melbourne News|Latest news Australia|Indonesia plane crash|Indonesia plane missing|Indonesia flight missing|Boeing Indonesia crash|737 Indonesia crash|737 Indonesia|Boeing 737|missing 737 Indonesia|plane crash in Indonesia|Java Sea|Jakarta|Sriwijaya Air Flight 182|62 people missing","207383","1779","70","0","https://i.ytimg.com/vi/eYePkqzxGnM/default.jpg","True","False","A massive search is underway for the wreckage of an Indonesian passenger jet which crashed into the sea just minutes after taking off. Subscribe: https://bit.ly/2noaGhv Get more breaking news at: https://bit.ly/2nobVgFJoin 9News for the latest in news and events that affect you in your local city, as well as news from across Australia and the world.Follow 9News on Facebook: https://www.facebook.com/9News/Follow 9News on Twitter: https://twitter.com/9NewsAUSFollow 9News on Instagram: https://www.instagram.com/9news/#9News #BreakingNews #NineNewsAustralia #9NewsAUS"
"N18gJ43MX0I","Bhoomi | Sneak Peek | Jayam Ravi |  Streaming From January 14","2021-01-11T13:30:18Z","UCwGz96rLr3AEQ62k-YTpuzA","DisneyPlus Hotstar VIP","24","21.13.01","Bhoomi|Bhoomi On Pongal|Tamil Film|Pongal|Pongal Film|Niddhi Aggerwal|Hotstar|Hotstar VIP|Multiplex|Hotstar Multiplex|Multiplex Film|Bhoomi On Multiplex|Jayam Ravi film|Jayam Ravi|Bhoomi Sneak Peek|Sneak Peek|Bhoomi Clip","1016078","70221","563","2176","https://i.ytimg.com/vi/N18gJ43MX0I/default.jpg","False","False","A glimpse into the life of a scientist, a farmer and a fighter. #BhoomiSneakPeek"
"25s3KXEAbH8","Respondent: Christine Dacera was still breathing at 10 am, no more pulse at 12 nn | ANC","2021-01-08T02:47:15Z","UCvi6hEzLM-Z_unKPSuuzKvg","ANC 24/7","25","21.13.01","ANC|ABSCBN News Channel|Philippine News|ANC Alerts|ANC 24/7|ANC 24-7|ANC 247|ABS-CBN|ABS-CBN News|ABS-CBN Philippines|latest news|breaking news|trending news|January 8 2021|20210108news|YT0psJonah|Dacera|Dacera rape slay|Gregorio de Guzman|Dacera suspects|Makati rape slay|Makati hotel|flight attendant|flight attendant rape slay|Rommel Galido|Valentine Rosales|John Reyes dela Serna|Clark Rapinan|Christine Dacera investigation|Christine Dacera Case","2104063","13857","1421","4667","https://i.ytimg.com/vi/25s3KXEAbH8/default.jpg","False","False","The respondents in Christine Dacera's case claim there was no foul play in the 23-year-old flight attendant's death. Rommel Galido recalls Christine was still breathing at 10 am, but became purplish and no longer had a pulse by 12 nn.For more ANC news videos, click the link below:https://www.youtube.com/playlist?list=PLm34qRgqWBU4Mvq4BSrOawikENaFf38wnTo watch Headstart videos, click the link below:http://bit.ly/ANC_HeadstartTo watch The World Tonight videos, click the link below:http://bit.ly/ANC_TheWorldTonightSubscribe to ANC YouTube channel! Click here: http://bit.ly/ANC24-7Visit our website at https://news.abs-cbn.com/ancFacebook: https://www.facebook.com/ancalertsTwitter: https://twitter.com/ancalerts#ANCHighlights#Headstart#ChristineDacera"
"QEMVx1_Ty9c","Kepala Basarnas: Ditemukan 17 Kantong Jenazah dan 16 Potongan  Besar Pesawat","2021-01-10T23:51:29Z","UCKII0Ml9S5wneKbHswmUrIQ","CNN Indonesia","25","21.13.01","Indonesia|cnn indonesia|berita|berita terbaru|trans tv|trans7|berita terakhir|terakhir|cnn|Berita Viral|Viral|transmedia|JICT|basarnas|update pencarian|jakarta|pesawat sriwijaya sj 182","1956237","16792","637","1232","https://i.ytimg.com/vi/QEMVx1_Ty9c/default.jpg","False","False","Live streaming 24 jam: https://www.cnnindonesia.com/tvLive bersama Kepala Basarnas Marsekal Madya Bagus Puruhito pukul 9 malam, perihal update hasil hari kedua pencarian puing dan korban jatuhnya pesawat dengan nomor registrasi PK CLC. Target operasi hari ketiga masih pencarian puing, korban, dan juga black box yang sudah ditemukan sinyal keberadaannya. Ikuti berita terbaru di tahun 2020 dengan kemasan internasional berbahasa Indonesia, dan jangan ketinggalan breaking news dengan berita terakhir dan live report CNN Indonesia di https://www.cnnindonesia.com/tv dan channel CNN Indonesia di Transvision. CNN Indonesia tergabung dalam grup Transmedia. Dalam Transmedia, tergabung juga Trans TV, Trans7, Detikcom, Transvision, CNN Indonesia.com dan CNBC Indonesia. Follow & Mention Twitter kami:@myTranstweet@cnniddaily@cnnidconnected @cnnidinsight @cnnindonesia Like & Follow Facebook:CNN IndonesiaFollow IG: cnnindonesiatv"
"gGrlYHQ1hZg","李香琴逝世原因曝光，曾被2家醫院拒收，生前女兒孝順有福氣#娛記太太","2021-01-05T02:45:21Z","UCnY3kA42_MF1z-Kh47xSVdw","娛記太太","24","21.13.01","娛樂|娛記太太","276444","1457","189","47","https://i.ytimg.com/vi/gGrlYHQ1hZg/default.jpg","False","False","歡迎訂閱預計太太，簡單看娛樂，開心每一天！歡迎觀看我們近期的精彩視頻同父同母不同命，林青霞親姐姐近況，住50平舊房領450退休金，不願接受妹妹資助原因曝光https://youtu.be/KscRlYOEpXk65歲的甄妮近照曝光，丈夫去世4年後生一女，女兒身世令人震驚，甄妮單身35年內幕使人感嘆https://youtu.be/4bOB606yTKs郭嘉文真面藏不住了，崩潰發文5年人設終崩塌，公公李嘉誠曝梁洛施豪門真實地位https://youtu.be/o5bRRtdQt1s莫可欣終於不忍了！自曝結婚12年矛盾重重，最醜港姐奉子成婚，丈夫真實態度終明了https://youtu.be/ENcG6RLIfOs邵氏頭牌凌波！17歲遇人不淑，27歲再嫁「窮小子」，攜手走過54年，恭喜！https://youtu.be/ywq4zGr-4xc不再隱瞞！朱玲玲真實身份曝光，一生二度嫁豪門，今61歲近照曝光令人感嘆https://youtu.be/pviIAsA7lJI現世報！打跑2個老婆，終被小30歲嬌妻奪半數家產狠甩，現68歲賣房養9歲兒https://youtu.be/id2lGmKBwyM隱瞞三十年，曾華倩與梁朝偉內幕曝光，曾華倩為子終身不嫁，可憐天下父母心https://youtu.be/8flpG6lthoc李澤楷宣布大婚？新娘竟是她？與梁洛施隔空喊話，梁洛施曝光照片回應真相https://youtu.be/Vx-jwa6tEHE李晨媽媽曝光範冰冰人品，離婚內幕原來是這樣！李晨公布一切真相https://youtu.be/XjK6q0LCOOo"
"8PbhGt8XxSM","Ruination | Season 2021 Cinematic - League of Legends","2021-01-08T16:00:06Z","UC2t5bjwHdUX4vM2g8TRDq5g","League of Legends","20","21.13.01","Riot Games|Riot|League of Legends|League|LoL|MOBA|Season start|season 2021|cinematic|ruined king|ruination|viego|animation|senna|lucian|shadow isles|runeterra|lore|video|league of legends|league|noxus|samira|darius|karma|poppy|vayne|black mist","3551840","175703","2476","11460","https://i.ytimg.com/vi/8PbhGt8XxSM/default.jpg","False","False","A king returns. All he touches turns to ruin.Video created in partnership with Digic Pictures.League of Legends Sign Up & Downloadhttps://signup.leagueoflegends.com/"
"XcDTlvMpWcs","venkatesh bhat makes sakkarai pongal | sweet pongal","2021-01-12T08:00:17Z","UC_exm4hbJ2zV-4SrqrL9IRw","Venkatesh Bhat's Idhayam Thotta Samayal","22","21.13.01","venkatesh bhat|Venkatesh bhat|Venkatesh Bhat's|venkatesh bhat's|vegetarian|south indian|recipe|in tamil|samayal|chef|pongal|how to|make|prepare|do|in Tamil|sweet|sakkarai","798733","25194","911","2050","https://i.ytimg.com/vi/XcDTlvMpWcs/default.jpg","False","False","Follow Venkatesh Bhat:Instagram: http://www.instagram.com/chefvenkateshbhatfacebook: http://www.facebook.com/chefVenkateshBhatDISCLAIMER : THE INGREDIENTS USED ARE OF CHEF'S CHOICE ,VIEWERS DISCRETION SOLICITED."
"l9y2Phvj3Ts","🔥裴洛西急彈劾川普有因？丟失筆電在特種部隊手中｜蓬佩奧出手 痛打中共！｜歐威爾《1984》在美國？｜美國大選世紀風雲 特別報導 【2021年1月11日】｜新唐人亞太電視","2021-01-11T06:13:03Z","UCi4AGjvmSMB9Nn6oyFPYPeQ","新唐人亞太電視台NTDAPTV","25","21.13.01","[none]","457042","9652","379","732","https://i.ytimg.com/vi/l9y2Phvj3Ts/default.jpg","False","False","⚡緊急通知⚡因應社交媒體訊息審查、封鎖、降觸及，請大家盡快加入以下平台，持續接收最新最真實的報導💪  📍 官網 ➡ https://www.ntdtv.com.tw/   📍 LBRY➡ http://bit.ly/3npw2UL📍 MeWe➡ http://bit.ly/2KIor6G   📍 Parler➡ http://bit.ly/2LA1kuP 📍 telegram➡ https://t.me/ntdaptv 📍 FB➡ http://bit.ly/2ITZwJp 📍 LINE社群➡ https://bit.ly/37PvMZphttps://www.ntdtv.com.tw/b5/20210111/video/286993.html首播: 周一至周五 pm 2：30 ~ 2：45=================================⭐️ 新唐人亞太電視YouTube 24小時直播 👉 http://www.youtube.com/c/NTDAPTV"
"2TSTHRpnsYw","Video Penampakan Bawah Laut Tempat Jatuhnya Pesawat Sriwijaya Air","2021-01-10T12:15:01Z","UCqLsfkQSM0yfyGvONAGWd3Q","BeritaSatu","25","21.13.01","BeritaSatu|Berita Terkini|Berita Viral|Pesawat|Sriwijaya Air|SJ-182|Kepulauan Seribu|Breaking News|Sriwijaya|SJY-182|Jakarta-Pontianak|Pesawat Sriwijaya|Basarnas|TNI AL","2958016","20826","1255","1452","https://i.ytimg.com/vi/2TSTHRpnsYw/default.jpg","False","False","Hasil penyelaman dari Dinas Penyelam Bawah Air Koarmada Satu menemukan serpihan pesawat yang berserakan di titik koordinat tempat jatuhnya Sriwijaya Air SJ-182. Tampilan visual penyelaman ini diunggah di akun instagram Koarmada Satu.#Penyelaman #SJ182 #SriwijayaAirKunjungi juga social media channel kami :Official Website: http://beritasatu.comTwitter : https://twitter.com/BeritasatuFacebook : https://www.facebook.com/beritasatu/Instagram : https://www.instagram.com/beritasatu/"
"7wn2HPi_SUw","18年前的大尺度剧情片！性感美女OL与老板在办公室各种“啪啪啪”！有事秘书干，没事干秘书！|尬聊电影解说/几分钟看电影","2021-01-10T05:00:01Z","UCg_p__Tejb9h3ESxWUfbYxQ","尬聊电影","1","21.13.01","movie|x分钟看电影|三分鐘睇電影|三分钟看电影|五分钟看完电影|人妻|人性|伦理|伦理片|偷情|催泪片|八卦|几分钟看完|几分钟看完电影|几分钟看电影|几分钟说电影|出軌|出轨|剧情片|励志|十分钟看电影|原创|喜剧|喜剧片|喜劇電影|奇幻|奇幻片|女神|婚外情|家庭|小三|小姐姐|少女|尬聊电影|帅哥|幾分鐘看電影|幾分鐘睇電影|幾分鐘電影|影视解说|影评|悬疑|情慾|感情|推理|搞笑|日剧|日本电影|模特|浓缩|激情|爆笑电影|爱情|爱情片|犯罪|玩弄|电影|电影剪辑|电影解说|电影解读|电影评论|男神|神速完劇|經典|经典电影|美女|誘惑|超模|长腿|電影|電影解說|韩国电影|科幻电影|科技|科幻片|灾难片|灾难电影|特效|特技|惊悚","496661","1681","124","75","https://i.ytimg.com/vi/7wn2HPi_SUw/default.jpg","False","False","#电影解说#電影解說#电影推荐#几分钟看电影尷尷尬尬說故事，輕輕鬆松聊電影！我是一名尷尬的電影解說，歡迎訂閱我的頻道！频道首页有更多精彩内容哦：https://www.youtube.com/channel/UCg_p__Tejb9h3ESxWUfbYxQ也可以關注我的Twitter與我互動哦！推特首頁:https://twitter.com/glmovie2019"
"AW0eHUT-MCI","[제35회 골든디스크] 트와이스 - 'CRY FOR ME' + 'MORE & MORE'♪｜JTBC 210110 방송","2021-01-10T08:51:27Z","UCesY-UN9tgibpFJ-lw3y_1A","Golden Disc Awards","24","21.13.01","골든디스크어워즈|골든디스크시상식|골든|골디|디스크|jtbc|음악|음반|노래|시상식|특집프로그램|특집|제35회골든디스크어워즈|제35회골든디스크어워즈큐라프록스|음반부문|트와이스|TWICE|무대|아이돌|걸그룹|국내|댄스","1099106","104341","2033","7293","https://i.ytimg.com/vi/AW0eHUT-MCI/default.jpg","False","False","#제35회골든디스크어워즈 #트와이스 #TWICE■ 제35회 골든디스크어워즈 with 큐라프록스 음반 부문트와이스 - 'INTRO + CRY FOR ME'♬ + 'INTRO + MORE & MORE'♪"
"aHmTzFnymOM","Pro-Trump mob storms U.S. Capitol","2021-01-07T05:25:07Z","UCKjU3KzdbJE1EFcHVqXC3_g","CBC News: The National","25","21.13.01","capitol hill|trump supporters|siege on capitol hill|washington|washington protest|washington riot|pro-trump rally|trump supporters washington|pro-trump riots|trump biden|trump twitter|congress|CBC|The National|Katie Simpson|Susan Ormiston","1199557","7672","2073","0","https://i.ytimg.com/vi/aHmTzFnymOM/default.jpg","True","False","An angry mob of U.S. President Donald Trump’s supporters stormed into the U.S. Capitol Building as Congress was preparing to certify the results of November’s election after Trump repeatedly said the election was rigged against him. Watch The National live on YouTube Sunday-Friday at 9 p.m. ETSubscribe to The National: https://www.youtube.com/user/CBCTheNational?sub_confirmation=1Connect with The National online:Facebook | https://www.facebook.com/thenationalTwitter | https://twitter.com/CBCTheNationalInstagram | https://www.instagram.com/cbcthenationalMore from CBC News | https://www.cbc.ca/newsThe National is CBC's flagship nightly news program, featuring the day's top stories with in-depth and original journalism, with hosts Adrienne Arsenault and Andrew Chang in Toronto, Ian Hanomansing in Vancouver and the CBC's chief political correspondent, Rosemary Barton in Ottawa."
"SKIF9s_kv_o","James Corden Is Hopeful on a Dark Day in the U.S.","2021-01-07T04:40:01Z","UCJ0uqCI0Vqr2Rrt1HseGirg","The Late Late Show with James Corden","24","21.13.01","The Late Late Show|Late Late Show|James Corden|Corden|late night|late night show|comedy|comedian|celebrity|celeb|celebrities|CBS|joke|jokes|funny|funny videos|funny video|humor|hollywood|famous","1437106","43038","1191","5081","https://i.ytimg.com/vi/SKIF9s_kv_o/default.jpg","False","False","James Corden begins The Late Late Show reflecting on what was a dark day at the United States Capitol, but sees hope on the horizon. After, he looks at Rev. Raphael Warnock and Jon Ossoff's victories in the Georgia Senate run-off election.More Late Late Show:Subscribe: http://bit.ly/CordenYouTubeWatch Full Episodes: http://bit.ly/1ENyPw4Facebook: http://on.fb.me/19PIHLCTwitter: http://bit.ly/1Iv0q6kInstagram: http://bit.ly/latelategramWatch The Late Late Show with James Corden weeknights at 12:35 AM ET/11:35 PM CT. Only on CBS.Get new episodes of shows you love across devices the next day, stream live TV, and watch full seasons of CBS fan favorites anytime, anywhere with CBS All Access. Try it free! http://bit.ly/1OQA29B---Each week night, THE LATE LATE SHOW with JAMES CORDEN throws the ultimate late night after party with a mix of celebrity guests, edgy musical acts, games and sketches. Corden differentiates his show by offering viewers a peek behind-the-scenes into the green room, bringing all of his guests out at once and lending his musical and acting talents to various sketches. Additionally, bandleader Reggie Watts and the house band provide original, improvised music throughout the show. Since Corden took the reigns as host in March 2015, he has quickly become known for generating buzzworthy viral videos, such as Carpool Karaoke."
"YVDJqipoohc","Jordan Klepper Sees It All at The Capitol Insurrection | The Daily Social Distancing Show","2021-01-12T20:31:40Z","UCwWhs_6x42TyRM4Wstoq8HA","The Daily Show with Trevor Noah","23","21.13.01","the daily show|trevor noah|daily show with trevor noah|the daily show episodes|comedy central|comedians|comedian|funny video|comedy videos|funny clips|noah trevor|trevor noah latest episode|daily show|trevor|news|politics|daily show trump|trevor noah trump|trump|coronavirus|jordan klepper|trump rally|donald trump|klepper fingers the pulse|joe biden|election|vote|2020 election|maga|protest|conspiracies|capitol|coup|coup d'etat|insurrection|washington|DC","3046975","102373","1928","12812","https://i.ytimg.com/vi/YVDJqipoohc/default.jpg","False","False","Pitchforks, Proud Boys, and a one-man “Tyranny Response Team.” Jordan Klepper saw it all at the Capitol insurrection. #DailyShow #JordanKlepper #CapitolSubscribe to The Daily Show:https://www.youtube.com/channel/UCwWhs_6x42TyRM4Wstoq8HA/?sub_confirmation=1 Follow The Daily Show:Twitter: https://twitter.com/TheDailyShowFacebook: https://www.facebook.com/thedailyshowInstagram: https://www.instagram.com/thedailyshowWatch full episodes of The Daily Show for free: http://www.cc.com/shows/the-daily-show-with-trevor-noah/full-episodesFollow Comedy Central:Twitter: https://twitter.com/ComedyCentralFacebook: https://www.facebook.com/ComedyCentralInstagram: https://www.instagram.com/comedycentralAbout The Daily Show:Trevor Noah and The Daily Show correspondents tackle the biggest stories in news, politics and pop culture.The Daily Show with Trevor Noah airs weeknights at 11/10c on Comedy Central."
